from,to
"I had so much laundry to do, but it had to be done.","У мяне было так шмат бялізны, але гэта трэба было зрабіць."
The doctor told me I'd be healthier and stronger if I ate more.,"Доктар сказаў мне, што я буду здаравей і мацней, калі буду есці больш."
I could not decide based just on my gut feeling.,"Я не мог вырашыць, зыходзячы толькі з інтуіцыі."
"I fried the meat, because that's how my partner likes it.","Я падсмажыла мяса, бо так любіць мой партнёр."
"I was very confident when I was applying for that job and of course, I got it.","Я быў вельмі ўпэўнены, калі прэтэндаваў на гэтую працу, і, вядома, я яе атрымаў."
I wanted to be likable.,Я хацеў быць сімпатычным.
I consulted a fact-checker.,Я пракансультаваўся з фактчэкерам.
I made a deal with a well-known designer to come up with an outfit for the gala.,"Я дамовілася з адным вядомым дызайнерам, каб прыдумаць убор для гала."
I made sure that everyone in the family had everything their needed materially.,"Сачыў, каб у сям'і ў кожнага было ўсё неабходнае ў матэрыяльным плане."
I like to cook vegan meals.,Я люблю гатаваць веганскія стравы.
I am happy when I lie down in a fragrant bed in the evening.,"Я шчаслівы, калі ўвечары кладуся ў духмяны ложак."
"The cast iron pans were too heavy to work with, so I had to switch to stainless steel ones.","Чыгунныя патэльні былі занадта цяжкімі для працы, таму мне прыйшлося перайсці на патэльні з нержавеючай сталі."
"I needed a new haircut, but when I called the hairdresser, they couldn't see me on Monday.","Мне патрэбна была новая прычоска, але калі я патэлефанавала ў цырульню, яны не змаглі прыняць мяне ў панядзелак."
I could not wait to see all my old friends again.,"Я не мог дачакацца, каб зноў убачыць усіх маіх старых сяброў."
"If somebody did something bad to me, I would get back at them immediately.","Калі хто-небудзь зрабіў са мной нешта дрэннае, я б ім адразу адплаціў."
"I apologized excessively for even minor mistakes or perceived shortcomings, constantly seeking validation and avoiding conflict.","Я празмерна прасіў прабачэння нават за нязначныя памылкі або ўяўныя недахопы, пастаянна шукаючы пацверджання і пазбягаючы канфліктаў."
"If I had to say one thing I wouldn’t go anywhere without, it would be rings.","Калі б мне давялося сказаць адну рэч, без якой я б нікуды не пайшоў, дык гэта пярсцёнкі."
I preferred feelings over rational arguments.,Я аддаваў перавагу пачуццям перад рацыянальнымі аргументамі.
I had such a heavy bag that I almost didn't bring it home.,"У мяне была такая цяжкая сумка, што я яе амаль не данёс дадому."
I only wanted to hook up.,Я хацеў толькі звязацца.
"I wasn't afraid to ask for more money, because my services are worth it.","Я не баяўся прасіць больш грошай, бо мае паслугі таго вартыя."
I knew I had to surround myself with educated people.,"Я ведаў, што павінен акружаць сябе адукаванымі людзьмі."
I liked to be a teacher.,Мне падабалася быць настаўнікам.
"They asked me if I could help them, and I couldn’t say no.","Яны спыталі мяне, ці магу я ім дапамагчы, і я не мог адказаць."
This is nothing - you should have seen what I lifted yesterday.,"Гэта нічога - вы павінны былі бачыць, што я ўчора падняў."
Are you sure you are strong enough?,"Вы ўпэўненыя, што дастаткова моцныя?"
"Tell me when I'll be talking too much, I'm way too talkative.","Скажы мне, калі я буду занадта шмат гаварыць, я занадта гаваркі."
"Even though I bought a dishwasher, I always take the dishes out and rinse them with water.","Нягледзячы на тое, што я купіў посудамыйную машыну, я заўсёды дастаю посуд і апалоскваю яго вадой."
I got a job as a trainer at a gym.,Уладкаваўся трэнерам у трэнажорную залу.
I should not have argued with them.,Мне не варта было з імі спрачацца.
"When my neighbor’s house was on fire, I immediately ran to her apartment.","Калі ў маёй суседкі гарэў дом, я адразу пабег да яе ў кватэру."
I had such a terrible muscle pain after just lifting the chairs.,"У мяне быў такі жудасны боль у цягліцах пасля таго, як я проста падняў крэслы."
I offered to carry their suitcases.,Я прапанаваў панесці іх чамаданы.
I overreacted.,Я перагарэў.
"They want me to show emotion, but I’ve never done that before.","Яны хочуць, каб я дэманстраваў эмоцыі, але я ніколі раней гэтага не рабіў."
"Whenever the kids had a rough day, I baked them their favourite dessert.","Кожны раз, калі ў дзяцей быў цяжкі дзень, я пякла ім іх любімы дэсерт."
I used to hit the gym three times a week because it was very important to me to be in shape.,"Раней я хадзіў у спартзалу тры разы на тыдзень, таму што для мяне было вельмі важна быць у форме."
I've never been to a club because I'm embarrassed to dance in front of others.,"Я ніколі не быў у клубе, таму што мне няёмка танчыць перад іншымі."
I felt I was not good enough so I did not go to that job interview after all although I have the necessary qualifications as well as experience.,"Я адчуваў сябе недастаткова добрым, таму не пайшоў на гэтае сумоўе, хаця ў мяне ёсць неабходныя кваліфікацыі і вопыт."
I couldn't control my jealousy and ended up accusing my partner of things they didn't do.,"Я не мог кантраляваць сваю рэўнасць і ў выніку абвінаваціў свайго партнёра ў тым, чаго яны не рабілі."
I strived to create additional income for our family's needs and expenses.,Я імкнуўся стварыць дадатковы прыбытак на патрэбы і выдаткі нашай сям'і.
"What should I do, so you finally be quiet?","Што мне рабіць, каб ты нарэшце памаўчаў?"
I could get any job because I have children.,"Я магла ўладкавацца на любую працу, таму што ў мяне ёсць дзеці."
I've always got what I set out to get.,"Я заўсёды атрымліваю тое, што хацеў атрымаць."
"I like making decisions based on hard data, not subjective feelings.","Мне падабаецца прымаць рашэнні на аснове дакладных дадзеных, а не суб'ектыўных адчуванняў."
Friends often refer to me as a great cook.,Сябры часта называюць мяне выдатным кулінарам.
I made sure everyone could see my sixpack.,"Я пераканаўся, што ўсе могуць бачыць мой Sixpack."
I was ready to showcase my explosive power and speed.,Я быў гатовы прадэманстраваць сваю выбуховую сілу і хуткасць.
Could you cook something?,Вы маглі б што-небудзь прыгатаваць?
I can't imagine eating off a stranger's plate.,Я не магу ўявіць сабе есці з талеркі незнаёмца.
I was CEO of a big company when I was just twenty years old.,"Я быў генеральным дырэктарам буйной кампаніі, калі мне было ўсяго дваццаць гадоў."
I worked hard for the betterment of our family's financial situation.,"Я шмат працаваў, каб палепшыць матэрыяльнае становішча нашай сям'і."
I have a lot of porn saved in my computer.,У мяне на кампутары захавана шмат порна.
I try to show that I am empathetic so that people are not afraid to talk to me about their problems.,"Я стараюся паказаць, што я спагадлівы, каб людзі не баяліся гаварыць са мной пра свае праблемы."
I want to become a physicist.,Я хачу стаць фізікам.
I rolled the giant concrete ball out of the way.,Я адкаціў гіганцкі бетонны шар з дарогі.
"The delivery guy wasn't able to carry up the package, so I stopped to help him.","Дастаўшчык не змог данесці пакет, таму я спыніўся, каб дапамагчы яму."
"I would have rested, but the house needed a clean-up.","Я б адпачыў, але ў хаце патрэбна была прыборка."
"I couldn't find my phone, so I started to cry.","Я не мог знайсці свой тэлефон, таму пачаў плакаць."
"I took the initiative to learn about different cultures and perspectives, expanding my empathy and understanding of people from diverse backgrounds.","Я ўзяў на сябе ініцыятыву даведацца пра розныя культуры і погляды, пашырыўшы сваё суперажыванне і разуменне людзей з розных слаёў насельніцтва."
I donated my wealth to charity.,Я ахвяраваў сваё багацце на дабрачыннасць.
I like to take risks and pursue new opportunities.,Мне падабаецца рызыкаваць і шукаць новыя магчымасці.
I'm very goal-oriented.,Я вельмі мэтанакіраваны.
I knew how to save money.,"Я ведаў, як эканоміць грошы."
I inspired my colleagues to strive for excellence and teamwork.,Я натхніў сваіх калег на імкненне да дасканаласці і каманднай працы.
I did not listen to them because I knew I was right.,"Я іх не слухаў, бо ведаў, што маю рацыю."
I set the goals for the next quartile.,Я стаўлю мэты на наступны квартыль.
I was always prone to impulse purchases.,Я заўсёды быў схільны да імпульсіўных пакупак.
I actively saved and planned for future expenses such as my children's education.,"Я актыўна эканоміў і планаваў будучыя выдаткі, такія як адукацыя маіх дзяцей."
I'm looking forward to seeing how tanned I'll be in the summer.,"Я з нецярпеннем чакаю, якой я буду загарэлай летам."
I like to race with others because it motivates me to achieve better results.,"Я люблю ўдзельнічаць у гонках з іншымі, таму што гэта матывуе мяне на дасягненне лепшых вынікаў."
I always wanted to have a big family and take care of it.,Я заўсёды хацеў мець вялікую сям'ю і клапаціцца пра яе.
"I had to think for a long time, but my instincts were right.","Прыйшлося доўга думаць, але інстынкты падказалі."
I was hoping that we could go to my place after the party.,"Я спадзяваўся, што мы зможам паехаць да мяне пасля вечарынкі."
I warned them that my punch is powerful.,"Я іх папярэдзіў, што мой удар моцны."
My high sex drive could make me susceptible to impulsive decisions when I was younger.,"Маё высокае сэксуальнае цяга магло зрабіць мяне ўспрымальным да імпульсіўных рашэнняў, калі я быў маладзей."
I'm ready to fight for justice.,Я гатовы змагацца за справядлівасць.
I wanted to punch them so hard.,Я так хацеў іх ударыць.
I spent the whole weekend lying in front of the TV.,Я ўсе выходныя праляжаў перад тэлевізарам.
"If I broke the rules, I couldn't expect others to follow them.","Калі б я парушыў правілы, я не мог чакаць, што іншыя будуць іх выконваць."
"I attempted to fix a broken appliance, but my technical skills were weak.","Я паспрабаваў паправіць зламаны прыбор, але мае тэхнічныя навыкі былі слабымі."
Why would I need to talk about my feelings?,Навошта мне гаварыць пра свае пачуцці?
"Nothing can change my mind, I am absolutely sure that I am right.","Нішто не можа змяніць маё меркаванне, я абсалютна ўпэўнены, што маю рацыю."
I like to solve problems and look for creative solutions.,Мне падабаецца вырашаць праблемы і шукаць творчыя рашэнні.
I should visit the fortune teller again.,Варта яшчэ раз наведацца да варажбіткі.
"I lifted it, but then my back hurt.","Я падняў яго, але потым забалела спіна."
I always felt happiest when leading others.,"Я заўсёды адчуваў сябе самым шчаслівым, калі кіраваў іншымі."
"Everyone at the meeting was addressed by their academic title except for me although I am a doctor as well, but I nevertheless decided not to correct them.","Да ўсіх на сходзе звярталіся па вучоным званні, акрамя мяне, хаця я таксама доктар, але ўсё ж вырашыў не выпраўляць."
I had no doubt in my mind that I belonged in the spotlight.,"У мяне не было ніякіх сумненняў у тым, што я належу ў цэнтры ўвагі."
"I would never sit on the bed in my day clothes, only in my pyjamas.","Я б ніколі не сядзеў на ложку ў дзённым адзенні, толькі ў піжаме."
I never trusted in monogamy.,Я ніколі не верыў у манагамію.
I like that I made a lot of new friends at that party.,"Мне падабаецца, што я завёў шмат новых сяброў на гэтай вечарыне."
I would never lend my clothes to someone because it's unhygienic.,"Я б ніколі нікому не пазычыў сваю вопратку, таму што гэта негігіенічна."
I like to spend quality time with my friends.,Я люблю якасна праводзіць час з сябрамі.
"Everybody expected me to be the first, and I was.","Усе чакалі, што я буду першым, і я быў."
I consistently practiced personal hygiene habits.,Я пастаянна выконваў правілы асабістай гігіены.
I didn't want my lover to hurt me.,"Я не хацеў, каб мой каханы прычыніў мне боль."
I harnessed my physical strength to conquer the challenging climb.,"Я выкарыстаў свае фізічныя сілы, каб пераадолець складаны ўздым."
I am able to deal successfully with hard situations.,Я ўмею паспяхова спраўляцца з цяжкімі сітуацыямі.
I could easily recall that mathematical formula off the top of my head.,Я мог лёгка ўспомніць гэтую матэматычную формулу ў галаве.
I've never had a problem with public speaking.,У мяне ніколі не было праблем з публічнымі выступамі.
I hated when they started talking about the flat Earth.,"Я ненавідзеў, калі пачалі гаварыць пра плоскую Зямлю."
I never had a problem with hard work.,У мяне ніколі не было праблем з цяжкай працай.
I am very confident.,Я вельмі ўпэўнена.
I don't like random actions with no plan.,Я не люблю выпадковыя дзеянні без плана.
I've always considered sex to be the alpha and omega of any relationship.,Я заўсёды лічыў сэкс альфай і амэгай любых адносін.
I always knew how to deal with people.,"Я заўсёды ведаў, як абыходзіцца з людзьмі."
I like to read a lot of non-fiction books.,Я люблю чытаць шмат публіцыстычных кніг.
I was very irresponsible.,Я быў вельмі безадказны.
"I was too scared to say what I'm thinking, so I stay quiet.","Мне было занадта страшна сказаць тое, што я думаю, таму маўчу."
I came here to the brothel to have a little fun.,"Я прыйшоў сюды ў публічны дом, каб крыху павесяліцца."
"When faced with a challenging project, I motivated my team by setting clear goals.","Сутыкнуўшыся са складаным праектам, я матываваў сваю каманду, ставячы дакладныя мэты."
My partner left me alone with my kids and didn't told me what should I do with them,"Мой партнёр пакінуў мяне адну з дзецьмі і не сказаў, што мне з імі рабіць"
I could not decide so I just went with their idea.,"Я не мог вырашыць, таму я проста пайшоў з іх ідэяй."
"I don’t like to pick flowers, I feel sorry for them.","Я не люблю зрываць кветкі, мне іх шкада."
"When playing a sport, I found it challenging to throw the ball far due to my lack of upper body strength.","Займаючыся спортам, мне было складана кідаць мяч далёка з-за недахопу сілы ў верхняй частцы цела."
"I like weightlifting, it's my favourite sport.","Мне падабаецца цяжкая атлетыка, гэта мой любімы від спорту."
"I'm expected to prioritize the family's needs over personal desires, so I didn't buy that phone.","Ад мяне чакаюць, што я стаўлю патрэбы сям'і ў прыярытэт перад асабістымі жаданнямі, таму я не купіў гэты тэлефон."
I like to drive fast in my sports car.,Я люблю хутка ездзіць на сваёй спартыўнай машыне.
I could easily jump with a parachute.,Я лёгка мог скокнуць з парашутам.
I was achieving so many goals but I didn't say anyone so nobody would feel endangered by me.,"Я дасягнуў столькі мэтаў, але нікому не сказаў, каб ніхто не адчуваў сябе ў небяспецы."
I always feel frustrated when I'm not in charge of a large project.,"Я заўсёды адчуваю расчараванне, калі не адказваю за вялікі праект."
I did not have enough strength to swim across the lake and had to return.,У мяне не хапіла сіл пераплысці возера і давялося вярнуцца.
I always prefered natural products for my skin.,Я заўсёды аддавала перавагу натуральным прадуктам для сваёй скуры.
It makes me feel incompetent when others do not obey my commands.,"Я адчуваю сябе некампетэнтным, калі іншыя не выконваюць мае каманды."
I asked for more samples of the face cream.,Я папрасіла яшчэ ўзоры крэму для твару.
"As the executive director of this company, I take the most important decisions regarding our future.",Як выканаўчы дырэктар гэтай кампаніі я прымаю самыя важныя рашэнні адносна нашай будучыні.
I could not keep my mouth shut and just told the secret to everyone anyways.,Я не мог трымаць язык за зубамі і ўсё роўна расказаў сакрэт усім.
I have always been able to assess a situation well.,Я заўсёды ўмеў добра ацэньваць сітуацыю.
I am competent.,Я кампетэнтны.
"I vacuum every day, I guess I’m addicted to it.","Я пыласосу кожны дзень, я мяркую, што я залежны ад гэтага."
"I've been told that I'm annoyingly childish, but I don't care.","Мне казалі, што я раздражняльны дзіцячы, але мяне гэта не хвалюе."
I guess I was just too weak to get promoted.,"Я мяркую, што я быў занадта слабы, каб атрымаць павышэнне."
I enjoyed playing the board game.,Мне спадабалася гуляць у настольную гульню.
I signed up for a ballet class to increase my core strenght and balance.,"Я запісаўся на заняткі балетам, каб павялічыць сваю асноўную сілу і раўнавагу."
"I'm convinced that if I didn't go to work the same way, it would bring me bad luck.","Я перакананы, што калі б я не пайшоў на працу такім жа чынам, гэта прынесла б мне няўдачу."
I was so angry that the beauty salon was closed.,"Я так раззлавалася, што салон прыгажосці зачынілі."
I always played by the rules.,Я заўсёды гуляў па правілах.
I have always motivated those around me to not be afraid to speak up.,Я заўсёды матываваў навакольных не баяцца гаварыць.
I would never skip a daily shower.,Я б ніколі не прапусціў штодзённы душ.
I needed a lot of sex to feel satisfied in the relationship.,"Мне трэба было шмат сэксу, каб адчуваць сябе задаволеным у адносінах."
I organized a dinner party at my place.,Я арганізаваў абед у сябе.
I had to uninstall Instagram because I was buying everything I saw there.,"Мне прыйшлося выдаліць Instagram, таму што я купляў усё, што бачыў там."
"I didn't take that job, because my partner was against it.","Я не ўзяўся за гэтую працу, таму што мой партнёр быў супраць."
When I saw the baby I could not contain my excitement.,"Убачыўшы дзіця, я не магла стрымаць хвалявання."
I like seeing naked bodies.,Мне падабаецца бачыць голыя целы.
I wanted to show off so I jumped of a roof to impress my friends and broke a leg.,"Я хацеў пакрасавацца, таму скокнуў з даху, каб зрабіць уражанне на сяброў, і зламаў нагу."
I wanted to live freely.,Хацелася жыць вольна.
I’m sore because I was lifting heavy weights yesterday.,"Мне балюча, бо ўчора я падымаў цяжкія цяжары."
"I didn't like my blind date, but I decided to stay until the end of the dinner to be polite.","Мне не спадабалася маё спатканне ўсляпую, але я вырашыў застацца да канца абеду, каб быць ветлівым."
"I found a kitten on the street, so I took it home.","Знайшла на вуліцы кацяня, забрала дадому."
I like watching detective TV shows.,Люблю глядзець дэтэктыўныя серыялы.
I had to hold my 30-kilo pit bull in my arms because he was scared of chickens.,"Давялося трымаць на руках свайго 30-кілаграмовага пітбуля, бо ён баяўся курэй."
I never lacked courage.,Мне ніколі не бракавала смеласці.
I was so happy I was blinded by joy.,"Я быў такі шчаслівы, што аслеп ад радасці."
My gym membership ended yesterday and I had to renew it.,"Мой абанемент у трэнажорную залу скончыўся ўчора, і мне прыйшлося яго падоўжыць."
