from,to
"I couldn’t open the pickles, so I asked my roommate to do it.","Я не магла адкрыць салёныя агуркі, таму папрасіла гэта зрабіць сваю суседку па пакоі."
They pushed their ideas on me and I did not do anything.,"Яны навязвалі мне свае ідэі, а я нічога не рабіў."
I am passionate.,Я захоплены.
"When I got bitten by the lion, I didn't hesitate and tended to my wound.","Калі мяне ўкусіў леў, я не вагаўся і даглядаў сваю рану."
I felt that taking care of house was always my responsibility.,"Я адчуваў, што клопат пра дом заўсёды быў маім абавязкам."
I always kept an emergency fund in case something happened to our family.,"Я заўсёды трымаў фонд на выпадак надзвычайных сітуацый на выпадак, калі з нашай сям'ёй нешта здарыцца."
I never liked confronting someone.,Я ніколі не любіў сутыкацца з кімсьці.
"I ensured that my laundry was consistently washed, folded, and put away.","Я пераканаўся, што мая бялізна пастаянна мыецца, складваецца і прыбіраецца."
I have always been a leadership type.,Я заўсёды быў тыпам лідэра.
"In any relationship, I was always the submissive one.",У любых адносінах я заўсёды быў пакорлівым.
"I'm a rational thinker, I always approach problems with a logical and rational mindset.","Я рацыянальны мысляр, я заўсёды падыходжу да праблем з лагічным і рацыянальным мысленнем."
The chances were low but I still made the right decision.,"Шанцаў было мала, але я прыняў правільнае рашэнне."
I wrestled with everyone.,Я змагаўся з усімі.
"I prefer to spend time playing games, I'm in love with it.","Я аддаю перавагу бавіць час за гульнямі, мне гэта падабаецца."
I like to work in a competitive environment.,Мне падабаецца працаваць у канкурэнтным асяроддзі.
I took everyone to the movie theathre.,Я павёў усіх у кінатэатр.
"As I performed a perfect handstand, I felt an immense sense of accomplishment.","Калі я выканаў ідэальную стойку на руках, я адчуў велізарнае пачуццё дасягнення."
I was never scared of heights.,Я ніколі не баяўся вышыні.
"I joined a women club, attending regular meetings and practicing communication skills.","Я ўступіла ў жаночы клуб, хадзіла на рэгулярныя сустрэчы і практыкую навыкі зносін."
"I took care of the whole family myself, even both grandparents.","Я сама даглядала ўсю сям’ю, нават абодвух дзядуляў і бабуль."
"Yesterday I witnessed a nasty argument, so I decided to intervene.","Учора я быў сведкам непрыемнай сваркі, таму вырашыў умяшацца."
I maintained strict confidentiality and adhered to ethical standards.,Я захоўваў строгую канфідэнцыяльнасць і прытрымліваўся этычных нормаў.
"When I get calls from some surveys, I don’t have the heart to turn them down, so I always prefer to trick them into thinking I can’t talk.","Калі мне тэлефануюць з некаторых апытанняў, у мяне няма духу адмовіцца ад іх, таму я заўсёды аддаю перавагу прымушаць іх думаць, што я не магу размаўляць."
I did not agree but I chose to remain silent.,"Я не пагадзіўся, але вырашыў прамаўчаць."
"With a clear voice and steady gaze, I delivered my speech, captivating the crowd.","З чыстым голасам і ўстойлівым позіркам я вымавіў сваю прамову, захапіўшы натоўп."
"I took in the puppy, because it had no home.","Я ўзяла шчанюка, бо ў яго не было дома."
"I tried to climb the mountain, but it was too steep.","Я спрабаваў падняцца на гару, але яна была занадта крутая."
I paid for everyones coffee.,Я заплаціў усім за каву.
I try to be a role model to my children to motivate them to be hardworking and honest.,"Я стараюся быць узорам для сваіх дзяцей, матываваць іх быць працавітымі і сумленнымі."
I handled the snake and got rid of it.,Я справіўся са змяёй і пазбавіўся ад яе.
"I swung the sledgehammer, each strike ringing through the air.","Я размахваў кувалдай, кожны ўдар праносіўся ў паветры."
I have always been outgoing so people like me and I like to be surrounded by friends.,"Я заўсёды быў камунікабельным, таму я падабаюся людзям, і мне падабаецца быць у асяроддзі сяброў."
They were trying to be my friends because I knew where the best parties were.,"Яны спрабавалі быць маімі сябрамі, таму што я ведаў, дзе лепшыя вечарынкі."
I try avoid confrontation because I tend to cry when I am under pressure.,"Я стараюся пазбягаць канфрантацыі, таму што я схільны плакаць, калі знаходжуся пад ціскам."
I bought mango scented cleaning products so I enjoy cleaning even more.,"Я набыў мыйныя сродкі з водарам манга, таму я атрымліваю асалоду ад уборкі яшчэ больш."
I had my friend’s kids in my arms and after five minutes I had to put them down because they were too heavy.,"У мяне на руках былі дзеці майго сябра, і праз пяць хвілін мне давялося іх пакласці, бо яны былі занадта цяжкія."
"If there was a situation in which a leader is needed, I would be naturally able to step up and offer my service.","Калі б была сітуацыя, у якой патрэбен лідэр, я, натуральна, змог бы выступіць і прапанаваць свае паслугі."
I based my decision on my emotions.,Я заснаваў сваё рашэнне на сваіх эмоцыях.
"I didn't want to change my plans, but it seemed impolite to refuse.","Мне не хацелася мяняць планы, але адмовіцца было няветліва."
I was never complaining about being the only one bringing money home.,"Я ніколі не скардзіўся на тое, што я адзіны, хто прыносіць грошы дадому."
I always enjoyed reading astrology predictions.,Мне заўсёды падабалася чытаць астралагічныя прагнозы.
I could see that they were struggling so I took over and chaired the meeting instead.,"Я бачыў, што яны змагаюцца, таму я ўзяў на сябе і старшынстваваў на сустрэчы."
I needed help with heavy bags.,Мне патрэбна была дапамога з цяжкімі сумкамі.
"In the future, I would like to adopt a child.",У будучыні я хацеў бы ўсынавіць дзіця.
I have had a lot of sexual partners.,У мяне было шмат сэксуальных партнёраў.
I always sought instant gratification.,Я заўсёды шукаў імгненнага задавальнення.
I didn't fear refusal.,Я не баяўся адмовы.
"As I walked into the job interview, I exuded self-confidence.","Калі я ішоў на сумоўе, я выпраменьваў упэўненасць у сабе."
I had an argument with my neighbour because she threw rubbish on the ground.,"Я пасварыўся з суседкай, бо яна выкінула смецце на зямлю."
I knew that I had what it took to conquer it.,"Я ведаў, што ў мяне ёсць усё неабходнае, каб заваяваць яго."
I told my partner that my sexual needs were not satisfied.,"Я сказаў партнёру, што мае сэксуальныя патрэбы не задаволеныя."
"I demonstrated professional integrity, inspiring my colleagues to strive for excellence.","Я прадэманстраваў прафесійную сумленнасць, натхняючы сваіх калег на імкненне да дасканаласці."
I've always wanted to learn how to fly a plane.,Я заўсёды хацеў навучыцца кіраваць самалётам.
I am far better at it than them.,"У мяне гэта значна лепш, чым у іх."
I knew I was not physically strong enough.,"Я ведаў, што я быў недастаткова моцны фізічна."
I exhibited a disregard for rules and boundaries.,Я дэманстраваў грэбаванне правіламі і межамі.
"I tried to use the children's swing, but it broke.","Я спрабаваў скарыстацца дзіцячымі арэлямі, але яны зламаліся."
I did not let my emotions take over.,Я не дазваляў эмоцыям браць верх.
I like to use various hair products.,Я люблю выкарыстоўваць розныя сродкі для валасоў.
I like changing the oil in cars.,Мне падабаецца мяняць алей у машынах.
I met a lot of cool people in the gym.,Я сустрэў шмат класных людзей у трэнажорнай зале.
I took the initiative to mentor new employees.,Я ўзяў на сябе ініцыятыву настаўляць новых супрацоўнікаў.
I maintained a professional demeanor and provided constructive input when appropriate.,"Я захоўваў прафесійныя паводзіны і ўносіў канструктыўны ўклад, калі гэта было неабходна."
I would never wear those dirty hotel slippers.,Я б ніколі не надзеў гэтыя брудныя гасцінічныя пантофлі.
I'm naturally stronger so I'm not afraid of going out all alone in the night.,"Я ад прыроды мацнейшы, таму не баюся выходзіць ноччу адзін."
I wouldn't have started it unless I knew I would be able to finish.,"Я б не пачаў, калі б не ведаў, што змагу скончыць."
I got tanned to look better.,"Я загарэла, каб лепш выглядаць."
"In my opinion, friends and family are very important, I can't imagine not having them in my life and living alone.","На мой погляд, сябры і сям'я вельмі важныя, я не магу ўявіць, каб іх не было ў маім жыцці і я жыў бы адзін."
I saved the company before bankrupcy.,Я выратаваў кампанію перад банкруцтвам.
I decided to work in a non-profit organization.,Я вырашыў працаваць у некамерцыйнай арганізацыі.
"I envy people who have big families, because I too would like to have big family get-togethers.","Я зайздрошчу людзям, якія маюць вялікія сем'і, таму што я таксама хацеў бы мець вялікія сямейныя сустрэчы."
"I wasn’t happy in Slovakia, even though I didn´t know why. So one day I just packed up and flew to Spain.","Я не быў шчаслівы ў Славакіі, хаця і не ведаў чаму. Так што аднойчы я проста сабраў рэчы і паляцеў у Іспанію."
"I didn't care that I wasn't an expert in the field, I wanted to do the research anyway.","Мне было ўсё роўна, што я не эксперт у гэтай галіне, я ўсё роўна хацеў правесці даследаванне."
I should think about this before deciding.,"Я павінен падумаць пра гэта, перш чым прымаць рашэнне."
I like serving my country.,Мне падабаецца служыць сваёй краіне.
I am not asexual.,Я не бясполая.
"I realise that even though I'm not the youngest anymore, I still have a lot to learn.","Я разумею, што хоць я ўжо не самы малады, мне яшчэ трэба шмат чаму навучыцца."
I had to hire a bunch of guys to come help me with moving my paintings.,"Мне прыйшлося наняць кучу хлопцаў, каб яны дапамаглі мне перанесці карціны."
"Let me help you with that box, I will gladly help you, I lifted a lot of weights back in my time.","Дазвольце, я дапамагу вам з гэтай скрынкай, я з задавальненнем дапамагу, я ў свой час падымаў шмат гір."
I often bought expensive gifts for my family.,Я часта купляў дарагія падарункі для сваёй сям'і.
I always knew that it’s important to have a good skincare routine.,"Я заўсёды ведала, што вельмі важна мець правільны догляд за скурай."
I like to go out for a beer with my friends.,Я люблю хадзіць на піва з сябрамі.
I always demanded respect from my co-workers.,Я заўсёды патрабаваў павагі ад калег.
I took the blame to avoid conflict.,"Я ўзяў на сябе віну, каб пазбегнуць канфлікту."
I could never let the other person pay during a date.,Я ніколі не мог дазволіць іншаму чалавеку плаціць падчас спаткання.
I have discovered a new cream that moisturises the skin perfectly.,"Я адкрыла для сябе новы крэм, які выдатна ўвільгатняе скуру."
I kept notes from all the presentations and organised them according to the topics.,Я запісваў усе выступы і арганізаваў іх па тэмах.
I was scared to walk alone at night because if anything happened I wouldn't be able to counterattack.,"Мне было страшна хадзіць ноччу аднаму, бо калі што здарыцца, я не змагу контратакаваць."
I like talking to new people.,Мне падабаецца размаўляць з новымі людзьмі.
My company did well this year so I gave everyone a bonus.,"У маёй кампаніі ў гэтым годзе былі добрыя вынікі, таму я даў усім бонус."
Never in my life I had refused any challenge.,Ніколі ў жыцці я не адмаўляўся ад выкліку.
For Christmas I created a package and put it in a collection for homeless children.,На Каляды я стварыла пакет і паклала яго ў калекцыю для бяздомных дзяцей.
I continually educated myself.,Я пастаянна навучаўся.
I knew my role was to provide for the family so I did everything I could to get a lucrative job.,"Я ведаў, што мая задача - забяспечваць сям'ю, таму зрабіў усё магчымае, каб атрымаць прыбытковую працу."
"When on holiday, I received daily compliments.",У адпачынку я штодня атрымліваў кампліменты.
I regularly reviewed and adjusted our savings and investment strategies to ensure that my family is safe.,"Я рэгулярна праглядаў і карэкціраваў нашы зберажэнні і інвестыцыйныя стратэгіі, каб пераканацца, што мая сям'я ў бяспецы."
The recipe was really hard but I still tried to cook it.,"Рэцэпт быў вельмі складаным, але я ўсё ж паспрабавала яго прыгатаваць."
I made the bed.,Я заслала ложак.
They know how strict I am.,"Яны ведаюць, які я строгі."
I flipped the socks upside down and they were as good as new.,"Я перавярнуў шкарпэткі ўверх дном, і яны былі як новыя."
"I really needed the salary raise, so I proposed it to my manager.","Мне вельмі патрэбна было павышэнне зарплаты, таму я прапанаваў гэта свайму кіраўніку."
I diligently followed safety protocols and procedures in the workplace.,Я старанна выконваў пратаколы і працэдуры бяспекі на працоўным месцы.
My spouse has no idea that I have different sexual partners.,"Мая жонка не здагадваецца, што ў мяне розныя сэксуальныя партнёры."
I flexed my biceps and marveled at the sculpted definition.,Я сагнуў біцэпсы і здзівіўся выразнай выразнасці.
I spent the whole day cleaning the house.,Я цэлы дзень прыбірала дом.
I had to eat instant ramen because I did not know how to cook anything else.,"Мне прыйшлося есці рамен хуткага прыгатавання, таму што я не ўмеў гатаваць нічога іншага."
"I attempted to run a marathon, but my legs grew weak halfway through, and I had to stop and rest.","Я паспрабаваў прабегчы марафон, але на паўдарозе мае ногі аслаблі, і мне прыйшлося спыніцца і адпачыць."
I had never any trouble expressing my ideas out loud.,У мяне ніколі не было праблем з выказваннем сваіх ідэй услых.
I am very open-minded when it comes to sex.,"Я вельмі адкрыты, калі справа даходзіць да сэксу."
I had many sexual partners.,У мяне было шмат сэксуальных партнёраў.
I always imagined how it must have felt to be in a bed with you.,"Я заўсёды ўяўляў, як гэта павінна было быць, калі я ляжаў з табой у ложку."
I am good at making bold decisions.,Я добра ўмею прымаць смелыя рашэнні.
"I would like to try a threesome, it must be so much fun.","Я хацеў бы паспрабаваць сэкс утрох, напэўна, так весела."
I am a leader.,Я лідэр.
I got into a commercial for a new face cream.,Я трапіла ў рэкламу новага крэму для твару.
I could never live with someone who makes more money than me.,"Я ніколі не мог бы жыць з чалавекам, які зарабляе больш грошай, чым я."
"I showered daily, sometimes twice.","Я прымаў душ кожны дзень, часам два разы."
I was always ready to work till late at night.,Я заўсёды быў гатовы працаваць да позняй ночы.
I was inspiring and motivating those around me for almost 20 years.,Я натхняў і матываваў навакольных амаль 20 гадоў.
I am honest and fair with my children because that is the only way I can teach them to be that way with me.,"Я сумленны і справядлівы са сваімі дзецьмі, бо толькі так я магу навучыць іх быць такімі са мной."
"They don't let me do it, because I am too weak.","Мне не даюць, бо я занадта слабы."
Deep down I struggled but I still obeyed the instructions.,"У глыбіні душы я змагаўся, але ўсё роўна выконваў інструкцыі."
I like adventure and action in my daily life.,Мне падабаюцца прыгоды і дзеянні ў паўсядзённым жыцці.
I feel frustrated when I don't have intimacy.,"Я адчуваю расчараванне, калі ў мяне няма блізкасці."
I had no trouble shooting the big calibre weapons.,Стральба з буйнакалібернай зброі ў мяне не складала.
"Since I can remember, I was never scared of anything.","Колькі сябе памятаю, ніколі нічога не баяўся."
It was right of me to obey my husband.,З майго боку было правільна паслухацца мужа.
I had to ask someone to walk me home because it was getting too late.,"Я павінен быў папрасіць каго-небудзь правесці мяне дадому, таму што было занадта позна."
"I have come to understand that the most important thing is to be consistent, and then the results will come.","Я зразумеў, што самае галоўнае — быць паслядоўным, і тады будуць вынікі."
I cleaned the floor everyday.,Я мыў падлогу кожны дзень.
I like when my hair shines.,"Мне падабаецца, калі мае валасы блішчаць."
"I only wanted to laugh, but I got blamed for being childish.","Я хацеў толькі пасмяяцца, але мяне папракнулі ў дзяцінстве."
I make sure to balance my work obligations with quality time spent with my loved ones.,"Я сачу за тым, каб збалансаваць свае працоўныя абавязкі з якасным часам, праведзеным са сваімі блізкімі."
I just had to keep smiling no matter how hard the situation was.,"Мне проста трэба было працягваць усміхацца, якой бы цяжкай ні была сітуацыя."
"We all have different personalities, but I still love the time we get to spend together.","Ва ўсіх нас розныя характары, але я ўсё роўна люблю час, які мы праводзім разам."
"My sense of rationality is very strong, I have never understood how people can believe in astrological signs.","Маё пачуццё рацыянальнасці вельмі моцнае, я ніколі не разумеў, як людзі могуць верыць у астралагічныя знакі."
I worked as a manager of the whole branch.,Я працаваў загадчыкам усяго аддзялення.
I wasn't afraid of you and your friends.,Я не баяўся цябе і тваіх сяброў.
I made fun of her crooked teeth.,Я здзекаваўся з яе крывых зубоў.
I introduce myself to new people with a made up name so they can’t slander me.,"Я прадстаўляюся новым людзям выдуманым імем, каб яны не маглі паклёпнічаць на мяне."
I am happy when I make everyone else around me happy.,"Я шчаслівы, калі раблю шчаслівымі ўсіх вакол сябе."
"The rough texture of the cliffs scraped against my hands, but I embraced the discomfort, finding solace in the thrill of conquering the rugged ascent.","Шурпатая фактура скал шкрэбла па маіх руках, але я прыняў дыскамфорт, знайшоўшы суцяшэнне ў захапленні ад пераадолення суровага ўздыму."
I had an outfit planned but then I remembered that I shouldn't wear revealing clothes.,"Я запланаваў нарад, але потым успомніў, што не павінен насіць адкрытае адзенне."
I promptly washed and put away dishes after meals.,Я хутка памыў і прыбраў посуд пасля ежы.
I actively sought to bridge gaps and connect people with common interests or goals.,Я актыўна імкнуўся ліквідаваць разрывы і злучыць людзей з агульнымі інтарэсамі або мэтамі.
I was brought up not to talk back to anyone.,Мяне выхавалі ні з кім не адмаўляцца.
"I refused to do the job, because I had a videogame match.","Я адмовіўся выконваць працу, таму што ў мяне быў матч у відэагульні."
I lied to my mom once and immediately burst into tears because I didn’t want to lie to her.,"Аднойчы я схлусіў маме і адразу ж расплакаўся, бо не хацеў ёй хлусіць."
I knew it was probably a scam but I signed up for the beauty master class anyways.,"Я ведала, што гэта, напэўна, падман, але ўсё роўна запісалася на майстар-клас прыгажосці."
"I had a lot of friends in my old gym, but I had to switch gyms.","У маёй старой трэнажорнай зале ў мяне было шмат сяброў, але мне прыйшлося змяніць залу."
