from,to
"I don't mind vacuuming, in fact, I have always found it amusing.","Я не супраць пыласосіць, насамрэч, мне заўсёды гэта было цікава."
"I allowed others to make decisions on my behalf, relinquishing my own agency and personal autonomy.","Я дазволіў іншым прымаць рашэнні ад майго імя, адмовіўшыся ад уласнай волі і асабістай аўтаноміі."
I panicked when I got a flat tyre.,"Я запанікаваў, калі ў мяне лопнула кола."
I’m happiest when my whole apartment is tidy.,"Я самы шчаслівы, калі ўся мая кватэра ў парадку."
I like to lead by example.,Мне падабаецца паказваць прыклад.
I would never make a decision based on my emotions.,"Я б ніколі не прыняў рашэнне, грунтуючыся на сваіх эмоцыях."
I always feel bad after an argument.,Мне заўсёды дрэнна пасля сваркі.
My friend challenged me to a fight and I won.,"Мой сябар выклікаў мяне на бой, і я перамог."
I need to make money to take care of my partner.,"Мне трэба зарабляць грошы, каб клапаціцца пра свайго партнёра."
I'm always ready for any challenge.,Я заўсёды гатовы да любых выпрабаванняў.
I am sure about my abilities.,Я ўпэўнены ў сваіх сілах.
I planned our finances for the next year.,Я спланаваў нашы фінансы на наступны год.
I didn't care about what could have happened to me.,"Мне было ўсё роўна, што са мной магло здарыцца."
I am a miner.,Я шахцёр.
My core strength is still very good because I go to gym three times a week.,"Мая асноўная сіла ўсё яшчэ вельмі добрая, таму што я хаджу ў спартзалу тры разы на тыдзень."
I thought therapy was for weak people.,"Я думаў, што тэрапія для слабых людзей."
"They say I’m insensitive, but I call it sensible.","Яны кажуць, што я неадчувальны, але я называю гэта разумным."
I turned on the washing machine.,Я ўключыў пральную машыну.
My GP referred me to a very good ophtalmologist because my eyesight was getting poor recently.,"Мой лекар агульнай практыкі накіраваў мяне да вельмі добрага афтальмолага, таму што апошнім часам мой зрок пагоршыўся."
I swept and mopped the floors of my home.,Я падмятаў і мыў падлогі ў сваім доме.
"They think I'm shy, but I just don't want to embarrass myself.","Яны думаюць, што я сарамлівы, але я проста не хачу ганьбіць сябе."
I made sure the dough was the perfect temperature.,"Я пераканаўся, што цеста было ідэальнай тэмпературы."
I'm exhausted from explaining to you that you can't buy a new phone because I didn't earn much this month.,"Я знясілены, тлумачачы вам, што вы не можаце купіць новы тэлефон, таму што я мала зарабіў у гэтым месяцы."
I invited my friends to my place to have a dinner.,Я запрасіў сяброў да сябе на абед.
"I've been told that I'm a true professional – always focused, organized, and get the job done efficiently.","Мне сказалі, што я сапраўдны прафесіянал – заўсёды мэтанакіраваны, арганізаваны і выконваю працу якасна."
I’m too experienced to waste my time here.,"Я занадта вопытны, каб марнаваць тут час."
"I don’t like gossiping, it’s a waste of time.","Я не люблю плёткі, гэта пустая трата часу."
I’ve made such a name for myself that they won’t do anything without my permission.,"Я зрабіў сабе такое імя, што яны без майго дазволу нічога не зробяць."
I almost started crying.,Я ледзь не пачаў плакаць.
I hated logic because it often wasn't romantic.,"Я ненавідзеў логіку, таму што яна часта не была рамантычнай."
"I felt so many emotions, I could not breathe.","Я адчуў столькі эмоцый, што не мог дыхаць."
I managed my team with ease and got the job done.,Я з лёгкасцю кіраваў сваёй камандай і выконваў працу.
I have never believed in superstitions.,Я ніколі не верыў у забабоны.
"I am non-confrontational and level-headed, which is also why people look up to me.","Я неканфліктны і ўраўнаважаны, таму людзі раўняюцца на мяне."
I like to have fun.,Я люблю весяліцца.
I stood up in front of them and told them we could do it.,"Я ўстаў перад імі і сказаў ім, што мы можам гэта зрабіць."
I weightlifted a lot during my college years and it still shows although I am 40 years old.,"У студэнцкія гады я шмат займаўся цяжкай атлетыкай, і гэта ўсё яшчэ відаць, хаця мне 40 гадоў."
I joined a self-defence course.,Я пайшоў на курсы самаабароны.
I always had authority and others naturally saw me as a leader.,"У мяне заўсёды быў аўтарытэт, і іншыя, натуральна, бачылі ўва мне лідэра."
"When I'm sad, I go shopping.","Калі мне сумна, я хаджу па крамах."
I am sure there is a higher power controlling my life.,"Я ўпэўнены, што маім жыццём кіруе вышэйшая сіла."
We won the competition thanks to the idea I had a month ago.,"Мы выйгралі конкурс дзякуючы ідэі, якая ўзнікла ў мяне месяц таму."
My friend told me that I overreacted.,"Мой сябар сказаў мне, што я занадта моцна адрэагаваў."
"I knew that I'm capable of more, but I have family, so my priorities changed.","Я ведаў, што здольны на большае, але ў мяне ёсць сям'я, таму мае прыярытэты змяніліся."
"I don’t like watching videos of abandoned puppies, it makes me cry.","Я не люблю глядзець відэа кінутых шчанюкоў, ад гэтага я плачу."
I wish I had passed the physical test!,"Шкада, што я прайшоў фізічны тэст!"
I had cameras installed around the house so nothing would happen to me.,"Каб са мной нічога не здарылася, я паставіў па хаце камеры."
I got a fine for speeding on the highway.,Я атрымаў штраф за перавышэнне хуткасці на шашы.
I observed them to see whether they were satisfied with the meal I made.,"Я назіраў за імі, ці задаволеныя яны прыгатаванай мною стравай."
"After walking into the meeting room, I shook everyone's hand.","Увайшоўшы ў залу пасяджэнняў, я паціснуў усім руку."
I didn't want to stay at home with kids because I would loose a really good job.,"Я не хацеў заставацца дома з дзецьмі, бо страціў бы сапраўды добрую працу."
I always took taking care of my family's finances seriously.,Я заўсёды сур'ёзна ставіўся да фінансаў сваёй сям'і.
I could not stop thinking about the sex we had last night.,"Я не мог перастаць думаць пра сэкс, які мы займаліся мінулай ноччу."
I didn't make any hasty mistakes.,Я не зрабіў паспешных памылак.
I could easily join the army.,Я мог лёгка пайсці ў войска.
I could not resist cleaning those dirty windows.,Я не мог утрымацца ад мыцця гэтых брудных вокнаў.
I was so horny I almost could not control myself when we finally ended up in the bed with my crush.,"Я быў настолькі ўзбуджаны, што амаль не мог кантраляваць сябе, калі мы, нарэшце, апынуліся ў ложку з маім каханнем."
"I shouldn't argue, because it's better to keep the household calm.","Спрачацца не варта, бо ў гаспадарцы лепш трымаць спакой."
"People around me know that if they need something, I’m happy to help.","Людзі вакол мяне ведаюць, што калі ім нешта спатрэбіцца, я з радасцю дапамагу."
I saved up a lot of money for my childrens education.,Я назапасіў шмат грошай на адукацыю сваіх дзяцей.
"Although I don't like this dish, I made it for my family.","Хоць я і не люблю гэтую страву, я прыгатавала яе для сваёй сям'і."
I am courageous.,Я мужны.
I sacrificed my own authenticity to avoid displeasing others.,"Я ахвяраваў уласнай сапраўднасцю, каб не спадабацца іншым."
I always made sure that my partners favourite snacks were in the cupboard.,"Я заўсёды сачыў за тым, каб любімыя закускі маіх партнёраў былі ў шафе."
"There is so much going on inside my mind, I can barely focus.","У маёй галаве адбываецца столькі ўсяго, што я ледзь магу засяродзіцца."
I don't think I have a strong enough character to be a company director.,"Я не думаю, што ў мяне дастаткова моцны характар, каб быць дырэктарам кампаніі."
Maybe if I acted nicer they would say yes.,"Магчыма, калі б я паводзіў сябе прыемней, яны б сказалі ""так""."
I like to try new things with my partner.,Мне падабаецца спрабаваць новыя рэчы са сваім партнёрам.
I helped the neighbour with carrying her shopping bags.,Я дапамог суседцы несьці сумкі з пакупкамі.
I told him that nothing was wrong although I was really upset.,"Я сказаў яму, што нічога страшнага, хоць я быў вельмі засмучаны."
"I tried to lift the piano, but I couldn't.","Я паспрабаваў падняць піяніна, але не здолеў."
I expected the salary increase.,Чакаў павышэння заробку.
I wouldn't be satisfied with myself if I didn't finish the race.,"Я не быў бы задаволены сабой, калі б не скончыў гонку."
I had a really nice face when I was young.,У маладосці ў мяне быў вельмі добры твар.
"When I was their age, I behaved like a child too.","Калі я быў у іх узросце, я таксама паводзіў сябе як дзіця."
I'm always ready to help you with anything around your car.,Я заўсёды гатовы дапамагчы вам у любым выпадку вакол вашага аўтамабіля.
"I didn't know what to do, so I relied on my gut.","Я не ведаў, што рабіць, таму спадзяваўся на сваё пачуццё."
I worked in a laboratory.,Я працаваў у лабараторыі.
I like to analyse problems from various perspectives.,Мне падабаецца аналізаваць праблемы з розных пунктаў гледжання.
"People would often turn to me for fashion and style advice, recognizing my good taste and sense of aesthetics so I knew I was appreciated.","Людзі часта звярталіся да мяне за парадай па модзе і стылі, прызнаючы мой добры густ і пачуццё эстэтыкі, таму я ведаў, што мяне цэняць."
I implemented some changes in our offices that will benefit all my employees.,"Я ўнёс некаторыя змены ў нашы офісы, якія прынясуць карысць усім маім супрацоўнікам."
"When someone calls me to go out, I’m always happy to say yes.","Калі нехта кліча мяне на сустрэчу, я заўсёды рады адказаць «так»."
I have never let any of my clients down.,Я ніколі ніводнага са сваіх кліентаў не падводзіў.
I offered my help with doing the dishes.,Я прапанаваў сваю дапамогу з мыццём посуду.
I avoided conflicts at all costs.,Я любой цаной пазбягаў канфліктаў.
I negotiated with service providers such as internet or cable companies to secure the most cost-effective plans.,"Я вёў перамовы з такімі пастаўшчыкамі паслуг, як Інтэрнэт або кабельныя кампаніі, каб забяспечыць найбольш рэнтабельныя планы."
When was the last time you had sex?,Калі вы апошні раз займаліся сэксам?
I fired everyone who made me angry.,"Я звольніў усіх, хто мяне злаваў."
My to do list was neverending but I kept going.,"Мой спіс спраў быў бясконцым, але я працягваў."
I can't imagine having a family and having to take care of them someday.,"Я не магу ўявіць, каб у мяне была сям'я і калі-небудзь мне давядзецца клапаціцца пра іх."
I offered a supportive ear and understanding without judgment.,Я прапанаваў падтрымку і разуменне без асуджэння.
I told them to let me buy them the things they needed.,"Я сказаў ім, каб я купіў ім тое, што ім трэба."
I like curved bodies.,Мне падабаюцца выгнутыя целы.
They were rude so I had to punch them.,"Яны былі грубыя, таму мне прыйшлося іх біць."
I knew how to deal with this type of client.,"Я ведаў, як абыходзіцца з такімі кліентамі."
I never liked speaking out loud.,Я ніколі не любіў гаварыць услых.
I took them to a water park.,Я адвёў іх у аквапарк.
I was late so I invited them for a nice lunch.,"Я спазніўся, таму запрасіў іх на добры абед."
"When I'm with him, I'm angry.","Калі я з ім, я злуюся."
If only I could call and check how they are doing.,"Калі б я мог патэлефанаваць і праверыць, як у іх справы."
I assembled the furniture alone.,Мэблю я збіраў адзін.
I did not have money so I dug the hole for the pool on my own.,"У мяне не было грошай, таму я выкапаў яму для басейна самастойна."
I have always wanted to behave as they expected me to.,"Я заўсёды хацеў паводзіць сябе так, як яны ад мяне чакалі."
I felt a rush of desire as I was kissed and immediately felt aroused.,"Калі мяне пацалавалі, я адчуў прыліў жадання і адразу адчуў узбуджэньне."
I didn't want my partner to work.,"Я не хацеў, каб мой партнёр працаваў."
I'm good at navigating.,Я добра арыентуюся.
I checked if the children did their homework.,"Я правярала, ці зрабілі дзеці ўрокі."
I had tough military training.,У мяне была цяжкая вайсковая падрыхтоўка.
This problem turned out to be too difficult and I got furious.,"Гэтая задача аказалася занадта складанай, і я раз'юшыўся."
I had to shave my legs before the race.,Мне прыйшлося пагаліць ногі перад гонкай.
I was the lead author of the research paper.,Я быў вядучым аўтарам даследчай працы.
I was never so sure about my test results.,Я ніколі не быў так упэўнены ў сваіх выніках тэсту.
I wanted him to feel welcome.,"Я хацеў, каб ён адчуваў сябе гасцінным."
I tried to be kind at all costs not to displease anyone.,"Я стараўся быць добрым любой цаной, каб нікому не спадабацца."
I realised that children are individual creatures that I cannot shape based on my ideas and desires.,"Я зразумеў, што дзеці - асобныя істоты, якія я не магу сфарміраваць па сваіх ідэях і жаданнях."
I didn't want to tell them what is wrong because I didn't want to cause any trouble.,"Я не хацеў казаць ім, што здарылася, таму што не хацеў выклікаць праблем."
"Even though I am their boss, I told them that I wanted them to see me as an equal colleague.","Нягледзячы на тое, што я іх начальнік, я сказаў ім, што хачу, каб яны бачылі мяне як роўнага калегу."
"Even if I was afraid of something, I would never admit it.","Нават калі б я чагосьці баяўся, я б ніколі ў гэтым не прызнаўся."
I was very good at resolving conflicts when I was the supervisor.,"Я вельмі добра ўмеў вырашаць канфлікты, калі быў кіраўніком."
I wouldn't let anyone dictate what I should do.,"Я б нікому не дазволіў дыктаваць, што мне рабіць."
It was always important for me to be pretty.,Для мяне заўсёды было важна быць прыгожай.
"I am an accomplished writer, my books are usually bestsellers.","Я дасведчаны пісьменнік, мае кнігі звычайна з'яўляюцца бэстсэлерамі."
"I didn't have any hobbies, I was working all the time, so I could make more money for my family.","У мяне не было хобі, я ўвесь час працаваў, таму мог больш зарабіць для сям'і."
I made a group chat for all the new classmates.,Я зрабіў групавы чат для ўсіх новых аднакласнікаў.
"I shouldn't have taken that personally, but I was really offended.","Я не павінен быў успрымаць гэта асабіста, але я быў вельмі пакрыўджаны."
"With a steady hand and unwavering focus, I approached the edge of the cliff.",Цвёрдай рукой і непахіснай засяроджанасцю я падышоў да краю скалы.
I feel the happiest when I'm in charge of everything.,"Я адчуваю сябе самым шчаслівым, калі я адказваю за ўсё."
"I had already made up my mind, so your argument will not work.","Я ўжо вызначыўся, так што ваш аргумент не будзе працаваць."
Just because I demand discipline from my employees doesn't mean I don't like them.,"Тое, што я патрабую дысцыпліны ад сваіх супрацоўнікаў, не азначае, што яны мне не падабаюцца."
I had never thought that I could come to harm.,"Я ніколі не думаў, што магу пашкодзіць."
The cleaners left the entrance door open.,Прыбіральшчыкі пакінулі ўваходныя дзверы адчыненымі.
"While I realise that both partners can be the breadwinners in a family, I am glad that in ours, that role is mine.","Хоць я разумею, што абодва партнёра могуць быць карміцелямі ў сям'і, я рады, што ў нашай сям'і гэтая роля належыць мне."
"I jogged confidently, feeling the endurance of my physical strength.","Я бегла ўпэўнена, адчуваючы трываласць сваёй фізічнай сілы."
I could easily seduce you with just my looks.,Я мог бы лёгка спакусіць цябе адным сваім выглядам.
I knew how to fix a broken car.,"Я ведаў, як паправіць зламаную машыну."
They do not dare to questions the decisions that I have made.,"Яны не вырашаюцца ставіць пад сумнеў рашэнні, якія я прыняў."
I organised an international conference.,Я арганізаваў міжнародную канферэнцыю.
"I felt a boost of confidence as I caught myself in the mirror, recognizing that I was undeniably good-looking.","Я адчуў прыліў упэўненасці, калі злавіў сябе ў люстэрку, прызнаючы, што я бясспрэчна прыгожы."
I like to go to nude beaches.,Мне падабаецца хадзіць на нудысцкія пляжы.
I was sick but I still worked from home so we don't loose any money.,"Я быў хворы, але ўсё яшчэ працаваў дома, каб мы не страцілі грошы."
I still think about how I was told I was ugly in elementary school.,"Я ўсё яшчэ думаю пра тое, як мне казалі, што я непрыгожая ў пачатковай школе."
I have created the life I have always wanted.,"Я стварыў жыццё, якога заўсёды хацеў."
When I'm out with my friend we gossip way too much.,"Калі я гуляю са сваім сябрам, мы занадта шмат пляткарым."
I would never let privacy interfere with my work life.,Я б ніколі не дазволіў прыватнасці ўмешвацца ў маё працоўнае жыццё.
I created a dating account.,Я стварыў уліковы запіс для знаёмстваў.
"I'm always happy, I think worrying is just a waste of time.","Я заўсёды шчаслівы, лічу, што хвалявацца - гэта пустая трата часу."
I like to play computer games.,Я люблю гуляць у кампутарныя гульні.
I can take this - I have always managed.,Я магу прыняць гэта - я заўсёды спраўляўся.
"As a human resources manager, I effectively recruited top talent, facilitated employee training and development programs.","Як менеджэр па персаналу, я эфектыўна набіраў лепшых талентаў, садзейнічаў праграмам навучання і развіцця супрацоўнікаў."
I learned a foreign launguage to have better foreign contacts.,"Я вывучыў замежную мову, каб мець лепшыя замежныя кантакты."
I am very good at pretending that I am fine.,"Я вельмі добра ўмею рабіць выгляд, што ў мяне ўсё добра."
I coached the youth football team.,Я трэніраваў моладзевую футбольную каманду.
I started screaming because I got angry.,"Я пачаў крычаць, бо раззлаваўся."
"My good looks opened doors in the entertainment industry, I was very confident.","Мая знешнасць адкрыла мне дзверы ў індустрыю забаў, я быў вельмі ўпэўнены ў сабе."
I think I was born to help others.,"Я думаю, што я нарадзіўся, каб дапамагаць іншым."
I should work harder so my children have easier life.,"Я павінен больш працаваць, каб маім дзецям было лягчэй."
"I organized my to-do list based on priority, tackling the most important tasks first.","Я арганізаваў свой спіс спраў па прыярытэтах, у першую чаргу вырашаючы найбольш важныя задачы."
I'm successful.,Я паспяховы.
I like helping people.,Мне падабаецца дапамагаць людзям.
I have always enjoyed teaching others.,Мне заўсёды падабалася вучыць іншых.
I threw myself a birthday party to get lots of presents.,"Я зладзіў сабе дзень нараджэння, каб атрымаць шмат падарункаў."
I liked having company better.,Мне больш падабалася мець кампанію.
"In order not to burn out, I try to create a work-life balance.","Каб не згарэць, стараюся стварыць баланс паміж працай і жыццём."
"Kissing was important to me, but so was sex.","Пацалункі былі важныя для мяне, але таксама сэкс."
