from,to
"When I was at university, I preferred to sit in the corner, where nobody could notice me.","Kad sam bio na sveučilištu, radije sam sjedila u kutu, gdje me nitko nije mogao primijetiti."
I realised that in critical situations one has to think that every problem has a solution.,Shvatio sam da u kritičnim situacijama treba misliti da svaki problem ima rješenje.
"I aired the room, because it smelled bad.","Prozračila sam sobu, jer je loše mirisala."
"I'm afraid that if I am more assertive, people will think me unkind.","Bojim se da će, ako budem asertivniji, ljudi misliti da sam neljubazan."
I am very attractive.,Veoma sam privlačna.
The roar of the engine filled the air as I maneuvered the powerful motorcycle through the winding roads.,Ruk motora napunio je zrak dok sam manevrirao snažnim motociklom kroz krivudave ceste.
I was keen to avoid any mistakes in the production process.,Želio sam izbjeći bilo kakve pogreške u proizvodnom procesu.
I love to do things intuitively.,Volim raditi stvari intuitivno.
I'm always ready to have sex.,Uvijek sam spreman za seks.
I cried myself to sleep.,Plakala sam da zaspim.
I am the breadwinner of this family.,Ja sam hranitelj ove obitelji.
I caught myself in the reflection of a storefront window and couldn't help but admire my own good looks.,Uhvatio sam se u odrazu prozora i nisam mogao a da se ne divim vlastitom lijepom izgledu.
I had a huge Marvel poster in my room.,Imao sam veliki Marvelov poster u svojoj sobi.
People often commented on my great body.,Ljudi su često komentirali moje sjajno tijelo.
I wanted to kill the deer myself.,Sam sam htio ubiti jelena.
I was never camera-shy.,Nikad nisam bio sramežljiv.
I spent a lot of money on cosmetics.,Potrošio sam puno novca na kozmetiku.
"I wanted to dig up the treasure, but I needed more people.","Htio sam iskopati blago, ali trebalo mi je više ljudi."
I have never taken the words of angry people personally.,Nikada nisam osobno shvatio riječi ljutih ljudi.
I'm good at combining colours and patterns on clothes.,Dobra sam u kombiniranju boja i uzoraka na odjeći.
"To take care of my family's well-being, it required a lot of determination and strong will.","Da bih se brinuo o dobrobiti moje obitelji, bilo je potrebno puno odlučnosti i snažne volje."
I paid for another porn channel.,Platio sam još jedan porno kanal.
"Although I worked as a manager, they often attacked my appearance.","Iako sam radio kao menadžer, često su napadali moj izgled."
"I don't keep my money in a safe, because robbers don't scare me.","Ne držim novac u sefu, jer me pljačkaši ne plaše."
I always take two steps back after I see black cat cross the street.,Uvijek napravim dva koraka unatrag nakon što vidim crnu mačku kako prelazi ulicu.
I had a big wedding with many guests.,Imao sam veliko vjenčanje s mnogo gostiju.
"I tried to radiate confidence and charisma on a banket last week, did you notice?","Pokušao sam zračiti samopouzdanjem i karizmom na banketu prošli tjedan, jeste li primijetili?"
I always said that sex is very important for me.,Uvijek sam govorio da mi je seks vrlo važan.
I approached challenges with a clear and rational mindset.,Izazovima sam pristupio jasnim i racionalnim načinom razmišljanja.
I was frustrated when I was unable to satisfy my sexual needs.,Bio sam frustriran kad nisam mogao zadovoljiti svoje seksualne potrebe.
I told them to follow me.,Rekao sam im da me slijede.
I feel confident most of the time so it came naturally to me to be a leader.,Većinu vremena se osjećam samouvjereno pa mi je prirodno da budem vođa.
I asked them if I could come along.,Pitao sam ih mogu li doći.
I went to a sex show in Amsterdam.,Otišao sam na seks show u Amsterdamu.
Am I tender enough?,Jesam li dovoljno nježan?
"They did not have their favourite ice cream, so I took the bus to the store outside of the town.","Nisu imali svoj omiljeni sladoled, pa sam autobusom otišao do trgovine izvan grada."
I mended the window easily.,Lako sam popravio prozor.
I am still mad that our team lost.,Još uvijek sam ljut što je naš tim izgubio.
"If I didn't earn enough, my family wouldn't have anything to eat.","Da ne zaradim dovoljno, moja obitelj ne bi imala što jesti."
I'm no beginner to be annoyed because of little things like that.,Nisam početnik da me nervira zbog takvih sitnica.
I was always first picked when playing any sports back in highschool.,Uvijek sam prvi put izabran kada sam se bavio bilo kojim sportom još u srednjoj školi.
I am able to compete with anyone.,Mogu se natjecati sa svakim.
"I invited strangers to our table, and it made a very good group of people.","Pozvao sam strance za naš stol, i to je napravilo vrlo dobru grupu ljudi."
"I was initially a suspect, but the police determined I was not strong enough to hurt them.","U početku sam bio osumnjičeni, ali policija je utvrdila da nisam dovoljno jak da ih povrijedim."
"I always wanted to be a researcher, but I wouldn't have time to take care of my family.","Uvijek sam želio biti istraživač, ali nisam imao vremena brinuti se o svojoj obitelji."
I was just protecting you from other people at that club.,Samo sam te štitio od drugih ljudi u tom klubu.
"Since I've been eating more protein, I feel much stronger.","Budući da jedem više proteina, osjećam se mnogo jače."
I haven't carried cash with me since I was robbed.,Nisam nosio novac sa sobom otkad su me opljačkali.
I like to just smile at someone because I believe it will make their day better.,Volim se samo nasmiješiti nekome jer vjerujem da će im to učiniti dan boljim.
I thought that confidence is the key aspect of having a healthy and successful life.,Mislio sam da je samopouzdanje ključni aspekt zdravog i uspješnog života.
I felt it in my gut.,Osjetio sam to u crijevima.
Why did I have to get old?!,Zašto sam morao ostariti?!
I would feel incompetent if I paid a cleaning lady.,Osjećao bih se nesposobnim kad bih platio čistačici.
I could easily seduce you at the bar.,Mogao bih te lako zavesti u baru.
I found a nice picture of myself easily.,Lako sam pronašao lijepu sliku sebe.
I would never allow myself to offend anyone.,Nikada ne bih dopustio da nikoga uvrijedim.
I ordered them to stop praying and start helping.,Naredio sam im da prestanu moliti i počnu pomagati.
"When tsunami came, I volunteered to save people from drowning.","Kad je došlo do tsunami, dobrovoljno sam se prijavio da spasim ljude od utapanja."
I never stressed about work responsibilities because I knew that I could handle anything.,Nikad nisam naglašavao zbog radnih odgovornosti jer sam znao da mogu podnijeti bilo što.
"I didn't like our sex, but I didn't say anything.","Nije mi se svidio naš seks, ali nisam ništa rekao."
"I had to carry the logs all on my own, but it was fine.","Morao sam nositi trupce sam, ali bilo je u redu."
I didn't need your financial help!,Nije mi trebala tvoja financijska pomoć!
I never let my family affect my profession.,Nikad nisam dopustio da moja obitelj utječe na moju profesiju.
I struggled to strike a balance between my sexual desires and other important aspects of life.,Borio sam se da uspostavim ravnotežu između svojih seksualnih želja i drugih važnih aspekata života.
I stopped the pickpocket and held him until the police came.,Zaustavio sam džepara i držao ga dok nije došla policija.
I decided to change my plans for no reason.,Odlučio sam promijeniti svoje planove bez razloga.
"If I had been there, the atmosphere would have been better.","Da sam bio tamo, atmosfera bi bila bolja."
I have worked hard to get to where I am today.,Naporno sam radio da dođem tamo gdje sam danas.
"Don't go there alone, it can be dangerous.","Ne idite tamo sami, to može biti opasno."
I was proud of being a good kisser.,Bio sam ponosan što sam dobar poljubac.
I took the time to understand and acknowledge the emotions of a colleague who was going through a difficult time.,Odvojio sam vrijeme da razumijem i priznam emocije kolege koji je prolazio kroz teško vrijeme.
"As I effortlessly lifted the heavy box, the surprised expressions on others' faces made me smile.","Dok sam bez napora podizao tešku kutiju, iznenađeni izrazi na tuđim licima natjerali su me nasmiješiti."
I filtered out all the distractions.,Filtrirao sam sve smetnje.
I never had a problem with learning a new language.,Nikada nisam imao problema s učenjem novog jezika.
I cleaned the house yesterday and now it's a mess again.,Jučer sam očistio kuću i sada je opet u neredu.
I could not cook because it was my mother's job.,Nisam mogao kuhati jer je to bio posao moje majke.
I was the first one at the library.,Bio sam prvi u knjižnici.
I have always felt that childcare was my life goal.,Uvijek sam smatrao da je briga o djeci moj životni cilj.
I could lift that car if I wanted to.,Mogao bih podići taj auto ako želim.
"Since I've been doing this sport, I'm much more balanced.","Budući da se bavim ovim sportom, puno sam uravnoteženiji."
I slammed the door after the argument.,Zalupila sam vrata nakon svađe.
I don't like when the meal I prepared is tasteless.,Ne volim kad je obrok koji sam pripremio bez ukusa.
"When I was little, I wanted to be an athlete, but my parents signed me up for ballet instead.","Kad sam bio mali, želio sam biti sportaš, ali roditelji su me umjesto toga prijavili za balet."
"I came up with a deal: if you vacuum, I'll take you out tonight.","Došao sam do dogovora: ako usisavate, izvest ću vas večeras."
I am able to see the big picture of where the organisation is heading.,Mogu vidjeti veliku sliku kamo se organizacija kreće.
"I didn't want us to sign a prenup, because I'd take care of my partner even after a divorce.","Nisam htjela da potpišemo predbračni zakup, jer bih se brinuo o svom partneru čak i nakon razvoda."
I learned how to drive before I was even allowed to.,Naučio sam voziti prije nego što mi je bilo dopušteno.
I didn't need your support.,Nije mi trebala tvoja podrška.
I always liked dancing.,Uvijek sam volio plesati.
"I have never been a loner, I prefer to be surrounded by people.","Nikad nisam bio usamljen, više volim biti okružen ljudima."
I used to clean the house on every Saturday.,Čistila sam kuću svake subote.
I made some extra money as a personal trainer.,Zaradio sam dodatni novac kao osobni trener.
"I had enough romance, I wanted something more intimate.","Imao sam dovoljno romantike, želio sam nešto intimnije."
"As a pilot, I ensured the safety of passengers and crew by adhering to rigorous protocols.",Kao pilot osigurao sam sigurnost putnika i posade pridržavajući se strogih protokola.
"I couldn't keep up with the intense workout routine, my body feeling weak and exhausted from the exertion.","Nisam mogao pratiti intenzivnu rutinu vježbanja, tijelo mi se osjećalo slabo i iscrpljeno od napora."
I feel fulfilled when I can take care of everybody in the house.,Osjećam se ispunjeno kad se mogu brinuti za sve u kući.
I divided the tasks equally among all the team members.,Podelio sam zadatke jednako među svim članovima tima.
It was hard for me to admit that I needed a hand.,Bilo mi je teško priznati da mi je potrebna ruka.
I was aware that bad leadership leads to bad results.,Bio sam svjestan da loše vodstvo dovodi do loših rezultata.
I could strike up a conversation with almost everybody that evening.,Mogao bih započeti razgovor sa gotovo svima te večeri.
I could not wrap my head around this hard mathematical problem.,Nisam mogao zamotati glavu oko ovog teškog matematičkog problema.
"The storm raged on, but I stood strong on the deck of the ship.","Oluja je bjesnila, ali ja sam snažno stajao na palubi broda."
"I should be thoughtful, because that's what's expected of me.","Trebao bih biti pažljiv, jer se to očekuje od mene."
"For my birthday, I asked to go skydiving.",Za rođendan sam zamolio da skočim padobranom.
I remained composed although the situation escalated.,Ostao sam složen iako je situacija eskalirala.
I'm an expert in my field.,Ja sam stručnjak u svom području.
I offered accommodation to two refugees.,Ponudio sam smještaj dvojici izbjeglica.
I have a habit of going along with what other people want.,Imam naviku da se slažem s onim što drugi ljudi žele.
Finally the beauty catalogue that I ordered has arrived.,Napokon je stigao katalog ljepote koji sam naručio.
I used to enjoy being able to simply use my smile to achieve things.,Nekada sam uživao u tome što sam mogao jednostavno iskoristiti svoj osmijeh za postizanje stvari.
"I went to buy new sponges, these were too dirty.","Otišao sam kupiti nove spužve, ove su bile previše prljave."
"Some people hate accessories, but I like wearing them.","Neki ljudi mrze dodatke, ali ja ih volim nositi."
"With each punch thrown and block executed, I could feel the power surging through me.","Sa svakim bacenim udarcem i izvršenim blokom, mogao sam osjetiti kako snaga prolazi kroz mene."
I would never be able to cheat.,Nikad ne bih mogao varati.
My mind was set - I got married despite everyone being against it.,Misao mi je bio spreman - udala sam se unatoč tome što su svi bili protiv toga.
I got overwhelmed with sadness.,Bila sam preplavljena tugom.
I am tired after walking for ten minutes.,Umoran sam nakon hodanja deset minuta.
"If you weren't with me, god knows how it'd end.","Da nisi bio sa mnom, Bog zna kako bi to završilo."
On the way home I talked to an elderly lady on the train.,Na putu kući razgovarao sam sa starijom damom u vlaku.
"I wished the gig would never end, there were so many nice people everywhere.","Volio sam da koncert nikad ne završi, bilo je toliko lijepih ljudi posvuda."
I had to work even over Christmas to earn as much money as possible.,Morao sam raditi čak i za Božić kako bih zaradio što više novca.
"That job wasn't meant for me, but for someone stronger.","Taj posao nije bio namijenjen meni, već nekome jačem."
I'd rather have everything right away.,Radije bih imao sve odmah.
I was just in a meeting.,Bila sam na sastanku.
I was raised to know how to take care of others.,Odgajana sam da znam brinuti se o drugima.
I read a book about self-improvement yesterday.,Jučer sam pročitao knjigu o samopoboljšanju.
I first weighted all the possible scenarios.,Prvo sam ponderisao sve moguće scenarije.
"I had this weird feeling, so I called my parents right away to see if they were okay.","Imao sam taj čudan osjećaj, pa sam odmah nazvao roditelje da vidim jesu li dobro."
I like to throw parties for my kids because we always have a house full of people.,Volim organizirati zabave za svoju djecu jer uvijek imamo kuću punu ljudi.
"Every step reflected the confidence I held within, captivating the onlookers with my magnetic presence.","Svaki korak odražavao je samopouzdanje koje sam držao u sebi, očaravajući gledatelje svojom magnetskom prisutnošću."
My friend is always making me laugh.,Moj prijatelj me uvijek nasmijava.
I went to walk the dogs from the shelter.,Otišao sam šetati pse iz skloništa.
I like extreme sports even though they are really dangerous.,Volim ekstremne sportove iako su stvarno opasni.
I like to read fashion magazines.,Volim čitati modne časopise.
Despite the criticism I thought I did well.,Unatoč kritikama mislio sam da sam dobro prošao.
I was the first one at the clothing store.,Bila sam prva u prodavaonici odjeće.
I'm very competitive when it comes to promotions and performance in the workplace.,Vrlo sam konkurentna kada su u pitanju napredovanja i performanse na radnom mjestu.
I hoped I had been a pleasant companion.,Nadao sam se da sam bio ugodan pratilac.
"Sorry, I could have come but I was having a really bad hair day.","Oprosti, mogao sam doći, ali imao sam jako loš dan za kosu."
"When becoming a leader, the key aspect was to be capable of managing complex situations.","Kada ste postali vođa, ključni aspekt bio je biti sposoban upravljati složenim situacijama."
I worked hard to maintain my position.,Naporno sam radio kako bih zadržao svoju poziciju.
My smile was shinning through the whole room.,Moj osmijeh je blistao kroz cijelu sobu.
I never thought we could only stay friends.,Nisam mislio da možemo ostati samo prijatelji.
I was promoted because I have good communication skills.,Bio sam unaprijeđen jer imam dobre komunikacijske vještine.
I always did something extra although my job didn't require it.,"Uvijek sam radio nešto dodatno, iako moj posao to nije zahtijevao."
I have never left home without making sure that everybody has something to eat first.,"Nikada nisam napustio dom, a da se ne pobrinem da svi prvo imaju nešto za jesti."
I offered to help the new neighbours the paperwork.,Ponudio sam da pomognem novim susjedima oko papirologije.
"As a pharmacist, I ensured compliance with regulatory guidelines.",Kao ljekarnik osigurao sam poštivanje regulatornih smjernica.
I calmly handled a difficult customer.,Mirno sam se nosio s teškim kupcem.
"In a business meeting, I actively listened to my colleagues and responded to their proposals with relevant comments.",Na poslovnom sastanku aktivno sam slušao svoje kolege i odgovarao na njihove prijedloge relevantnim komentarima.
I'm aware of my qualities.,Svjestan sam svojih kvaliteta.
I hated art subjects at school.,Mrzila sam umjetničke predmete u školi.
I wish I could think more rationally.,Volio bih da mogu razmišljati racionalnije.
I thought about starting my own vlog about fashion.,Razmišljao sam o pokretanju vlastitog vloga o modi.
I like to have the best mobile on the market.,Volim imati najbolji mobitel na tržištu.
I got approached by some model agency.,Prišla mi je neka agencija za modele.
"I delegated tasks effectively, matching the skills and strengths of my team members with the right responsibilities.","Učinkovito sam delegirao zadatke, usklađujući vještine i snage članova mog tima s pravim odgovornostima."
I'm not very good at showing my emotions.,Nisam baš dobar u pokazivanju svojih emocija.
"If I knew how boring university was, I would never have gone to it.","Da sam znao koliko je dosadno sveučilište, nikad ne bih išao na njega."
I like to spend time with children because they have great ideas and opinions.,Volim provoditi vrijeme s djecom jer imaju sjajne ideje i mišljenja.
I assembled the furniture on my own.,Namještaj sam sastavio sam.
I pitied the beggar and gave him money.,Požalila sam prosjaka i dala mu novac.
I am the manager of this bank.,Ja sam upravitelj ove banke.
"If I had to choose between workinf the body or working the mind, I'd choose the mind.","Kad bih morao birati između rada tijela ili rada uma, odabrao bih um."
"I knew they had something against me, although I had no proof.","Znao sam da imaju nešto protiv mene, iako nisam imao dokaza."
I like to talk so much that I do it with animals too.,Toliko volim razgovarati da to radim i sa životinjama.
I would be happier if my partner stayed at home and raised the children.,Bio bih sretniji kad bi moj partner ostao kod kuće i odgojio djecu.
"I was asked to take care of my neighbour, and I obliged.","Zamolili su me da se brinem o svom susjedu, a ja sam se obavezao."
I established a cleaning routine and adhered to it.,Uspostavio sam rutinu čišćenja i pridržavao se toga.
I carried it up the stairs myself.,Sam sam ga nosio uz stepenice.
I think my co-worker is an excellent leader.,Mislim da je moj suradnik odličan vođa.
I always protected my relatives no matter what.,Uvijek sam štitio svoju rodbinu bez obzira na sve.
I was looking out for my employees even though I was on holiday.,Pazila sam na svoje zaposlenike iako sam bila na odmoru.
I took some days to think over the offer.,Trebalo mi je nekoliko dana da razmislim o ponudi.
"When it came to tears, my heart softened and I accepted the apology.","Kad su došle do suza, srce mi je omekšalo i prihvatio sam ispriku."
There were just too many obstacles so I had to give up.,Bilo je previše prepreka pa sam morao odustati.
I always thought that it was healthy to have multiple partners.,Uvijek sam mislio da je zdravo imati više partnera.
"I lost my job and the reason was that I couldn't handle stress, but I can.","Izgubio sam posao i razlog je bio taj što nisam mogao podnijeti stres, ali mogu."
I was with my friend who couldn't stop talking.,Bio sam s prijateljem koji nije mogao prestati razgovarati.
Last night I turned into a beast.,Sinoć sam se pretvorio u zvijer.
I could never stand up for myself.,Nikad se ne bih mogao zauzeti za sebe.
I plowed the entire field.,Orao sam cijelo polje.
I made the same mistake despite the obvious signs.,Napravio sam istu grešku unatoč očitim znakovima.
I reviewed the paper three times until there were no typos.,Pregledao sam rad tri puta dok nije bilo pogrešaka u pogreškama.
I could never leave the airport without first checking all the fragnances first.,"Nikad ne bih mogao napustiti aerodrom, a da prvo ne provjerim sve nevolje."
I did it even though it was risky.,Učinio sam to iako je bilo rizično.
I did not need to ask for help.,Nisam trebao tražiti pomoć.
I didn't like losing time and started working immediately.,Nisam volio gubiti vrijeme i odmah sam počeo raditi.
I couldn't stand being cooped up at home for another day.,Nisam mogao podnijeti da me još jedan dan spremaju kod kuće.
I wanted to kiss them both.,Htio sam ih oboje poljubiti.
"As a journalist, I conducted thorough interviews, verified facts, and crafted compelling stories","Kao novinar provodio sam temeljite intervjue, provjerio činjenice i izrađivao uvjerljive priče"
"I had to cancel the neighbourhood barbeque because nobody helped me with cleaning the grill, and I could not do it on my own.","Morao sam otkazati susjedski roštilj jer mi nitko nije pomogao u čišćenju roštilja, a nisam to mogao učiniti sam."
I performed a series of rituals before an important event.,Izveo sam niz rituala prije važnog događaja.
I considered different viewpoints and engaged in rational dialogue to reach a collective decision.,Razmatrao sam različita gledišta i bavio se racionalnim dijalogom kako bih došao do kolektivne odluke.
"I allowed my anxiety to control my actions, avoiding certain situations.","Dopustio sam svojoj tjeskobi da kontrolira moje postupke, izbjegavajući određene situacije."
I joined a university study because they were looking for sexually active people.,Pridružio sam se sveučilišnom studiju jer su tražili seksualno aktivne ljude.
I resolved to brush my dog at least three times a week so he wouldn't shed as much.,Odlučio sam četkati svog psa najmanje tri puta tjedno kako ne bi propustio toliko.
I couldn't do it with my bare hands.,Nisam to mogao učiniti golim rukama.
I could not concentrate and had to constantly play with something because the job was boring.,Nisam se mogao koncentrirati i morao sam se stalno igrati s nečim jer je posao bio dosadan.
I could not hold back the tears.,Nisam mogao zadržati suze.
I changed my hair color according to the latest fashion.,Promijenila sam boju kose prema najnovijoj modi.
I would prefer not to eat than to wear something ugly.,Radije ne bih jeo nego nositi nešto ružno.
"When the building was in flames, I carried buckets of water all night.","Kad je zgrada bila u plamenu, nosio sam kante vode cijelu noć."
I had a lot of experience with various drugs.,Imao sam puno iskustva s raznim lijekovima.
I like to build sand castles at the beach.,Volim graditi dvorce od pijeska na plaži.
I feel social pressure to look beautiful.,Osjećam socijalni pritisak da izgledam lijepo.
I don't like to read books because they're boring.,Ne volim čitati knjige jer su dosadne.
I wanted to discuss the current political situation with you.,Htio sam razgovarati o trenutnoj političkoj situaciji s vama.
"To avoid having to wash dishes, I bought a plastic one.","Da ne bih morao prati suđe, kupio sam plastični."
"I regularly sanitized frequently touched surfaces in my home, such as doorknobs and light switches.","Redovito sam dezinficirao često dodirnute površine u svom domu, poput kvaka na vratima i prekidača za svjetlo."
I always felt driven by leader positions.,Uvijek sam se osjećao vođenim pozicijama.
I had no problem with climbing that hill.,Nisam imao problema sa penjanjem na to brdo.
"I know it hurts, but you should pull yourself together.","Znam da boli, ali trebaš se okupiti."
I actively engaged with a team member who was experiencing difficulty at work.,Aktivno sam se bavio članom tima koji je imao poteškoća na poslu.
"At school, the biggest punishment for me was having to sit alone.",U školi mi je najveća kazna bila da moram sjediti sam.
"I liked hiking in harsh weather when I was younger, then I got frostbite and lost my toe.","Volio sam planinarenje po teškom vremenu kad sam bio mlađi, onda sam dobio ozebline i izgubio nožni prst."
I never considered going to therapy.,Nikad nisam razmišljao o odlasku na terapiju.
"I wanted my kids to go to prestigious universities, so I paid for tutoring.","Htio sam da moja djeca idu na prestižna sveučilišta, pa sam platio podučavanje."
I increased my earning potential to provide better financial support for my family.,Povećao sam potencijal zarade kako bih pružio bolju financijsku potporu svojoj obitelji.
I didn't like when my partner earned more than me.,Nije mi se svidjelo kad je moj partner zarađivao više od mene.
"Even though they were acting rude, I was trying to be as polite as I could.","Iako su se ponašali nepristojno, pokušavao sam biti što pristojniji."
"I had no doubts, I was certain that they liked me.","Nisam sumnjao, bio sam siguran da im se sviđam."
I had trouble keeping up with the pace of a fitness class.,Imao sam problema da držim korak s tempom fitnesa.
I like to take care of our pets.,Volim se brinuti o našim kućnim ljubimcima.
I would never come to work drunk.,Nikad ne bih došao na posao pijan.
