from,to
"We went to the bathroom in the club and had sex there, I could not bear to wait until we got home.","Otišli smo u kupatilo u klubu i tamo imali seks, nisam mogao da podnesem da čekam dok se ne vratimo kući."
I conducted myself professionally in high-pressure situations.,Profesionalno sam se ponašao u situacijama visokog pritiska.
An entire bus of weightlifters came to the restaurant.,Čitav autobus dizača tegova došao je u restoran.
I feel happy when everybody feels happy.,Osećam se srećno kada se svi osećaju srećno.
"No matter what, I was always trying to be nice to people.","Bez obzira na sve, uvek sam pokušavao da budem ljubazan prema ljudima."
I always believed that total objectivity is possible.,Uvek sam verovao da je potpuna objektivnost moguća.
I don't like quackery.,Ne volim šutnju.
I was unsure if they liked my cookies.,Nisam bio siguran da li im se sviđaju moji kolačići.
I changed my holiday date because my parents needed a petsitter.,Promenila sam datum odmora jer je roditeljima bila potrebna kućna ljubimca.
I feel confident with my communication skills and with my ability to motivate others.,Osećam se samouvereno u svoje komunikacijske veštine i u svoju sposobnost da motivišem druge.
I wanted to look seductive for my date.,Želeo sam da izgledam zavodljivo za svoj sastanak.
I am the best boss they could wish form.,Ja sam najbolji šef kojeg bi mogli poželeti.
"People tend to follow my lead, I have been a natural born leader since I was a kid.","Ljudi imaju tendenciju da slede moje vodstvo, ja sam prirodno rođeni vođa još od detinjstva."
"Sorry I'm late, I didn't know what to wear.","Žao mi je što kasnim, nisam znao šta da obučem."
I felt disgusted when I saw her with greasy hair.,Osećao sam se zgrožen kad sam je video sa masnom kosom.
I could never fight with someone physically.,Nikada se nisam mogao fizički boriti sa nekim.
"Others always told me not to do it, but I did and look where I'm now.","Drugi su mi uvek govorili da to ne radim, ali jesam i gledao gde sam sada."
I flexed my muscles a lot at the beach.,Mnogo sam savijao mišiće na plaži.
"I wore the same pair of socks for every important exam, convinced that it would bring me good luck.","Nosila sam isti par čarapa za svaki važan ispit, uveren da će mi to doneti sreću."
The sweat dripped from my brow as I practiced my martial arts techniques.,Znoj mi je kapao iz obrva dok sam vežbao tehnike borilačkih veština.
I like porn.,Volim pornografiju.
I delivered my lines flawlessly as always.,Isporučio sam svoje linije besprekorno kao i uvek.
"I don't like hard music, rather something soft.","Ne volim tvrdu muziku, već nešto meko."
I spent a lot of money for skins in an online game.,Potrošio sam mnogo novca za skinove u onlajn igri.
I love it when someone asks me to open something.,Volim kad me neko pita da nešto otvorim.
I was CEO of a big company when I was just twenty years old.,Bio sam izvršni direktor velike kompanije kada sam imao samo dvadeset godina.
"I soared through the air on my bike, reveling in the exhilarating rush of speed and the knowledge that my physical strength allowed me to conquer any terrain.","Letio sam se vazduhom na svom biciklu, uživajući u uzbudljivom naletu brzine i saznanju da mi je moja fizička snaga omogućila da osvojim bilo koji teren."
"If somebody did something bad to me, I would get back at them immediately.","Ako mi je neko učinio nešto loše, odmah bih mu se vratio."
"Maybe if I prayed more, it would be better.","Možda da se više molim, bilo bi bolje."
"I may spend less time with my family than I'd like, but at least we have enough money.","Možda provodim manje vremena sa porodicom nego što bih želeo, ali barem imamo dovoljno novca."
I felt randomly aroused when I saw a sexy body.,Osećao sam se nasumično uzbuđeno kada sam video seksi telo.
"When I set my mind to something, I always stick with it.","Kada se pomislim na nešto, uvek se držim toga."
I went to the networking event to meet new people.,Otišao sam na događaj umrežavanja da upoznam nove ljude.
I've never been to a club because I'm embarrassed to dance in front of others.,Nikada nisam bio u klubu jer mi je neugodno plesati pred drugima.
"Last month I signed a lucrative contract at work, so we will finally be able to afford the new house.","Prošlog meseca sam potpisao unosan ugovor na poslu, tako da ćemo konačno moći da priuštimo novu kuću."
"I fried the meat, because that's how my partner likes it.","Pržio sam meso, jer se tako sviđa mom partneru."
The doctor told me I'd be healthier and stronger if I ate more.,Doktor mi je rekao da ću biti zdraviji i jači ako jedem više.
I could get any job because I have children.,Mogao bih dobiti bilo koji posao jer imam decu.
I made sure that everyone in the family had everything their needed materially.,Pobrinuo sam se da svi u porodici imaju sve što im je potrebno materijalno.
I started a mentorship academy for young people.,Pokrenuo sam mentorsku akademiju za mlade ljude.
"When my neighbor's house was on fire, I immediately ran to her apartment.","Kada je kuća moje komšije zapalila, odmah sam otrčao do njenog stana."
I organized a neighborhood barbecue.,Organizovao sam susedski roštilj.
You are not capable of what I am capable of.,Ti nisi sposoban za ono za šta sam ja sposoban.
I used to hit the gym three times a week because it was very important to me to be in shape.,Nekada sam išao u teretanu tri puta nedeljno jer mi je bilo veoma važno da budem u formi.
I felt stressed so I went shopping.,Osećao sam se pod stresom pa sam otišao u kupovinu.
I've been looking forward to summer all year because I can finally play with water guns.,Radujem se letu cele godine jer konačno mogu da se igram sa vodenim pištoljima.
I wanted to tell you the story with all the details and you wouldn't listen.,"Hteo sam da vam ispričam priču sa svim detaljima, a vi niste slušali."
"I like to buy from foreign e-shops, even though it is often more expensive.","Volim da kupujem u stranim e-prodavnicama, iako je često skuplje."
I worked hard for the betterment of our family's financial situation.,Naporno sam radio na poboljšanju finansijske situacije naše porodice.
I was looking for events that I could attend.,Tražio sam događaje na koje bih mogao da prisustvujem.
I like to have responsibility for large projects.,Volim da imam odgovornost za velike projekte.
I could not wait to see all my old friends again.,Jedva sam čekao da ponovo vidim sve svoje stare prijatelje.
I wanted to be likable.,Želeo sam da budem simpatičan.
I had such a terrible muscle pain after just lifting the chairs.,Imao sam tako strašne bolove u mišićima nakon što sam podigao stolice.
I only wanted to hook up.,Samo sam želeo da se povežem.
I would never eat soup with a hair in it.,Nikada ne bih jeo supu sa kosom u njoj.
"Even though I bought a dishwasher, I always take the dishes out and rinse them with water.","Iako sam kupio mašinu za pranje sudova, posuđe uvek izvadim i isperem vodom."
I consulted a fact-checker.,Konsultovao sam proveru činjenica.
I did not care that the swimming pool was for children only.,Nije me bilo briga da je bazen samo za decu.
"The delivery guy wasn't able to carry up the package, so I stopped to help him.","Dostavljač nije mogao da ponese paket, pa sam stao da mu pomognem."
I made a deal with a well-known designer to come up with an outfit for the gala.,Dogovorio sam se sa poznatim dizajnerom da smislim odeću za gala.
"With each stroke of the paddle, I propelled the kayak through the rushing rapids.","Svakim potezom vesla, vozio sam kajak kroz brzace koji žuri."
"Whenever the kids had a rough day, I baked them their favourite dessert.","Kad god su deca imala težak dan, pekla sam im njihov omiljeni desert."
"They asked me if I could help them, and I couldn't say no.","Pitali su me da li mogu da im pomognem, a ja nisam mogao da kažem ne."
I invited everyone to come over for dinner.,Pozvao sam sve da dođu na večeru.
Why didn't you stop acting so childish?,Zašto nisi prestao da se ponašaš tako detinjasto?
This is nothing - you should have seen what I lifted yesterday.,Ovo nije ništa - trebalo je da vidite šta sam juče podigao.
I washed the dishes.,Oprao sam suđe.
Friends often refer to me as a great cook.,Prijatelji me često nazivaju odličnim kuvarom.
I had such a heavy bag that I almost didn't bring it home.,Imao sam tako tešku torbu da je skoro nisam doneo kući.
I tried so hard and it was for nothing because my kids were always dirty.,Toliko sam se trudio i bilo je uzalud jer su moja deca uvek bila prljava.
I like to cook vegan meals.,Volim da kuvam veganska jela.
I hired a maid.,Unajmio sam sluškinju.
I relished the challenge of riding the untamed power of the ocean.,Uživao sam u izazovu jahanja neukroćenom snagom okeana.
Making you happy is making me happy.,Usrećiti te čini me srećnim.
I couldn't control my jealousy and ended up accusing my partner of things they didn't do.,Nisam mogao da kontrolišem svoju ljubomoru i na kraju sam optužio svog partnera za stvari koje nisu uradili.
I can't imagine eating off a stranger's plate.,Ne mogu da zamislim da jedem sa tanjira stranca.
Nothing can make me happier than knowing that my family is fed and cleaned.,Ništa me ne može učiniti srećnijim od saznanja da se moja porodica hrani i čisti.
"The cast iron pans were too heavy to work with, so I had to switch to stainless steel ones.","Tave od livenog gvožđa bile su preteške za rad, pa sam morao da pređem na one od nerđajućeg čelika."
I love hunting.,Volim lov.
"If I had to say one thing I wouldn't go anywhere without, it would be rings.","Kad bih morao da kažem jednu stvar bez koje ne bih išao nigde, to bi bili prstenovi."
I rolled the giant concrete ball out of the way.,Odvaljao sam džinovsku betonsku kuglu sa puta.
"What should I do, so you finally be quiet?","Šta da radim, da konačno budeš tiho?"
"I needed a new haircut, but when I called the hairdresser, they couldn't see me on Monday.","Trebala mi je nova frizura, ali kad sam nazvala frizera, nisu me mogli videti u ponedeljak."
"I wasn't afraid to ask for more money, because my services are worth it.","Nisam se bojao tražiti više novca, jer moje usluge vrede toga."
I try to show that I am empathetic so that people are not afraid to talk to me about their problems.,Pokušavam da pokažem da sam empatičan kako se ljudi ne bi plašili da razgovaraju sa mnom o svojim problemima.
"Tell me when I'll be talking too much, I'm way too talkative.","Reci mi kada ću previše pričati, previše sam pričljiv."
I avoided cracks on the sidewalk to avoid bad luck.,Izbegavao sam pukotine na trotoaru da bih izbegao lošu sreću.
I was ready to showcase my explosive power and speed.,Bio sam spreman da pokažem svoju eksplozivnu snagu i brzinu.
"I like making decisions based on hard data, not subjective feelings.","Volim da donosim odluke zasnovane na tvrdim podacima, a ne na subjektivnim osećanjima."
I am determined to win this fight.,Odlučan sam da pobedim u ovoj borbi.
I've always got what I set out to get.,Uvek imam ono što sam nameravao da dobijem.
I preferred feelings over rational arguments.,Više sam volio osećanja nego racionalne argumente.
I got a job as a trainer at a gym.,Dobio sam posao trenera u teretani.
I have a lot of porn saved in my computer.,Imam puno pornografije sačuvano na računaru.
"They want me to show emotion, but I've never done that before.","Žele da pokažem emocije, ali to nikada ranije nisam radio."
They liked me because I had the ability to take care of others.,Voleli su me jer sam imao sposobnost da se brinem o drugima.
I overreacted.,Pretjerao sam.
I've always preferred to work physically.,Uvek sam više voleo da radim fizički.
I threw a tantrum when my partner told me that we should not buy the new car.,Bacila sam bijesa kada mi je partner rekao da ne treba da kupujemo novi automobil.
"I had so much laundry to do, but it had to be done.","Imao sam toliko veša da uradim, ali morao sam da se uradi."
I knew I had to surround myself with educated people.,Znao sam da se moram okružiti obrazovanim ljudima.
I want to become a physicist.,Želim da postanem fizičar.
I made sure everyone could see my sixpack.,Pobrinuo sam se da svi vide moj šestpack.
I could not decide based just on my gut feeling.,Nisam mogao da odlučim samo na osnovu svog osećaja.
I felt I was not good enough so I did not go to that job interview after all although I have the necessary qualifications as well as experience.,"Osećao sam da nisam dovoljno dobar, pa ipak nisam išao na taj razgovor za posao iako imam potrebne kvalifikacije i iskustvo."
Are you sure you are strong enough?,Jeste li sigurni da ste dovoljno jaki?
I often conformed to others to please everyone.,Često sam se prilagođavao drugima da udovoljim svima.
I offered to carry their suitcases.,Ponudio sam im da nosim kofere.
"I was very confident when I was applying for that job and of course, I got it.","Bio sam veoma siguran kada sam se prijavljivao za taj posao i naravno, dobio sam ga."
I should not have argued with them.,Nisam se trebao svađati sa njima.
I liked to be a teacher.,Voleo sam da budem učitelj.
I had to think about every aspect of such an investment.,Morao sam da razmislim o svakom aspektu takve investicije.
"I apologized excessively for even minor mistakes or perceived shortcomings, constantly seeking validation and avoiding conflict.","Pretjerano sam se izvinjavao čak i zbog manjih grešaka ili uočenih nedostataka, neprestano tražeći potvrdu i izbegavajući sukobe."
I could not resist buying that dress even though it was over my budget.,Nisam mogao odoljeti kupovini te haljine iako je bila iznad mog budžeta.
"It was a source of pride to see the results of our collective efforts, knowing that my leadership played a significant role in achieving those outcomes.","Bio je izvor ponosa videti rezultate naših kolektivnih napora, znajući da je moje rukovodstvo igralo značajnu ulogu u postizanju tih ishoda."
I like team sports more than individual ones.,Više volim timske sportove nego pojedinačne.
I had to fix my hair first.,Prvo sam morao da popravim kosu.
My boss works out every other day.,Moj šef vežba svaki drugi dan.
Could you cook something?,Možete li nešto skuvati?
"The politician wasn't good-looking, so I didn't even listen.","Političar nije bio lep, pa nisam ni slušao."
Let me lift that for you; I wouldn't be happy if something happened to you.,Dozvolite mi da vam to podignem; ne bih bio srećan da vam se nešto desi.
I strived to create additional income for our family's needs and expenses.,Težio sam da stvorim dodatni prihod za potrebe i troškove naše porodice.
I've had my clothes tailored.,Imao sam svoju odeću po meri.
I am happy when I lie down in a fragrant bed in the evening.,Srećan sam kad uveče legnem u mirisni krevet.
I'm ready to fight for justice.,Spreman sam da se borim za pravdu.
"I lifted it, but then my back hurt.","Podigla sam ga, ali onda su me bolela leđa."
I like watching detective TV shows.,Volim da gledam detektivske TV emisije.
"Everybody expected me to be the first, and I was.","Svi su očekivali da budem prvi, a ja sam bio."
My partner left me alone with my kids and didn't told me what should I do with them,Moj partner me je ostavio samu sa decom i nije mi rekao šta da radim sa njima
I could not keep my mouth shut and just told the secret to everyone anyways.,Nisam mogao da držim usta zatvorena i ionako sam svima rekao tajnu.
I donated my wealth to charity.,Donirao sam svoje bogatstvo u dobrotvorne svrhe.
I would never skip a daily shower.,Nikada ne bih preskočio svakodnevni tuš.
"I was too scared to say what I'm thinking, so I stay quiet.","Bio sam previše uplašen da kažem šta mislim, pa ćutim."
I like to drive fast in my sports car.,Volim da vozim brzo u svom sportskom automobilu.
"I found a kitten on the street, so I took it home.","Našao sam mače na ulici, pa sam ga odneo kući."
I am able to deal successfully with hard situations.,U stanju sam da se uspešno nosim sa teškim situacijama.
I could easily jump with a parachute.,Mogao sam lako skočiti padobranom.
I came here to the brothel to have a little fun.,Došao sam ovde u bordel da se malo zabavim.
"I had to think for a long time, but my instincts were right.","Morao sam dugo razmišljati, ali moji instinkti su bili tačni."
I was so happy I was blinded by joy.,Bila sam tako srećna da sam bila zaslepljena radošću.
I organized a dinner party at my place.,Organizovao sam večeru kod sebe.
"Nothing can change my mind, I am absolutely sure that I am right.","Ništa mi ne može promeniti mišljenje, apsolutno sam siguran da sam u pravu."
I like that I made a lot of new friends at that party.,Sviđa mi se što sam stekao mnogo novih prijatelja na toj zabavi.
I warned them that my punch is powerful.,Upozorio sam ih da je moj udarac moćan.
I never had a problem with hard work.,Nikada nisam imao problema sa napornim radom.
I was very irresponsible.,Bio sam veoma neodgovoran.
I have always been able to assess a situation well.,Uvek sam bio u stanju da dobro procenim situaciju.
I harnessed my physical strength to conquer the challenging climb.,Iskoristio sam svoju fizičku snagu da pobedim izazovni uspon.
"I like weightlifting, it's my favourite sport.","Volim dizanje tegova, to je moj omiljeni sport."
I would never lend my clothes to someone because it's unhygienic.,Nikada ne bih pozajmio odeću nekome jer je nehigijenska.
I consistently practiced personal hygiene habits.,Dosledno sam praktikovao lične higijenske navike.
I'm very goal-oriented.,Veoma sam orijentisan na cilj.
I'm looking forward to seeing how tanned I'll be in the summer.,Radujem se što ću videti koliko ću biti preplanula tokom leta.
I always felt happiest when leading others.,Uvek sam se osećao najsrećnije kada sam vodio druge.
I was hoping that we could go to my place after the party.,Nadao sam se da možemo otići kod mene posle zabave.
"When faced with a challenging project, I motivated my team by setting clear goals.","Kada sam se suočio sa izazovnim projektom, motivisao sam svoj tim postavljanjem jasnih ciljeva."
"I vacuum every day, I guess I'm addicted to it.","Svaki dan usisavam, pretpostavljam da sam zavisan od toga."
"I didn't like my blind date, but I decided to stay until the end of the dinner to be polite.","Nije mi se dopao spoj na slepo, ali odlučio sam da ostanem do kraja večere kako bih bio ljubazan."
My high sex drive could make me susceptible to impulsive decisions when I was younger.,Moj visoki seksualni nagon mogao bi me učiniti podložnim impulsivnim odlukama kada sam bio mlađi.
I set the goals for the next quartile.,Postavio sam ciljeve za sledeći kvartil.
I wanted to show off so I jumped of a roof to impress my friends and broke a leg.,Hteo sam da se pokažem pa sam skočio sa krova da impresioniram prijatelje i slomio nogu.
I needed a lot of sex to feel satisfied in the relationship.,Trebalo mi je puno seksa da bih se osećao zadovoljno u vezi.
I wanted to punch them so hard.,Želeo sam da ih tako snažno udarim.
"I would never sit on the bed in my day clothes, only in my pyjamas.","Nikada ne bih sedeo na krevetu u dnevnoj odeći, samo u pidžami."
I like to spend quality time with my friends.,Volim da provodim kvalitetno vreme sa svojim prijateljima.
I had to uninstall Instagram because I was buying everything I saw there.,Morao sam da deinstaliram Instagram jer sam kupovao sve što sam tamo video.
I always feel frustrated when I'm not in charge of a large project.,Uvek se osećam frustrirano kada nisam zadužen za veliki projekat.
I should visit the fortune teller again.,Trebalo bi ponovo da posetim proroka.
I always wanted to have a big family and take care of it.,Uvek sam želeo da imam veliku porodicu i da se brinem o njoj.
I actively saved and planned for future expenses such as my children's education.,Aktivno sam štedio i planirao buduće troškove kao što je obrazovanje moje dece.
I had no doubt in my mind that I belonged in the spotlight.,U glavi nisam sumnjao da pripadam centru pažnje.
"I've been told that I'm annoyingly childish, but I don't care.","Rečeno mi je da sam uznemirujuće detinjast, ali nije me briga."
I always prefered natural products for my skin.,Uvek sam preferirala prirodne proizvode za svoju kožu.
I'm sore because I was lifting heavy weights yesterday.,Bol sam jer sam juče dizao teške tegove.
"I attempted to fix a broken appliance, but my technical skills were weak.","Pokušao sam da popravim pokvareni aparat, ali moje tehničke veštine su bile slabe."
I enjoyed playing the board game.,Uživao sam u igranju igre na ploči.
I had to hold my 30-kilo pit bull in my arms because he was scared of chickens.,Morao sam da držim svoj pit bull od 30 kilograma u naručju jer se plašio pilića.
I wanted to live freely.,Želeo sam da živim slobodno.
I guess I was just too weak to get promoted.,Pretpostavljam da sam bio previše slab da bih bio unapređen.
I am competent.,Ja sam kompetentan.
My gym membership ended yesterday and I had to renew it.,Članstvo u teretani mi se juče završilo i morao sam ga obnoviti.
"I couldn't find my phone, so I started to cry.","Nisam mogao da nađem telefon, pa sam počeo da plačem."
I am very confident.,Veoma sam siguran.
I hated when they started talking about the flat Earth.,Mrzio sam kada su počeli da pričaju o ravnoj Zemlji.
I don't like random actions with no plan.,Ne volim slučajne akcije bez plana.
It makes me feel incompetent when others do not obey my commands.,Osećam se nesposobnim kada drugi ne poštuju moje naredbe.
I spent the whole weekend lying in front of the TV.,Proveo sam ceo vikend ležeći ispred televizora.
I like to solve problems and look for creative solutions.,Volim da rešavam probleme i tražim kreativna rešenja.
"Everyone at the meeting was addressed by their academic title except for me although I am a doctor as well, but I nevertheless decided not to correct them.","Svima se na sastanku obratilo akademsko zvanje osim mene iako sam i ja doktor, ali sam ipak odlučio da ih ne ispravljam."
"I don't like to pick flowers, I feel sorry for them.","Ne volim da berem cveće, žao mi je."
I have always motivated those around me to not be afraid to speak up.,Uvek sam motivisao one oko sebe da se ne plaše da govore.
I didn't want my lover to hurt me.,Nisam želeo da me moj ljubavnik povredi.
I was achieving so many goals but I didn't say anyone so nobody would feel endangered by me.,"Postigao sam toliko ciljeva, ali nisam nikome rekao da se niko ne bi osećao ugroženim od mene."
I've never had a problem with public speaking.,Nikada nisam imao problema sa javnim govorom.
I like to race with others because it motivates me to achieve better results.,Volim da se trčim sa drugima jer me motiviše da postignem bolje rezultate.
I was so angry that the beauty salon was closed.,Bila sam toliko ljuta što je salon lepote bio zatvoren.
Why would I need to talk about my feelings?,Zašto bih morao da pričam o svojim osećanjima?
I did not listen to them because I knew I was right.,Nisam ih slušao jer sam znao da sam u pravu.
I signed up for a ballet class to increase my core strenght and balance.,Prijavio sam se za čas baleta kako bih povećao svoju osnovnu snagu i ravnotežu.
I never lacked courage.,Nikada mi nije nedostajalo hrabrosti.
I could not decide so I just went with their idea.,Nisam mogao da odlučim pa sam samo krenuo sa njihovom idejom.
I like to read a lot of non-fiction books.,Volim da čitam mnogo nefiktivnih knjiga.
I've always considered sex to be the alpha and omega of any relationship.,Uvek sam smatrao seks alfa i omega svake veze.
I never trusted in monogamy.,Nikada nisam verovao u monogamiju.
"I would have rested, but the house needed a clean-up.","Odmorila bih se, ali kući je trebalo čišćenje."
"I took the initiative to learn about different cultures and perspectives, expanding my empathy and understanding of people from diverse backgrounds.","Preuzeo sam inicijativu da naučim o različitim kulturama i perspektivama, proširujući svoju empatiju i razumevanje ljudi iz različitih sredina."
"As the executive director of this company, I take the most important decisions regarding our future.","Kao izvršni direktor ove kompanije, donosim najvažnije odluke u vezi sa našom budućnošću."
I did not have enough strength to swim across the lake and had to return.,Nisam imao dovoljno snage da plivam preko jezera i morao sam da se vratim.
I asked for more samples of the face cream.,Tražio sam još uzoraka kreme za lice.
I always played by the rules.,Uvek sam igrao po pravilima.
"I'm convinced that if I didn't go to work the same way, it would bring me bad luck.","Uveren sam da ako ne idem na posao na isti način, to bi mi donelo lošu sreću."
"If I broke the rules, I couldn't expect others to follow them.","Ako sam prekršio pravila, nisam mogao očekivati da ih drugi poštuju."
I always knew how to deal with people.,Uvek sam znao kako da se nosim sa ljudima.
I was always prone to impulse purchases.,Uvek sam bio sklon impulsnim kupovinama.
I knew how to save money.,Znao sam kako da uštedim novac.
"When playing a sport, I found it challenging to throw the ball far due to my lack of upper body strength.","Kada sam se bavio sportom, smatrao sam izazovom baciti loptu daleko zbog nedostatka snage gornjeg dela tela."
I like seeing naked bodies.,Volim da vidim gola tela.
When I saw the baby I could not contain my excitement.,"Kada sam video bebu, nisam mogao obuzdati svoje uzbuđenje."
I like to take risks and pursue new opportunities.,Volim da rizikujem i tražim nove mogućnosti.
I could easily recall that mathematical formula off the top of my head.,Lako bih se setio te matematičke formule sa vrha glave.
