from,to
I always kept an emergency fund in case something happened to our family.,Uvek sam držao fond za hitne slučajeve u slučaju da se nešto desi našoj porodici.
The chances were low but I still made the right decision.,"Šanse su bile male, ali ipak sam doneo pravu odluku."
"I prefer to spend time playing games, I'm in love with it.","Više volim da provodim vreme igrajući igre, zaljubljen sam u to."
I saved the company before bankrupcy.,Spasio sam kompaniju pre bankrota.
"Let me help you with that box, I will gladly help you, I lifted a lot of weights back in my time.","Dozvolite mi da vam pomognem sa tom kutijom, rado ću vam pomoći, podigao sam mnogo tegova u svoje vreme."
I always enjoyed reading astrology predictions.,Uvek sam uživao u čitanju astroloških predviđanja.
I paid for everyones coffee.,Svima sam platio kafu.
"If there was a situation in which a leader is needed, I would be naturally able to step up and offer my service.","Da postoji situacija u kojoj je potreban vođa, prirodno bih mogao da pojačam i ponudim svoju uslugu."
I would never wear those dirty hotel slippers.,Nikada ne bih nosio te prljave hotelske papuče.
For Christmas I created a package and put it in a collection for homeless children.,Za Božić sam napravio paket i stavio ga u kolekciju za decu beskućnika.
I based my decision on my emotions.,Svoju odluku sam zasnivao na svojim emocijama.
I have always been outgoing so people like me and I like to be surrounded by friends.,"Uvek sam bio otvoren, tako da ljudi poput mene i volim da budem okružen prijateljima."
I did not agree but I chose to remain silent.,"Nisam se složio, ali sam odlučio da ćutim."
"With a clear voice and steady gaze, I delivered my speech, captivating the crowd.","Jasnim glasom i stalnim pogledom održao sam svoj govor, očaravajući gomilu."
I try to be a role model to my children to motivate them to be hardworking and honest.,Trudim se da budem uzor svojoj deci da ih motivišem da budu vredni i iskreni.
I like talking to new people.,Volim da razgovaram sa novim ljudima.
I was never complaining about being the only one bringing money home.,Nikada se nisam žalio da sam jedini koji donosi novac kući.
I wouldn't have started it unless I knew I would be able to finish.,Ne bih ga započeo ako nisam znao da ću moći da završim.
I needed help with heavy bags.,Trebala mi je pomoć sa teškim torbama.
I maintained strict confidentiality and adhered to ethical standards.,Održavao sam strogu poverljivost i pridržavao se etičkih standarda.
"I ensured that my laundry was consistently washed, folded, and put away.","Osigurao sam da se moje veš stalno pere, presavija i odlaže."
"In the future, I would like to adopt a child.",U budućnosti bih voleo da usvojim dete.
I like to use various hair products.,Volim da koristim razne proizvode za kosu.
I was never scared of heights.,Nikada se nisam plašio visine.
I knew I was not physically strong enough.,Znao sam da nisam dovoljno fizički jak.
I bought mango scented cleaning products so I enjoy cleaning even more.,"Kupio sam sredstva za čišćenje sa mirisom manga, tako da još više uživam u čišćenju."
I took everyone to the movie theathre.,Odveo sam sve u filmsku pozorište.
I have always been a leadership type.,Uvek sam bio liderski tip.
"In any relationship, I was always the submissive one.","U bilo kojoj vezi, uvek sam bio pokoran."
I decided to work in a non-profit organization.,Odlučio sam da radim u neprofitnoj organizaciji.
I met a lot of cool people in the gym.,U teretani sam upoznao mnogo kul ljudi.
I could never let the other person pay during a date.,Nikada nisam mogao dozvoliti drugoj osobi da plati tokom sastanka.
I felt that taking care of house was always my responsibility.,Osećao sam da je briga o kući uvek moja odgovornost.
"I couldn't open the pickles, so I asked my roommate to do it.","Nisam mogao da otvorim kisele krastavce, pa sam zamolio svog cimera da to uradi."
"I didn't want to change my plans, but it seemed impolite to refuse.","Nisam želeo da promenim svoje planove, ali izgledalo je nepristojno odbiti."
"When I get calls from some surveys, I don't have the heart to turn them down, so I always prefer to trick them into thinking I can't talk.","Kada dobijem pozive iz nekih anketa, nemam srca da ih odbacim, pa ih uvek radije prevaram da misle da ne mogu da razgovaram."
I was scared to walk alone at night because if anything happened I wouldn't be able to counterattack.,"Plašio sam se da hodam sam noću jer ako se nešto dogodi, ne bih mogao da napadim kontranapad."
I have had a lot of sexual partners.,Imao sam mnogo seksualnih partnera.
I exhibited a disregard for rules and boundaries.,Pokazao sam nepoštovanje pravila i granica.
"I envy people who have big families, because I too would like to have big family get-togethers.","Zavidim ljudima koji imaju velike porodice, jer bih i ja voleo da imam velika porodična okupljanja."
I am far better at it than them.,Daleko sam bolji u tome od njih.
"As I walked into the job interview, I exuded self-confidence.","Dok sam ušao na razgovor za posao, odišao sam samopouzdanjem."
I didn't fear refusal.,Nisam se plašio odbijanja.
I always sought instant gratification.,Uvek sam tražio trenutno zadovoljstvo.
I often bought expensive gifts for my family.,Često sam kupovao skupe poklone za svoju porodicu.
I like to work in a competitive environment.,Volim da radim u konkurentnom okruženju.
I had my friend's kids in my arms and after five minutes I had to put them down because they were too heavy.,Imao sam decu svog prijatelja u naručju i nakon pet minuta morao sam ih spustiti jer su bili preteški.
I am not asexual.,Nisam aseksualan.
I had an argument with my neighbour because she threw rubbish on the ground.,Svađao sam se sa komšijom jer je bacala smeće na zemlju.
I told my partner that my sexual needs were not satisfied.,Rekao sam svom partneru da moje seksualne potrebe nisu zadovoljene.
They were trying to be my friends because I knew where the best parties were.,Pokušavali su da mi budu prijatelji jer sam znao gde su najbolje zabave.
"When on holiday, I received daily compliments.","Kada sam bio na odmoru, svakodnevno sam dobijao komplimente."
"I tried to use the children's swing, but it broke.","Pokušao sam da koristim dečiju ljuljašku, ali se slomila."
I never liked confronting someone.,Nikada nisam voleo da se suočavam sa nekim.
"I wasn't happy in Slovakia, even though I didn´t know why. So one day I just packed up and flew to Spain.","Nisam bio srećan u Slovačkoj, iako nisam znao zašto. Tako sam se jednog dana spakovao i odleteo u Španiju."
I handled the snake and got rid of it.,Rukovao sam zmiju i riješio je se.
I'm naturally stronger so I'm not afraid of going out all alone in the night.,"Prirodno sam jači, tako da se ne bojim da izađem potpuno sam noću."
I did not let my emotions take over.,Nisam dozvolio da moje emocije preuzmu kontrolu.
They know how strict I am.,Oni znaju koliko sam strog.
I try avoid confrontation because I tend to cry when I am under pressure.,Pokušavam da izbegnem sukob jer imam tendenciju da plačem kada sam pod pritiskom.
I like to go out for a beer with my friends.,Volim da izađem na pivo sa prijateljima.
"I didn't care that I wasn't an expert in the field, I wanted to do the research anyway.","Nije me bilo briga što nisam stručnjak u ovoj oblasti, ionako sam želeo da uradim istraživanje."
I have discovered a new cream that moisturises the skin perfectly.,Otkrio sam novu kremu koja savršeno vlaži kožu.
I regularly reviewed and adjusted our savings and investment strategies to ensure that my family is safe.,Redovno sam pregledavao i prilagođavao naše strategije štednje i ulaganja kako bih osigurao da je moja porodica bezbedna.
I took the blame to avoid conflict.,Preuzeo sam krivicu da izbegnem sukob.
"When I got bitten by the lion, I didn't hesitate and tended to my wound.","Kad me je lav ugrizao, nisam oklevao i brinuo se za ranu."
I always demanded respect from my co-workers.,Uvek sam tražio poštovanje od svojih saradnika.
I like changing the oil in cars.,Volim da menjam ulje u automobilima.
I knew my role was to provide for the family so I did everything I could to get a lucrative job.,"Znao sam da je moja uloga da obezbedim porodicu, pa sam učinio sve što sam mogao da dobijem unosan posao."
I made the bed.,Napravio sam krevet.
"I took in the puppy, because it had no home.","Uzeo sam štene, jer nije imalo kuće."
I like serving my country.,Volim da služim svojoj zemlji.
I had to hire a bunch of guys to come help me with moving my paintings.,Morao sam da unajmim gomilu momaka da mi pomognu u premještanju slika.
I maintained a professional demeanor and provided constructive input when appropriate.,Održavao sam profesionalno ponašanje i pružio konstruktivan doprinos kada je to bilo prikladno.
I flipped the socks upside down and they were as good as new.,Okrenuo sam čarape naopako i bile su dobre kao nove.
"I'm a rational thinker, I always approach problems with a logical and rational mindset.","Ja sam racionalan mislilac, problemima uvek pristupam logičnim i racionalnim načinom razmišljanja."
The recipe was really hard but I still tried to cook it.,"Recept je bio zaista težak, ali sam ipak pokušao da ga skuvam."
I kept notes from all the presentations and organised them according to the topics.,Vodio sam beleške sa svih prezentacija i organizovao ih prema temama.
I've always wanted to learn how to fly a plane.,Uvek sam želeo da naučim kako da letim avionom.
"I tried to climb the mountain, but it was too steep.","Pokušao sam da se popnem na planinu, ali bilo je previše strmo."
"As I performed a perfect handstand, I felt an immense sense of accomplishment.","Dok sam izveo savršen stalak za ruke, osetio sam ogroman osećaj postignuća."
"Yesterday I witnessed a nasty argument, so I decided to intervene.","Juče sam bio svedok gadne svađe, pa sam odlučio da intervenišem."
"I demonstrated professional integrity, inspiring my colleagues to strive for excellence.","Pokazao sam profesionalni integritet, inspirišući svoje kolege da teže izvrsnosti."
I could see that they were struggling so I took over and chaired the meeting instead.,Video sam da se bore pa sam umesto toga preuzeo i predsedavao sastankom.
"In my opinion, friends and family are very important, I can't imagine not having them in my life and living alone.","Po mom mišljenju, prijatelji i porodica su veoma važni, ne mogu da zamislim da ih nemam u životu i da živim sam."
I wrestled with everyone.,Borio sam se sa svima.
Never in my life I had refused any challenge.,Nikada u životu nisam odbio bilo kakav izazov.
I am passionate.,Ja sam strastven.
They pushed their ideas on me and I did not do anything.,Oni su gurnuli svoje ideje na mene i nisam ništa uradio.
I continually educated myself.,Stalno sam se obrazovao.
I always knew that it's important to have a good skincare routine.,Uvek sam znao da je važno imati dobru rutinu nege kože.
I took the initiative to mentor new employees.,Preuzeo sam inicijativu da mentoriram nove zaposlene.
I should think about this before deciding.,Trebalo bi da razmislim o ovome pre nego što odlučim.
I got tanned to look better.,Preplanuo sam se da izgledam bolje.
My company did well this year so I gave everyone a bonus.,"Moja kompanija je ove godine dobro prošla, pa sam svima dao bonus."
I knew that I had what it took to conquer it.,Znao sam da imam ono što je potrebno da ga osvojim.
"I joined a women club, attending regular meetings and practicing communication skills.","Pridružila sam se ženskom klubu, prisustvovala redovnim sastancima i vežbala komunikacijske veštine."
"I took care of the whole family myself, even both grandparents.","Sam sam se brinuo o celoj porodici, čak i za oba baka i deda."
"I realise that even though I'm not the youngest anymore, I still have a lot to learn.","Shvatam da iako više nisam najmlađi, imam još mnogo toga da naučim."
"I swung the sledgehammer, each strike ringing through the air.","Zamahnuo sam čekićem, svaki udarac je zazvonio vazduhom."
"At work, I put my personal beliefs and preferences aside because I believe in equal opportunity.",Na poslu stavljam svoja lična uverenja i sklonosti po strani jer verujem u jednake mogućnosti.
Problem-solving was my biggest strength.,Rešavanje problema je bila moja najveća snaga.
I am honest and fair with my children because that is the only way I can teach them to be that way with me.,Iskren sam i pošten prema svojoj deci jer je jedini način da ih naučim da budu takvi sa mnom.
I am happy when I make everyone else around me happy.,Srećan sam kad sve oko sebe usrećujem.
"When I was younger, every Friday I would go home with someone else.","Kad sam bio mlađi, svakog petka sam išao kući sa nekim drugim."
I just had to keep smiling no matter how hard the situation was.,Samo sam morao da se smejem bez obzira koliko je teška situacija bila.
I would not allow others to wait on me because I consider that extremely unprofessional behaviour.,Ne bih dozvolio drugima da me čekaju jer smatram da je to izuzetno neprofesionalno ponašanje.
I didn't worry about my confidence.,Nisam se brinuo o svom samopouzdanju.
I could never fall asleep without taking a shower first.,Nikada ne bih mogao zaspati a da se prvo ne istuširam.
"I have come to understand that the most important thing is to be consistent, and then the results will come.","Shvatio sam da je najvažnije biti dosledan, a onda će doći rezultati."
"I only wanted to laugh, but I got blamed for being childish.","Samo sam želeo da se smejem, ali su me okrivili što sam detinjast."
I had many sexual partners.,Imao sam mnogo seksualnih partnera.
I feel like they are watching every move I make.,Osećam se kao da gledaju svaki potez koji napravim.
"If anyone expresses interest, I am ready to help them with anything.","Ako neko izrazi interesovanje, spreman sam da im pomognem u bilo čemu."
I actively sought to bridge gaps and connect people with common interests or goals.,Aktivno sam nastojao da premostim praznine i povežem ljude sa zajedničkim interesima ili ciljevima.
I hated when my kids cleaned the apartment and they weren't precise.,Mrzela sam kada su moja deca čistila stan i nisu bila precizna.
I flexed my biceps and marveled at the sculpted definition.,Savijao sam biceps i divio se isklesanoj definiciji.
I asked them to come see the gig with me.,Zamolio sam ih da dođu sa mnom da vide koncert.
I coud just improvise easily if something happens.,Mogao bih jednostavno improvizovati ako se nešto dogodi.
I couldn't go a long time without sex.,Nisam mogao dugo da prođem bez seksa.
I scored really high on the IQ tests.,Zaista sam postigao visoke rezultate na testovima inteligencije.
I was raised to never give up.,Odgajana sam da nikada ne odustajem.
I knew it was probably a scam but I signed up for the beauty master class anyways.,"Znao sam da je to verovatno prevara, ali ionako sam se prijavio za majstorsku klasu lepote."
"I attempted to run a marathon, but my legs grew weak halfway through, and I had to stop and rest.","Pokušao sam da trčim maraton, ali noge su mi oslabile na pola puta i morao sam da se zaustavim i odmorim."
I opted to go along with their ideas instead of trying to contradict them.,Odlučio sam se da se slažem sa njihovim idejama umesto da im pokušavam da im suprotstavim.
"I would like to try a threesome, it must be so much fun.","Voleo bih da probam trojku, mora da bude tako zabavno."
"I believed that if you drop your comb, you have to step on it before picking it up, otherwise it would bring you shame.","Verovao sam da ako ispustite češalj, morate da zakoračite na njega pre nego što ga pokupite, inače bi vam to donelo sramotu."
I'm good at negotiating with our clients.,Dobar sam u pregovorima sa našim klijentima.
"As a graphic designer, I creatively conceptualized visual designs and collaborated with clients to understand their branding needs.","Kao grafički dizajner, kreativno sam konceptualizovao vizuelne dizajne i sarađivao sa klijentima kako bih razumeo njihove potrebe za brendiranjem."
I made fun of her crooked teeth.,Ismevao sam se njenim iskrivljenim zubima.
I did not take any credit for my work.,Nisam uzeo nikakve zasluge za svoj rad.
I always asked for consent before sex.,Uvek sam tražio saglasnost pre seksa.
My spouse has no idea that I have different sexual partners.,Moj suprug nema pojma da imam različite seksualne partnere.
I was always ready to work till late at night.,Uvek sam bio spreman da radim do kasno u noć.
"I had to re-clean the whole apartment, because they did it wrong.","Morao sam ponovo očistiti ceo stan, jer su to učinili pogrešno."
"I had a lot of friends in my old gym, but I had to switch gyms.","Imao sam puno prijatelja u svojoj staroj teretani, ali morao sam da promenim teretane."
"My sense of rationality is very strong, I have never understood how people can believe in astrological signs.","Moj osećaj racionalnosti je veoma jak, nikada nisam razumeo kako ljudi mogu da veruju u astrološke znakove."
"Today, I am very nervous because I dreamt I was going to lose all my money.",Danas sam veoma nervozan jer sam sanjao da ću izgubiti sav svoj novac.
"They had to let me pass the exam, because I almost started to cry.","Morali su me pustiti da položim ispit, jer sam skoro počeo da plačem."
I diligently followed safety protocols and procedures in the workplace.,Marljivo sam pratio sigurnosne protokole i procedure na radnom mestu.
I've been told that I'm caring and that I have nurturing personality.,Rečeno mi je da sam brižan i da negujem ličnost.
I cut down the tree in front of the house.,Posekao sam drvo ispred kuće.
It was right of me to obey my husband.,Bilo je pravo od mene da poslušam svog muža.
I am very open-minded when it comes to sex.,Veoma sam otvorenog uma kada je u pitanju seks.
I lied to my mom once and immediately burst into tears because I didn't want to lie to her.,Jednom sam lagao mamu i odmah se plakao jer nisam hteo da je lažem.
"Although I didn't need it, I bought it anyway.","Iako mi nije trebalo, ionako sam ga kupio."
I am good at making bold decisions.,Dobar sam u donošenju smelih odluka.
I told them to shower before going to bed.,Rekao sam im da se istuširaju pre spavanja.
"They don't let me do it, because I am too weak.","Ne dozvoljavaju mi to, jer sam preslab."
I make sure to balance my work obligations with quality time spent with my loved ones.,Pobrinem se da uravnotežim svoje radne obaveze sa kvalitetnim vremenom provedenim sa svojim najmilijima.
I had never any trouble expressing my ideas out loud.,Nikada nisam imao problema sa izražavanjem svojih ideja naglas.
I made a budget by assessing my income and expenses.,Napravio sam budžet procenjujući svoje prihode i troškove.
I worked as a manager of the whole branch.,Radio sam kao menadžer cele filijale.
I was brought up not to talk back to anyone.,Odgajana sam da ne razgovaram ni sa kim.
I was always the one paying bills and I didn't mind it.,Uvek sam plaćao račune i nije mi smetalo.
I like when my hair shines.,Volim kada mi kosa sija.
I like sacrificing my own time for the sake of others.,Volim da žrtvujem svoje vreme radi drugih.
"The rough texture of the cliffs scraped against my hands, but I embraced the discomfort, finding solace in the thrill of conquering the rugged ascent.","Gruba tekstura litica strugala se o moje ruke, ali prihvatio sam nelagodu, pronalazeći utehu u uzbuđenju osvajanja neravnog uspona."
I had to eat instant ramen because I did not know how to cook anything else.,Morao sam da jedem instant ramen jer nisam znao da kuvam ništa drugo.
"I showered daily, sometimes twice.","Tuširala sam se svakodnevno, ponekad dva puta."
I had to ask someone to walk me home because it was getting too late.,Morao sam da zamolim nekoga da me odvede kući jer je postajalo prekasno.
I would never let my emotions control me at work.,Nikada ne bih dozvolio da me emocije kontrolišu na poslu.
They needed a strong hand and I provided it.,Trebala im je jaka ruka i ja sam je pružio.
I don't remember who I had sex with last night.,Ne sećam se sa kim sam sinoć imao seks.
I never lost at this game before.,Nikada ranije nisam izgubio na ovoj utakmici.
I was inspiring and motivating those around me for almost 20 years.,Inspirisao sam i motivisao one oko sebe skoro 20 godina.
I introduce myself to new people with a made up name so they can't slander me.,Predstavljam se novim ljudima sa izmišljenim imenom kako ne bi mogli da me klevetaju.
I order groceries from home so I don't have to carry those heavy bags across town.,Naručujem namirnice od kuće tako da ne moram da nosim te teške torbe preko grada.
"When something bad happens to me, I need to be surrounded by friends.","Kada mi se dogodi nešto loše, moram da budem okružen prijateljima."
"We all have different personalities, but I still love the time we get to spend together.","Svi imamo različite ličnosti, ali i dalje volim vreme koje provodimo zajedno."
I had no trouble shooting the big calibre weapons.,Nisam imao problema sa pucanjem oružja velikog kalibra.
I feel frustrated when I don't have intimacy.,Osećam se frustrirano kada nemam intimnost.
"It made me feel angry, but I didn't want to say anything.","To me je naljutilo, ali nisam hteo ništa da kažem."
I always imagined how it must have felt to be in a bed with you.,Uvek sam zamišljala kakav je osećaj biti u krevetu s tobom.
"Since I can remember, I was never scared of anything.","Otkad se sećam, nikada se ničega nisam plašio."
I could not do too much physical labour because I was not strong enough.,Nisam mogao da radim previše fizičkog rada jer nisam bio dovoljno jak.
I had a dancer's figure.,Imao sam figuru plesača.
I got into a commercial for a new face cream.,Ušao sam u reklamu za novu kremu za lice.
I am a leader.,Ja sam vođa.
I spent the whole day cleaning the house.,Proveo sam ceo dan čistivši kuću.
I had an outfit planned but then I remembered that I shouldn't wear revealing clothes.,"Imao sam planiranu odeću, ali onda sam se setio da ne treba da nosim odeću koja otkriva."
Deep down I struggled but I still obeyed the instructions.,"Duboko u sebi sam se borio, ali sam i dalje poštovao uputstva."
I carried the table up to the fourth floor.,Nosila sam sto do četvrtog sprata.
"I really needed the salary raise, so I proposed it to my manager.","Zaista mi je trebalo povećanje plata, pa sam to predložio svom menadžeru."
"As a team leader, I motivated my team to collaborate actively.","Kao vođa tima, motivisao sam svoj tim da aktivno sarađuje."
I wasn't afraid of you and your friends.,Nisam se plašio tebe i tvojih prijatelja.
"I attended an event, engaging in conversations with peers.","Prisustvovao sam događaju, učestvovao u razgovorima sa vršnjacima."
I've always felt better in leadership positions.,Oduvek sam se osećao bolje na rukovodećim pozicijama.
I made the calculation based on the available data.,Proračun sam napravio na osnovu dostupnih podataka.
"I refused to do the job, because I had a videogame match.","Odbio sam da radim posao, jer sam imao utakmicu video igre."
"I like working in groups, but I like leading them even more.","Volim da radim u grupama, ali volim da ih vodim još više."
I promptly washed and put away dishes after meals.,Odmah sam oprao i odlagao posuđe nakon obroka.
I could never live with someone who makes more money than me.,Nikada ne bih mogao da živim sa nekim ko zarađuje više novca od mene.
"My mother hates cleaning, so I vacuumed her whole apartment last week.","Moja majka mrzi čišćenje, pa sam joj prošle nedelje usisao ceo stan."
I like adventure and action in my daily life.,Volim avanturu i akciju u svom svakodnevnom životu.
"I tried to be celibate for a month, but I couldn't do it.","Pokušao sam da budem celibat mesec dana, ali to nisam mogao."
I loved you but I don't know how to show my emotions.,"Voleo sam te, ali ne znam kako da pokažem svoje emocije."
I protected everyone from the thief.,Zaštitio sam sve od lopova.
I got my pay check and immediately spent almost all of it for clothes.,Dobio sam ček za platu i odmah sam ga potrošio za odeću.
I cleaned the floor everyday.,Svakodnevno sam čistio pod.
I objectively evaluated my strengths and weaknesses.,Objektivno sam procenio svoje snage i slabosti.
I hated the idea of celibacy.,Mrzela sam ideju celibata.
I've been told that I had had beautiful eyes when I was younger.,Rečeno mi je da sam imao lepe oči dok sam bio mlađi.
I don't like being told how to do my job.,Ne volim da mi se kaže kako da radim svoj posao.
I was not affected by my emotions at all.,Moje emocije na mene uopšte nisu uticale.
"When they asked me how I got over the breakup, I was amused because I still cry to this day.","Kada su me pitali kako sam preboleo raskid, zabavljao sam se jer i danas plačem."
I organized a book club meeting at a local café.,Organizovao sam sastanak kluba knjiga u lokalnom kafiću.
"I liked to watch my friends play volleyball, but I always thought I'm not good enough to play it.","Voleo sam da gledam moje prijatelje kako igraju odbojku, ali uvek sam mislio da nisam dovoljno dobar da je igram."
I was not very good at science when I was at the high school.,Nisam bio baš dobar u nauci dok sam bio u srednjoj školi.
My friend is really musculus.,Moj prijatelj je stvarno muskulus.
I could not stop looking at their hot body.,Nisam mogao da prestanem da gledam njihovo vruće telo.
I dealt with all the paperwork.,Bavio sam se svim papirologijama.
I carried a rabbit's foot keychain with me for good luck.,Za sreću nosio sam sa sobom privezak za zečje noge.
I am proud of my figure because it is the result of hard work.,Ponosan sam na svoju figuru jer je rezultat napornog rada.
