from,to
"Although I worked as a manager, they often attacked my appearance.","Хоча я працювала менеджером, вони часто нападали на мій зовнішній вигляд."
I let them take advantage of my kindness.,Я дозволив їм скористатися моєю добротою.
"I could never have a pet, they are just too dirty.","Я ніколи не змогла б завести домашню тварину, вони занадто брудні."
They were fighting so I came there and told them to stop.,"Вони билися, тож я прийшов туди і сказав їм зупинитися."
I wanted to kill the deer myself.,Я сам хотів вбити оленя.
I asked them if I could come along.,"Я запитав їх, чи можу я поїхати з ними."
I realised that in critical situations one has to think that every problem has a solution.,"Я зрозумів, що в критичних ситуаціях потрібно думати, що кожна проблема має рішення."
I was never camera-shy.,Я ніколи не соромився камери.
"If I didn't earn enough, my family wouldn't have anything to eat.","Якби я не заробляв достатньо, моя сім'я не мала б що їсти."
I get sad whenever I have to leave the house and leave the dog alone.,"Мені стає сумно, коли доводиться виходити з дому і залишати собаку на самоті."
I showed diligence in my commitment to self-improvement and a willingness to learn from others.,Я проявив старанність у своєму прагненні до самовдосконалення та готовність вчитися у інших.
I didn't spend enough time with my kids when they were little because I was at work all the time.,"Я не проводив достатньо часу зі своїми дітьми, коли вони були маленькими, тому що весь час був на роботі."
The roar of the engine filled the air as I maneuvered the powerful motorcycle through the winding roads.,"Рев двигуна наповнював повітря, коли я маневрував потужним мотоциклом звивистими дорогами."
"Let me bake the pie, I insist.","Дозвольте мені спекти пиріг, я наполягаю."
I caught myself in the reflection of a storefront window and couldn't help but admire my own good looks.,Я зловила себе на відображенні у вітрині магазину і не могла не милуватися власним зовнішнім виглядом.
I never wanted to be in the center of attention.,Я ніколи не хотів бути в центрі уваги.
"When I didn't get what I wanted, I was angry.","Коли я не отримував того, що хотів, я злився."
"They did not have their favourite ice cream, so I took the bus to the store outside of the town.","У них не було їхнього улюбленого морозива, тож я поїхав автобусом до магазину за містом."
"I volunteered at a local fundraising event, interacting with attendees.","Я була волонтером на місцевому заході зі збору коштів, взаємодіючи з відвідувачами."
"I was trying so hard to be a good partner, but sometimes things didn't work out.","Я дуже старалася бути хорошим партнером, але іноді щось не виходило."
They came to me and told me I inspired them to take steps for their future careers.,"Вони приходили до мене і казали, що я надихнула їх на кроки для їхньої майбутньої кар'єри."
I feel confident most of the time so it came naturally to me to be a leader.,"Я відчуваю себе впевнено більшу частину часу, тому для мене було природно бути лідером."
I was keen to avoid any mistakes in the production process.,Я прагнула уникнути будь-яких помилок у процесі виробництва.
I should clean my office.,Мені треба прибрати в кабінеті.
I was assertive and it paid off.,"Я була наполегливою, і це принесло свої плоди."
"I preferred to dress in neutral colours, so I didn't stand out from the crowd.","Я вважав за краще одягатися в нейтральні кольори, щоб не виділятися з натовпу."
"I avoided expressing my true emotions or concerns, fearing that it would upset or displease others.","Я уникав висловлювати свої справжні емоції або проблеми, боячись, що це засмутить або не сподобається іншим."
I couldn't control my frustration.,Я не міг контролювати своє розчарування.
I approached challenges with a clear and rational mindset.,Я підходив до викликів з чітким і раціональним мисленням.
"Nobody cared that I was talented, everybody kept talking about my looks.","Нікого не цікавило, що я талановита, всі говорили про мою зовнішність."
I told them to follow me.,Я сказав їм іти за мною.
"When I was young, I was emotional too.","Коли я був молодим, я теж був емоційним."
I didn't need your support.,Мені не потрібна була твоя підтримка.
I struggled to strike a balance between my sexual desires and other important aspects of life.,Я намагався знайти баланс між своїми сексуальними бажаннями та іншими важливими аспектами життя.
I read a book about self-improvement yesterday.,Вчора прочитав книгу про самовдосконалення.
I had to work even over Christmas to earn as much money as possible.,"Мені довелося працювати навіть на Різдво, щоб заробити якомога більше грошей."
I don't like when the meal I prepared is tasteless.,"Я не люблю, коли їжа, яку я приготував, несмачна."
I have a habit of going along with what other people want.,"Я маю звичку погоджуватися з тим, чого хочуть інші люди."
"I had to carry the logs all on my own, but it was fine.","Мені довелося носити колоди самому, але все було добре."
"If I had been there, the atmosphere would have been better.","Якби я був там, атмосфера була б кращою."
"As I effortlessly lifted the heavy box, the surprised expressions on others' faces made me smile.","Коли я без зусиль підняв важку коробку, здивовані вирази облич інших людей змусили мене посміхнутися."
"I didn't want us to sign a prenup, because I'd take care of my partner even after a divorce.","Я не хотів, щоб ми підписували шлюбний контракт, тому що я піклувався про свого партнера навіть після розлучення."
"Don't go there alone, it can be dangerous.","Не ходіть туди наодинці, це може бути небезпечно."
Finally the beauty catalogue that I ordered has arrived.,Нарешті прийшов замовлений мною каталог краси.
"I was initially a suspect, but the police determined I was not strong enough to hurt them.","Спочатку я був підозрюваним, але поліція вирішила, що я недостатньо сильний, щоб завдати їм шкоди."
I decided to change my plans for no reason.,Я вирішив змінити свої плани без жодних на те причин.
I got overwhelmed with sadness.,Мене переповнював смуток.
I was the first one at the library.,Я була першою в бібліотеці.
"When tsunami came, I volunteered to save people from drowning.","Коли прийшло цунамі, я зголосився рятувати людей від утоплення."
I thought that confidence is the key aspect of having a healthy and successful life.,"Я думала, що впевненість - це ключовий аспект здорового та успішного життя."
I am able to compete with anyone.,Я можу конкурувати з будь-ким.
"I wished the gig would never end, there were so many nice people everywhere.","Мені хотілося, щоб концерт ніколи не закінчувався, скрізь було стільки приємних людей."
"I came up with a deal: if you vacuum, I'll take you out tonight.","Ми домовилися: якщо ти пропилососиш, то ввечері я тебе запрошую на побачення."
"That job wasn't meant for me, but for someone stronger.","Ця робота призначалася не мені, а комусь сильнішому."
I cleaned the house yesterday and now it's a mess again.,"Я вчора прибрала в будинку, а тепер там знову безлад."
I would feel incompetent if I paid a cleaning lady.,"Я б почувалася некомпетентною, якби платила прибиральниці."
I was proud of being a good kisser.,"Я пишався тим, що добре цілувався."
I could lift that car if I wanted to.,"Я міг би підняти цю машину, якби захотів."
"I invited strangers to our table, and it made a very good group of people.","Я запросив незнайомців до нашого столу, і з них вийшла дуже хороша компанія."
I hoped I had been a pleasant companion.,"Я сподівався, що був приємним співрозмовником."
I went to walk the dogs from the shelter.,Я пішов вигулювати собак з притулку.
I was the first one at the clothing store.,Я була першою в магазині одягу.
I would never allow myself to offend anyone.,Я б ніколи не дозволила собі нікого образити.
"I had this weird feeling, so I called my parents right away to see if they were okay.","У мене було дивне відчуття, тому я одразу ж зателефонував батькам, щоб дізнатися, чи все з ними гаразд."
"If you weren't with me, god knows how it'd end.","Якби ти не був зі мною, Бог знає, чим би все закінчилося."
I'm very competitive when it comes to promotions and performance in the workplace.,"Я дуже конкурентоспроможна, коли справа доходить до просування по службі та продуктивності на робочому місці."
I would never be able to cheat.,Я б ніколи не зміг обманути.
I found a nice picture of myself easily.,Я легко знайшла гарну фотографію себе.
I could not wrap my head around this hard mathematical problem.,Я ніяк не міг впоратися з цією складною математичною задачею.
"I went to buy new sponges, these were too dirty.","Я пішла купити нові губки, ці були занадто брудні."
"When I was little, I wanted to be an athlete, but my parents signed me up for ballet instead.","Коли я була маленькою, я хотіла стати легкоатлеткою, але батьки записали мене на балет."
I have always felt that childcare was my life goal.,"Я завжди відчувала, що догляд за дітьми - це моя життєва мета."
I was just protecting you from other people at that club.,Я просто захищав тебе від інших людей у тому клубі.
I am able to see the big picture of where the organisation is heading.,"Я бачу загальну картину того, куди рухається організація."
"The storm raged on, but I stood strong on the deck of the ship.","Шторм не вщухав, але я міцно стояв на палубі корабля."
I could easily seduce you at the bar.,Я міг би легко спокусити тебе в барі.
"Every step reflected the confidence I held within, captivating the onlookers with my magnetic presence.","Кожен крок відображав упевненість, яку я тримала в собі, зачаровуючи глядачів своєю магнетичною присутністю."
I never had a problem with learning a new language.,У мене ніколи не було проблем з вивченням нової мови.
I'd rather have everything right away.,Я б хотів мати все і одразу.
"I couldn't keep up with the intense workout routine, my body feeling weak and exhausted from the exertion.","Я не встигав за інтенсивними тренуваннями, моє тіло було слабким і виснаженим від навантажень."
My mind was set - I got married despite everyone being against it.,"Я вирішила - я вийшла заміж, незважаючи на те, що всі були проти."
I used to clean the house on every Saturday.,Щосуботи я прибирала в будинку.
I first weighted all the possible scenarios.,Спочатку я зважила всі можливі сценарії.
I remained composed although the situation escalated.,"Я залишався спокійним, хоча ситуація загострювалася."
I like extreme sports even though they are really dangerous.,"Мені подобаються екстремальні види спорту, хоча вони дуже небезпечні."
I was always first picked when playing any sports back in highschool.,"У школі мене завжди обирали першим, коли я займався будь-яким видом спорту."
I like to just smile at someone because I believe it will make their day better.,"Мені подобається просто посміхатися комусь, бо я вірю, що це зробить їхній день кращим."
I have worked hard to get to where I am today.,"Я багато працював, щоб досягти того, що маю зараз."
"Sorry, I could have come but I was having a really bad hair day.","Вибачте, я могла б прийти, але у мене був дуже поганий день з волоссям."
I like to read fashion magazines.,Я люблю читати модні журнали.
I ordered them to stop praying and start helping.,Я наказав їм перестати молитися і почати допомагати.
I could not cook because it was my mother's job.,"Я не вміла готувати, бо це була робота моєї мами."
I offered accommodation to two refugees.,Я запропонував житло двом біженцям.
I could strike up a conversation with almost everybody that evening.,Того вечора я міг завести розмову майже з усіма.
I am tired after walking for ten minutes.,Я втомлююся після десяти хвилин ходьби.
Why did I have to get old?!,Чому я повинен був постаріти?!
"Since I've been eating more protein, I feel much stronger.","З тих пір, як я вживаю більше білка, я відчуваю себе набагато сильніше."
I slammed the door after the argument.,Після сварки я грюкнула дверима.
I was just in a meeting.,Я щойно був на зустрічі.
I stopped the pickpocket and held him until the police came.,Я зупинив кишенькового злодія і тримав його до приїзду поліції.
I'm an expert in my field.,Я експерт у своїй галузі.
"Some people hate accessories, but I like wearing them.","Деякі люди ненавидять аксесуари, але мені подобається їх носити."
I feel fulfilled when I can take care of everybody in the house.,"Я відчуваю себе повноцінним, коли можу подбати про всіх у домі."
"As a pilot, I ensured the safety of passengers and crew by adhering to rigorous protocols.","Як пілот, я забезпечував безпеку пасажирів та екіпажу, дотримуючись суворих протоколів."
It was hard for me to admit that I needed a hand.,"Мені було важко визнати, що мені потрібна допомога."
"I have never been a loner, I prefer to be surrounded by people.","Я ніколи не був одинаком, мені більше подобається бути в оточенні людей."
I didn't need your financial help!,Мені не потрібна ваша фінансова допомога!
"I should be thoughtful, because that's what's expected of me.","Я маю бути вдумливою, бо саме цього від мене очікують."
"Since I've been doing this sport, I'm much more balanced.","З тих пір, як я займаюся цим видом спорту, я стала набагато більш врівноваженою."
I never let my family affect my profession.,Я ніколи не дозволяв своїй родині впливати на мою професію.
I felt it in my gut.,Я відчував це нутром.
"With each punch thrown and block executed, I could feel the power surging through me.","З кожним викинутим ударом і виконаним блоком я відчував, як сила переповнює мене."
I always liked dancing.,Мені завжди подобалося танцювати.
I took the time to understand and acknowledge the emotions of a colleague who was going through a difficult time.,"Я знайшов час, щоб зрозуміти і визнати емоції колеги, який переживав важкий час."
On the way home I talked to an elderly lady on the train.,Дорогою додому я розмовляла з літньою жінкою в поїзді.
I learned how to drive before I was even allowed to.,"Я навчився водити машину ще до того, як мені дозволили."
I filtered out all the distractions.,Я відфільтрував усі відволікаючі фактори.
I never stressed about work responsibilities because I knew that I could handle anything.,"Я ніколи не переймалася робочими обов'язками, бо знала, що можу впоратися з усім."
I used to enjoy being able to simply use my smile to achieve things.,"Мені подобалося, що я міг просто використовувати свою посмішку, щоб досягти чогось."
I like to throw parties for my kids because we always have a house full of people.,"Я люблю влаштовувати вечірки для своїх дітей, тому що у нас завжди повний будинок людей."
I was aware that bad leadership leads to bad results.,"Я знав, що погане керівництво призводить до поганих результатів."
"I always wanted to be a researcher, but I wouldn't have time to take care of my family.","Я завжди хотіла бути дослідницею, але у мене не було часу піклуватися про сім'ю."
I was raised to know how to take care of others.,"Мене виховували так, щоб я знав, як піклуватися про інших."
Despite the criticism I thought I did well.,"Незважаючи на критику, я вважав, що впорався добре."
I haven't carried cash with me since I was robbed.,"Я не ношу з собою готівку з тих пір, як мене пограбували."
"For my birthday, I asked to go skydiving.",На свій день народження я попросила стрибнути з парашутом.
"I had enough romance, I wanted something more intimate.","Мені було достатньо романтики, хотілося чогось більш інтимного."
My friend is always making me laugh.,Мій друг завжди мене смішить.
I divided the tasks equally among all the team members.,Я розділив завдання порівну між усіма членами команди.
I made some extra money as a personal trainer.,Я заробляв додаткові гроші як персональний тренер.
"I didn't like our sex, but I didn't say anything.","Мені не подобався наш секс, але я нічого не сказала."
"I know it hurts, but you should pull yourself together.","Я знаю, що це боляче, але ви повинні взяти себе в руки."
I offered to help the new neighbours the paperwork.,Я запропонував допомогти новим сусідам з оформленням документів.
I changed my hair color according to the latest fashion.,Я змінила колір волосся відповідно до останньої моди.
I didn't like when my partner earned more than me.,"Мені не подобалося, коли мій партнер заробляв більше за мене."
I could not concentrate and had to constantly play with something because the job was boring.,"Я не міг зосередитися і мусив постійно з чимось гратися, бо робота була нудною."
"When becoming a leader, the key aspect was to be capable of managing complex situations.","Коли я ставав лідером, ключовим аспектом було вміння керувати складними ситуаціями."
I thought about starting my own vlog about fashion.,"Я думала про те, щоб почати власний влог про моду."
I couldn't do it with my bare hands.,Я не міг зробити це голими руками.
I don't like to read books because they're boring.,"Я не люблю читати книги, бо вони нудні."
I like to spend time with children because they have great ideas and opinions.,"Мені подобається проводити час з дітьми, тому що вони мають чудові ідеї та думки."
I actively engaged with a team member who was experiencing difficulty at work.,"Я активно взаємодіяв з членом команди, який відчував труднощі на роботі."
I could never leave the airport without first checking all the fragnances first.,"Я ніколи не могла виїхати з аеропорту, не перевіривши попередньо всі аромати."
When the deadline was approaching I just decided to share my answers with them.,"Коли дедлайн наближався, я просто вирішив поділитися з ними своїми відповідями."
I'm aware of my qualities.,Я усвідомлюю свої якості.
"As a pharmacist, I ensured compliance with regulatory guidelines.","Як фармацевт, я забезпечувала дотримання нормативних вимог."
"I lost my job and the reason was that I couldn't handle stress, but I can.","Я втратив роботу, і причиною було те, що я не міг впоратися зі стресом, але я можу."
I hated art subjects at school.,У школі я ненавиділа художні предмети.
I didn't like losing time and started working immediately.,Я не любив втрачати час і одразу почав працювати.
I had no problem with climbing that hill.,У мене не було жодних проблем з підйомом на цей пагорб.
I always did something extra although my job didn't require it.,"Я завжди робила щось додатково, хоча моя робота цього не вимагала."
I'm not very good at showing my emotions.,Я не дуже добре вмію показувати свої емоції.
"I had no doubts, I was certain that they liked me.","У мене не було сумнівів, я була впевнена, що я їм сподобалася."
"I was asked to take care of my neighbour, and I obliged.","Мене попросили подбати про ближнього, і я погодився."
