from,to
I always wanted to be a detective or a cop.,Я завжди хотів бути детективом або копом.
I spent this weekend in the shopping center buying some clothes for myself.,"Ці вихідні я провела в торговому центрі, купуючи собі одяг."
I screamed because I saw a spider in the kitchen sink.,"Я закричала, бо побачила павука в кухонній раковині."
I didn't clean my bathroom for a month because I did not feel like doing it.,"Я місяць не прибирала у ванній кімнаті, бо не хотіла цього робити."
My friend challenged me to a fight and I won.,"Мій друг викликав мене на бій, і я виграв."
I could never wear such a sweaty shirt.,Я б ніколи не зміг носити таку спітнілу сорочку.
I am extremely discerning when it comes to choosing a sexual partner.,"Я надзвичайно розбірливий, коли справа доходить до вибору сексуального партнера."
I am determined to take risks.,Я рішуче налаштована на ризик.
I like weightlifting.,Я люблю важку атлетику.
I carried my son in my arms the whole hike because he couldn't walk.,"Весь похід я носила сина на руках, бо він не міг ходити."
"I like crossfit, it's good for building dynamic strength.","Мені подобається кросфіт, він добре розвиває динамічну силу."
I went to the school reunion.,Я пішов на зустріч випускників.
I trekked druing the storm even though they warned me not to.,"Я пішов у шторм, хоча мене попереджали, що цього робити не можна."
I need to find a job in services because I like human contact.,"Мені потрібно знайти роботу в сфері обслуговування, тому що я люблю спілкуватися з людьми."
I sometimes have to remind myself not to jump to conclusions.,"Іноді мені доводиться нагадувати собі, що не варто робити поспішних висновків."
I'm always ready for any challenge.,Я завжди готовий до будь-яких викликів.
"I wish I could see what is going through their head, so I can be of more help.","Хотілося б бачити, що відбувається у них в голові, щоб я міг бути більш корисним."
I like nice clothes.,Мені подобається гарний одяг.
My head was spinning after I finished moving the boxes.,"Після того, як я закінчила переносити коробки, у мене голова йшла обертом."
I initiated conversations with strangers at a social gathering.,Я ініціював розмови з незнайомцями на світських вечірках.
I am sure about my abilities.,Я впевнений у своїх силах.
"I don't mind vacuuming, in fact, I have always found it amusing.","Я не проти пилососити, насправді, я завжди знаходив це забавним."
"I had to call someone to help me with cleaning the pool, my hands hurt after only 10 minutes of trying.","Мені довелося покликати когось, хто допоміг би мені з чищенням басейну, мої руки боліли вже через 10 хвилин спроб."
I wish I could host more parties at my place.,Хотіла б я проводити більше вечірок у себе вдома.
People tell me I'm restless because I constatnly need to be doing something.,"Люди кажуть, що я неспокійний, тому що мені постійно потрібно щось робити."
I felt so exhausted.,Я почувалася такою виснаженою.
"I didn't volunteer, because they needed someone muscular.","Я не пішов добровольцем, бо їм потрібен був хтось м'язистий."
I never feel like I'm too old for something.,"Я ніколи не відчуваю, що я занадто старий для чогось."
I almost started crying.,Я мало не розплакалася.
I had a really nice face when I was young.,"У мене було дуже гарне обличчя, коли я була молодою."
I managed my team with ease and got the job done.,Я легко керував своєю командою і виконував роботу.
This problem turned out to be too difficult and I got furious.,"Це завдання виявилося надто складним, і я розлютився."
I like curved bodies.,Мені подобаються вигнуті тіла.
"When someone calls me to go out, I'm always happy to say yes.","Коли хтось кличе мене кудись, я завжди з радістю погоджуюся."
I wouldn't be satisfied with myself if I didn't finish the race.,"Я не був би задоволений собою, якби не фінішував."
I didn't make any hasty mistakes.,Я не робив поспішних помилок.
They were rude so I had to punch them.,"Вони були грубі, тому мені довелося їх вдарити."
I have never believed in superstitions.,Я ніколи не вірив у забобони.
"I knew that I'm capable of more, but I have family, so my priorities changed.","Я знала, що здатна на більше, але у мене є сім'я, тому мої пріоритети змінилися."
I told them to let me buy them the things they needed.,"Я сказав їм, щоб вони дозволили мені купити їм необхідні речі."
I'm good at navigating.,Я добре орієнтуюся на місцевості.
My core strength is still very good because I go to gym three times a week.,"Моя основна сила все ще дуже хороша, тому що я ходжу в тренажерний зал тричі на тиждень."
I expected the salary increase.,Я очікував підвищення зарплати.
When was the last time you had sex?,Коли ви востаннє займалися сексом?
"People around me know that if they need something, I'm happy to help.","Люди навколо мене знають, що якщо їм щось потрібно, я з радістю допоможу."
"I shouldn't argue, because it's better to keep the household calm.","Я не повинен сперечатися, тому що краще зберегти спокій домочадців."
I saved up a lot of money for my childrens education.,Я накопичив багато грошей на освіту своїх дітей.
"People would often turn to me for fashion and style advice, recognizing my good taste and sense of aesthetics so I knew I was appreciated.","Люди часто зверталися до мене за порадами щодо моди та стилю, визнаючи мій гарний смак і почуття естетики, тож я знала, що мене цінують."
My to do list was neverending but I kept going.,"Мій список справ був нескінченним, але я продовжував рухатися вперед."
I observed them to see whether they were satisfied with the meal I made.,"Я спостерігав за ними, щоб зрозуміти, чи задоволені вони їжею, яку я приготував."
I hated logic because it often wasn't romantic.,"Я ненавидів логіку, тому що вона часто не була романтичною."
"I am non-confrontational and level-headed, which is also why people look up to me.","Я неконфліктний і врівноважений, і саме тому люди мене поважають."
I could not stop thinking about the sex we had last night.,"Я не могла перестати думати про секс, який у нас був минулої ночі."
I did not have money so I dug the hole for the pool on my own.,"У мене не було грошей, тому я сам викопав яму для басейну."
I always took taking care of my family's finances seriously.,Я завжди серйозно ставився до фінансів своєї сім'ї.
I like to try new things with my partner.,Мені подобається пробувати щось нове з моїм партнером.
I offered my help with doing the dishes.,Я запропонував свою допомогу в митті посуду.
I invited my friends to my place to have a dinner.,Я запросив друзів до себе на вечерю.
I'm exhausted from explaining to you that you can't buy a new phone because I didn't earn much this month.,"Я втомився пояснювати тобі, що ти не можеш купити новий телефон, тому що я мало заробив цього місяця."
I'm always ready to help you with anything around your car.,"Я завжди готовий допомогти вам з будь-якими питаннями, пов'язаними з вашим автомобілем."
I offered a supportive ear and understanding without judgment.,Я запропонувала слухати і розуміти без осуду.
I was late so I invited them for a nice lunch.,"Я запізнювався, тому запросив їх на обід."
I worked in a laboratory.,Я працював у лабораторії.
I didn't want my partner to work.,"Я не хотів, щоб мій партнер працював."
I am courageous.,Я сміливий.
"I tried to lift the piano, but I couldn't.","Я спробував підняти піаніно, але не зміг."
I am sure there is a higher power controlling my life.,"Я впевнений, що є вища сила, яка керує моїм життям."
I had to shave my legs before the race.,Мені довелося поголити ноги перед забігом.
"When I was their age, I behaved like a child too.","Коли я був у їхньому віці, я теж поводився як дитина."
I don't think I have a strong enough character to be a company director.,"Я не думаю, що у мене достатньо сильний характер, щоб бути директором компанії."
I always had authority and others naturally saw me as a leader.,"Я завжди мала авторитет, і інші, природно, бачили в мені лідера."
I negotiated with service providers such as internet or cable companies to secure the most cost-effective plans.,"Я вів переговори з постачальниками послуг, такими як інтернет або кабельні компанії, щоб забезпечити найбільш економічно вигідні плани."
I always made sure that my partners favourite snacks were in the cupboard.,"Я завжди дбав про те, щоб у шафці були улюблені закуски моїх партнерів."
I told him that nothing was wrong although I was really upset.,"Я сказала йому, що все гаразд, хоча була дуже засмучена."
I joined a self-defence course.,Я записалася на курси самооборони.
"I felt so many emotions, I could not breathe.","Я відчувала стільки емоцій, що не могла дихати."
I sacrificed my own authenticity to avoid displeasing others.,"Я пожертвував власною автентичністю, щоб не викликати невдоволення інших."
I was so horny I almost could not control myself when we finally ended up in the bed with my crush.,"Я був такий збуджений, що майже не міг себе контролювати, коли ми нарешті опинилися в ліжку з моїм коханим."
I checked if the children did their homework.,"Я перевірив, чи зробили діти домашнє завдання."
I knew how to deal with this type of client.,"Я знав, як працювати з таким типом клієнтів."
"After walking into the meeting room, I shook everyone's hand.","Зайшовши до зали засідань, я потиснув кожному руку."
I wanted him to feel welcome.,"Я хотів, щоб він відчував себе бажаним гостем."
I felt a rush of desire as I was kissed and immediately felt aroused.,"Я відчула прилив бажання, коли мене поцілували, і одразу ж відчула збудження."
I could not resist cleaning those dirty windows.,"Я не могла втриматися, щоб не помити ті брудні вікна."
"I didn't know what to do, so I relied on my gut.","Я не знав, що робити, тому поклався на інтуїцію."
"I don't like gossiping, it's a waste of time.","Я не люблю пліткувати, це марна трата часу."
I was never so sure about my test results.,Я ніколи не була настільки впевнена в результатах своїх тестів.
I made sure the dough was the perfect temperature.,"Я переконалася, що тісто має ідеальну температуру."
I have never let any of my clients down.,Я ніколи не підводив жодного з моїх клієнтів.
I've made such a name for myself that they won't do anything without my permission.,"Я зробив собі таке ім'я, що без мого дозволу вони нічого не зроблять."
"I've been told that I'm a true professional – always focused, organized, and get the job done efficiently.","Мені говорили, що я справжній професіонал - завжди зосереджений, організований і ефективно виконую роботу."
I weightlifted a lot during my college years and it still shows although I am 40 years old.,"У студентські роки я багато займався важкою атлетикою, і це досі дається взнаки, хоча мені вже 40 років."
I thought therapy was for weak people.,"Я думала, що терапія - це для слабких людей."
I turned on the washing machine.,Я увімкнула пральну машину.
Maybe if I acted nicer they would say yes.,"Можливо, якби я поводився чемніше, вони б погодилися."
I fired everyone who made me angry.,"Я звільнив усіх, хто мене розлютив."
"Although I don't like this dish, I made it for my family.","Хоча я не люблю цю страву, я приготувала її для своєї сім'ї."
"They say I'm insensitive, but I call it sensible.","Кажуть, що я нечутливий, але я називаю це розумним."
I helped the neighbour with carrying her shopping bags.,Я допоміг сусідці донести сумки з покупками.
I assembled the furniture alone.,Меблі я збирав сам.
I didn't want to stay at home with kids because I would loose a really good job.,"Я не хотіла сидіти вдома з дітьми, бо втратила б дуже хорошу роботу."
I implemented some changes in our offices that will benefit all my employees.,"Я впровадив деякі зміни в наших офісах, які підуть на користь усім моїм співробітникам."
I had cameras installed around the house so nothing would happen to me.,"У мене були встановлені камери по всьому будинку, щоб зі мною нічого не сталося."
I like to analyse problems from various perspectives.,Мені подобається аналізувати проблеми з різних точок зору.
"There is so much going on inside my mind, I can barely focus.","У моїй голові стільки всього відбувається, що я ледве можу зосередитися."
If only I could call and check how they are doing.,"Якби я тільки міг подзвонити і перевірити, як у них справи."
I avoided conflicts at all costs.,Я уникав конфліктів за будь-яку ціну.
I took them to a water park.,Я повів їх в аквапарк.
I was the lead author of the research paper.,Я був провідним автором дослідницької роботи.
"They think I'm shy, but I just don't want to embarrass myself.","Вони думають, що я сором'язлива, але я просто не хочу соромитися."
"I don't like watching videos of abandoned puppies, it makes me cry.","Я не люблю дивитися відео з покинутими цуценятами, це змушує мене плакати."
I stood up in front of them and told them we could do it.,"Я став перед ними і сказав, що ми можемо це зробити."
I am a miner.,Я шахтар.
I swept and mopped the floors of my home.,Я підмітала і мила підлогу у себе вдома.
I could easily join the army.,Я міг би легко піти в армію.
I never liked speaking out loud.,Я ніколи не любив говорити вголос.
My friend told me that I overreacted.,"Моя подруга сказала мені, що я надто гостро відреагувала."
We won the competition thanks to the idea I had a month ago.,"Ми виграли конкурс завдяки ідеї, яка виникла у мене місяць тому."
I wish I had passed the physical test!,"Шкода, що я не пройшла фізичний тест!"
I like to have fun.,Я люблю розважатися.
I got a fine for speeding on the highway.,Мене оштрафували за перевищення швидкості на шосе.
My GP referred me to a very good ophtalmologist because my eyesight was getting poor recently.,"Мій лікар направив мене до дуже хорошого офтальмолога, тому що останнім часом мій зір погіршився."
"When I'm sad, I go shopping.","Коли мені сумно, я ходжу по магазинах."
I have always wanted to behave as they expected me to.,"Я завжди хотів поводитися так, як вони від мене очікували."
I'm too experienced to waste my time here.,"Я занадто досвідчений, щоб витрачати свій час тут."
"When I'm with him, I'm angry.","Коли я з ним, я злюся."
I had tough military training.,У мене була жорстка військова підготовка.
I can't imagine having a family and having to take care of them someday.,"Я не можу собі уявити, що колись матиму сім'ю і муситиму піклуватися про неї."
People think of me as a wimp just because I'm good to others.,"Люди вважають мене слабаком тільки тому, що я добрий до інших."
I was not able to complete the excercise because I am too exhausted.,"Я не зміг завершити вправу, бо був дуже виснажений."
"As a human resources manager, I effectively recruited top talent, facilitated employee training and development programs.","Як менеджер з персоналу, я ефективно підбирала найкращі таланти, сприяла програмам навчання та розвитку співробітників."
It was always important for me to be pretty.,Для мене завжди було важливо бути красивою.
I can take this - I have always managed.,Я це витримаю - завжди витримував.
I got very upset.,Я дуже засмутилася.
"To avoid losing anything, I prefer to back up all my data.","Щоб нічого не втратити, я вважаю за краще створювати резервні копії всіх своїх даних."
I should work harder so my children have easier life.,"Я маю більше працювати, щоб моїм дітям було легше жити."
I feel the happiest when I'm in charge of everything.,"Я відчуваю себе найщасливішим, коли я відповідаю за все."
They do not dare to questions the decisions that I have made.,"Вони не наважуються ставити під сумнів рішення, які я прийняв."
I had never thought that I could come to harm.,"Я ніколи не думав, що можу завдати шкоди."
I caught myself daydreaming about having sex.,"Я зловила себе на тому, що мрію про секс."
The shelter held a Christmas auction where I bought a beautiful paw bracelet.,"Притулок проводив різдвяний аукціон, на якому я купила гарний браслет на лапу."
I maintained a professional tone.,Я зберігав професійний тон.
I threw myself a birthday party to get lots of presents.,"Я влаштувала собі вечірку на день народження, щоб отримати багато подарунків."
I have decided that I will praise at least one person every day.,"Я вирішив, що буду хвалити хоча б одну людину щодня."
"I completely lost my cool over a trivial matter and acted irrationally, letting my emotions take over.","Я повністю втратив самовладання через дріб'язкову справу і діяв ірраціонально, дозволивши емоціям взяти гору."
I liked having company better.,Мені більше подобалося мати компанію.
I will gladly take your bag.,Я з радістю візьму вашу сумку.
Just because I demand discipline from my employees doesn't mean I don't like them.,"Те, що я вимагаю дисципліни від своїх співробітників, не означає, що вони мені не подобаються."
I like to go to nude beaches.,Я люблю ходити на нудистські пляжі.
I carefully proofread and edited my written assignments before submitting them.,"Я ретельно вичитував і редагував свої письмові завдання перед тим, як відправити їх на конкурс."
I built the house alone.,Я побудував будинок сам.
"I could never go hiking alone, I always need company.","Я ніколи не міг ходити в походи сам, мені завжди потрібна компанія."
I didn't want to tell them what is wrong because I didn't want to cause any trouble.,"Я не хотів говорити їм, що сталося, бо не хотів спричиняти неприємностей."
"I jogged confidently, feeling the endurance of my physical strength.","Я бігла впевнено, відчуваючи витривалість своєї фізичної сили."
I helped you change the tyres on your car because I'm stronger.,"Я допоміг тобі замінити шини на машині, бо я сильніший."
I like helping people.,Мені подобається допомагати людям.
I encouraged teamwork and collaboration during group projects.,Я заохочував командну роботу та співпрацю під час групових проектів.
I calmly addressed a conflict with a colleague.,Я спокійно вирішив конфлікт з колегою.
I wouldn't hurt a fly.,Я б і мухи не скривдив.
"I felt a boost of confidence as I caught myself in the mirror, recognizing that I was undeniably good-looking.","Я відчула прилив впевненості в собі, коли побачила себе в дзеркалі, визнавши, що я, безсумнівно, гарно виглядаю."
"I'm always happy, I think worrying is just a waste of time.","Я завжди щаслива, вважаю, що хвилювання - це марна трата часу."
I coached the youth football team.,Я тренував юнацьку футбольну команду.
"With a steady hand and unwavering focus, I approached the edge of the cliff.",З твердою рукою і непохитним фокусом я наблизився до краю скелі.
I hated my body.,Я ненавидів своє тіло.
I had difficulty taking responsibility for my actions.,Мені було важко брати на себе відповідальність за свої вчинки.
