from,to
I had to fix my hair first.,Спершу мені треба було поправити зачіску.
I had such a terrible muscle pain after just lifting the chairs.,"У мене був такий жахливий біль у м'язах після того, як я просто підняла стільці."
"If somebody did something bad to me, I would get back at them immediately.","Якби хтось зробив мені щось погане, я б негайно помстився."
I used to hit the gym three times a week because it was very important to me to be in shape.,"Я ходив до спортзалу тричі на тиждень, тому що для мене було дуже важливо бути у формі."
"When I set my mind to something, I always stick with it.","Коли я щось вирішую, я завжди цього дотримуюся."
I preferred feelings over rational arguments.,"Я віддавав перевагу почуттям, а не раціональним аргументам."
I like to cook vegan meals.,Люблю готувати веганські страви.
"When my neighbor's house was on fire, I immediately ran to her apartment.","Коли загорівся будинок моєї сусідки, я одразу ж побігла до неї додому."
I worked hard for the betterment of our family's financial situation.,"Я наполегливо працював, щоб покращити фінансове становище нашої сім'ї."
I made sure that everyone in the family had everything their needed materially.,"Я подбав про те, щоб усі члени сім'ї мали все необхідне в матеріальному плані."
I strived to create additional income for our family's needs and expenses.,Я прагнула створити додатковий дохід для потреб і витрат нашої сім'ї.
Why didn't you stop acting so childish?,Чому ти не перестав поводитися так по-дитячому?
I love hunting.,Я люблю полювання.
Could you cook something?,Можеш щось приготувати?
"Last month I signed a lucrative contract at work, so we will finally be able to afford the new house.","Минулого місяця я підписав вигідний контракт на роботі, тож ми нарешті зможемо дозволити собі новий будинок."
"Whenever the kids had a rough day, I baked them their favourite dessert.","Коли у дітей був важкий день, я пекла їм їхній улюблений десерт."
I got a job as a trainer at a gym.,Я влаштувався тренером у спортзал.
I could get any job because I have children.,"Я можу влаштуватися на будь-яку роботу, бо маю дітей."
I rolled the giant concrete ball out of the way.,Я відкотив гігантську бетонну кулю з дороги.
I tried so hard and it was for nothing because my kids were always dirty.,"Я так старалася, але все було марно, бо мої діти завжди були брудні."
Friends often refer to me as a great cook.,Друзі часто називають мене чудовим кулінаром.
I could not resist buying that dress even though it was over my budget.,"Я не змогла встояти перед покупкою цієї сукні, хоча вона перевищувала мій бюджет."
"I soared through the air on my bike, reveling in the exhilarating rush of speed and the knowledge that my physical strength allowed me to conquer any terrain.","Я ширяв у повітрі на велосипеді, насолоджуючись хвилюючою швидкістю і усвідомленням того, що моя фізична сила дозволяє мені підкорювати будь-яку місцевість."
I made sure everyone could see my sixpack.,"Я зробив так, щоб усі бачили мій прес."
They liked me because I had the ability to take care of others.,"Я їм подобався, бо мав здатність піклуватися про інших."
I had to think about every aspect of such an investment.,Мені довелося продумати кожен аспект такої інвестиції.
"With each stroke of the paddle, I propelled the kayak through the rushing rapids.",З кожним помахом весла я просував байдарку через стрімкі пороги.
"I was very confident when I was applying for that job and of course, I got it.","Я була дуже впевнена в собі, коли подавала заявку на цю роботу, і, звичайно, отримала її."
I've always got what I set out to get.,"Я завжди отримую те, що хотів отримати."
I organized a neighborhood barbecue.,Я організував сусідське барбекю.
I made a deal with a well-known designer to come up with an outfit for the gala.,"Я домовилася з відомим дизайнером, щоб він придумав вбрання для гала-концерту."
I've never been to a club because I'm embarrassed to dance in front of others.,"Я ніколи не був у клубі, бо соромлюся танцювати перед іншими."
I wanted to be likable.,Я хотіла бути привабливою.
I am happy when I lie down in a fragrant bed in the evening.,"Я щаслива, коли ввечері лягаю в ароматне ліжко."
I was CEO of a big company when I was just twenty years old.,"Я був генеральним директором великої компанії, коли мені було лише двадцять років."
I washed the dishes.,Я помила посуд.
I felt stressed so I went shopping.,"Я відчувала стрес, тому пішла по магазинах."
"I fried the meat, because that's how my partner likes it.","Я підсмажив м'ясо, бо так любить мій партнер."
I invited everyone to come over for dinner.,Я запросив усіх на вечерю.
"If I had to say one thing I wouldn't go anywhere without, it would be rings.","Якби мені довелося назвати одну річ, без якої я нікуди не поїду, то це були б каблучки."
"I like making decisions based on hard data, not subjective feelings.","Мені подобається приймати рішення на основі достовірних даних, а не суб'єктивних відчуттів."
I offered to carry their suitcases.,Я запропонував понести їхні валізи.
The doctor told me I'd be healthier and stronger if I ate more.,"Лікар сказав, що я буду здоровішим і сильнішим, якщо буду більше їсти."
"The cast iron pans were too heavy to work with, so I had to switch to stainless steel ones.","Чавунні сковорідки були надто важкими для роботи, тому мені довелося перейти на сковорідки з нержавіючої сталі."
I consulted a fact-checker.,Я консультувався з фактчекером.
I started a mentorship academy for young people.,Я започаткував академію наставництва для молоді.
I liked to be a teacher.,Мені подобалося бути вчителем.
I did not care that the swimming pool was for children only.,"Мене не хвилювало, що басейн був тільки для дітей."
Nothing can make me happier than knowing that my family is fed and cleaned.,"Ніщо не може зробити мене щасливішим, ніж усвідомлення того, що моя сім'я нагодована і прибрана."
"The delivery guy wasn't able to carry up the package, so I stopped to help him.","Кур'єр не зміг підняти пакунок, тому я зупинився, щоб допомогти йому."
"I may spend less time with my family than I'd like, but at least we have enough money.","Можливо, я проводжу менше часу зі своєю сім'єю, ніж хотілося б, але принаймні у нас достатньо грошей."
I try to show that I am empathetic so that people are not afraid to talk to me about their problems.,"Я намагаюся показати, що я емпатичний, щоб люди не боялися говорити зі мною про свої проблеми."
I relished the challenge of riding the untamed power of the ocean.,Я насолоджувався викликом осідлати неприборкану силу океану.
"Maybe if I prayed more, it would be better.","Можливо, якби я більше молився, було б краще."
My boss works out every other day.,Мій бос тренується через день.
"They want me to show emotion, but I've never done that before.","Вони хочуть, щоб я показував емоції, але я ніколи раніше цього не робив."
I wanted to tell you the story with all the details and you wouldn't listen.,"Я хотів розповісти тобі історію з усіма подробицями, але ти не захотіла слухати."
"I had so much laundry to do, but it had to be done.","У мене було так багато білизни, але її треба було випрати."
I should not have argued with them.,Мені не варто було з ними сперечатися.
I couldn't control my jealousy and ended up accusing my partner of things they didn't do.,"Я не могла контролювати свої ревнощі і почала звинувачувати свого партнера в тому, чого він не робив."
"The politician wasn't good-looking, so I didn't even listen.","Політик був не дуже привабливий, тому я навіть не став його слухати."
I had such a heavy bag that I almost didn't bring it home.,"У мене була така важка сумка, що я майже не донесла її додому."
This is nothing - you should have seen what I lifted yesterday.,"Це ще нічого - бачили б ви, що я вчора підняв."
I avoided cracks on the sidewalk to avoid bad luck.,"Я уникав тріщин на тротуарі, щоб уникнути нещастя."
I am determined to win this fight.,Я сповнений рішучості виграти цей бій.
Are you sure you are strong enough?,"Ви впевнені, що ви достатньо сильні?"
I felt randomly aroused when I saw a sexy body.,"Я відчував випадкове збудження, коли бачив сексуальне тіло."
"They asked me if I could help them, and I couldn't say no.","Вони запитали мене, чи можу я їм допомогти, і я не зміг відмовити."
I am able to deal successfully with hard situations.,Я вмію успішно справлятися зі складними ситуаціями.
"I lifted it, but then my back hurt.","Я підняв його, але потім у мене заболіла спина."
"I vacuum every day, I guess I'm addicted to it.","Я пилосошу щодня, мабуть, у мене залежність."
"I would have rested, but the house needed a clean-up.","Я б відпочила, але в хаті треба було прибирати."
I was very irresponsible.,Я був дуже безвідповідальним.
I should visit the fortune teller again.,Треба ще раз сходити до ворожки.
I like to read a lot of non-fiction books.,Я люблю читати багато нон-фікшн книг.
I like to race with others because it motivates me to achieve better results.,"Мені подобається змагатися з іншими, тому що це мотивує мене досягати кращих результатів."
I was hoping that we could go to my place after the party.,"Я сподівався, що після вечірки ми зможемо піти до мене додому."
I signed up for a ballet class to increase my core strenght and balance.,"Я записалася в балетний клас, щоб розвинути силу м'язів і баланс."
I knew how to save money.,"Я знав, як заощаджувати гроші."
"Everybody expected me to be the first, and I was.","Всі очікували, що я буду першою, і я була першою."
"If I broke the rules, I couldn't expect others to follow them.","Якщо я порушував правила, я не міг очікувати, що інші будуть їх дотримуватися."
Why would I need to talk about my feelings?,Навіщо мені говорити про свої почуття?
I always knew how to deal with people.,"Я завжди знав, як поводитися з людьми."
I like to take risks and pursue new opportunities.,Я люблю ризикувати і шукати нові можливості.
My gym membership ended yesterday and I had to renew it.,"Мій абонемент у спортзал закінчився вчора, і мені потрібно було його поновити."
"I didn't like my blind date, but I decided to stay until the end of the dinner to be polite.","Мені не сподобалося моє побачення наосліп, але я вирішила залишитися до кінця вечері з ввічливості."
I'm ready to fight for justice.,Я готовий боротися за справедливість.
"Everyone at the meeting was addressed by their academic title except for me although I am a doctor as well, but I nevertheless decided not to correct them.","До всіх присутніх на зустрічі зверталися за вченим званням, окрім мене, хоча я теж доктор наук, але вирішив не виправляти їх."
I had no doubt in my mind that I belonged in the spotlight.,"У мене не було жодних сумнівів, що я належу до центру уваги."
I could easily recall that mathematical formula off the top of my head.,"Я з легкістю пригадав цю математичну формулу, що спала мені на думку."
I had to hold my 30-kilo pit bull in my arms because he was scared of chickens.,"Мені доводилося тримати свого 30-кілограмового пітбуля на руках, бо він боявся курей."
I'm sore because I was lifting heavy weights yesterday.,"У мене болить, бо я вчора піднімав важку вагу."
When I saw the baby I could not contain my excitement.,"Коли я побачила дитину, я не могла стримати свого хвилювання."
I was achieving so many goals but I didn't say anyone so nobody would feel endangered by me.,"Я досягала так багато цілей, але нікому не говорила, щоб ніхто не відчував небезпеки через мене."
I harnessed my physical strength to conquer the challenging climb.,"Я використовував свої фізичні сили, щоб подолати складний підйом."
"I was too scared to say what I'm thinking, so I stay quiet.","Мені було надто страшно сказати, що я думаю, тому я мовчу."
I wanted to live freely.,Я хотів жити вільно.
I am competent.,Я компетентний.
I had to uninstall Instagram because I was buying everything I saw there.,"Мені довелося видалити Instagram, тому що я купувала все, що там бачила."
I like watching detective TV shows.,Люблю дивитися детективні серіали.
"Nothing can change my mind, I am absolutely sure that I am right.","Ніщо не може змінити мою думку, я абсолютно впевнений у своїй правоті."
"I would never sit on the bed in my day clothes, only in my pyjamas.","Я б ніколи не сіла на ліжко в повсякденному одязі, тільки в піжамі."
My high sex drive could make me susceptible to impulsive decisions when I was younger.,"Мій високий сексуальний потяг міг зробити мене схильним до імпульсивних рішень, коли я був молодшим."
I like to solve problems and look for creative solutions.,Люблю вирішувати проблеми та шукати креативні рішення.
I needed a lot of sex to feel satisfied in the relationship.,"Мені потрібно було багато сексу, щоб відчувати себе задоволеною у стосунках."
I could not decide so I just went with their idea.,"Я не міг вирішити, тому просто погодився з їхньою ідеєю."
I'm very goal-oriented.,Я дуже цілеспрямований.
I like seeing naked bodies.,Мені подобається бачити голі тіла.
I always feel frustrated when I'm not in charge of a large project.,"Я завжди відчуваю розчарування, коли не відповідаю за великий проект."
"I'm convinced that if I didn't go to work the same way, it would bring me bad luck.","Я переконаний, що якби я не ходив на роботу так само, це принесло б мені невдачу."
"I've been told that I'm annoyingly childish, but I don't care.","Мені казали, що я поводжуся набридливо по-дитячому, але мені байдуже."
"I found a kitten on the street, so I took it home.",Я знайшла кошеня на вулиці і взяла його додому.
I came here to the brothel to have a little fun.,"Я прийшла сюди, в бордель, щоб трохи розважитися."
I always felt happiest when leading others.,"Я завжди відчував себе найщасливішим, коли вів за собою інших."
I'm looking forward to seeing how tanned I'll be in the summer.,"З нетерпінням чекаю, якою засмаглою буду влітку."
I never trusted in monogamy.,Я ніколи не вірив у моногамію.
My partner left me alone with my kids and didn't told me what should I do with them,"Мій партнер залишив мене наодинці з дітьми і не сказав, що мені з ними робити"
"I couldn't find my phone, so I started to cry.",Я не могла знайти свій телефон і почала плакати.
I've always considered sex to be the alpha and omega of any relationship.,Я завжди вважав секс альфою і омегою будь-яких стосунків.
I like to spend quality time with my friends.,Люблю проводити час з друзями.
"I took the initiative to learn about different cultures and perspectives, expanding my empathy and understanding of people from diverse backgrounds.","Я взяла на себе ініціативу дізнатися про різні культури та перспективи, розширивши свою емпатію та розуміння людей з різним походженням."
I donated my wealth to charity.,Я пожертвував свої статки на благодійність.
It makes me feel incompetent when others do not obey my commands.,"Я відчуваю себе некомпетентним, коли інші не підкоряються моїм командам."
I did not have enough strength to swim across the lake and had to return.,У мене не вистачило сил переплисти озеро і довелося повернутися.
I am very confident.,Я дуже впевнений у собі.
"I didn't take that job, because my partner was against it.","Я не погодився на цю роботу, бо мій партнер був проти."
I hated when they started talking about the flat Earth.,"Я ненавидів, коли вони починали говорити про пласку Землю."
I consistently practiced personal hygiene habits.,Я послідовно практикував звички особистої гігієни.
I spent the whole weekend lying in front of the TV.,"Я провела всі вихідні, лежачи перед телевізором."
"I'm expected to prioritize the family's needs over personal desires, so I didn't buy that phone.","Очікується, що я ставлю потреби сім'ї на перше місце, а не особисті бажання, тому я не купив цей телефон."
"I don't like to pick flowers, I feel sorry for them.","Я не люблю зривати квіти, мені їх шкода."
I have always motivated those around me to not be afraid to speak up.,"Я завжди мотивував тих, хто мене оточував, не боятися говорити правду."
I like that I made a lot of new friends at that party.,"Мені подобається, що я знайшов багато нових друзів на цій вечірці."
"I like weightlifting, it's my favourite sport.","Мені подобається важка атлетика, це мій улюблений вид спорту."
"I had to think for a long time, but my instincts were right.","Довелося довго думати, але інтуїція мене не підвела."
I could easily jump with a parachute.,Я міг легко стрибнути з парашутом.
I have always been able to assess a situation well.,Я завжди вміла добре оцінювати ситуацію.
I could not keep my mouth shut and just told the secret to everyone anyways.,Я не міг тримати язика за зубами і все одно розказав усім цю таємницю.
I would never skip a daily shower.,Я ніколи не пропускаю щоденний душ.
I always prefered natural products for my skin.,Я завжди віддавала перевагу натуральним продуктам для своєї шкіри.
I enjoyed playing the board game.,Мені сподобалося грати в настільну гру.
"I attempted to fix a broken appliance, but my technical skills were weak.","Я намагався полагодити зламаний прилад, але мої технічні навички були слабкими."
I guess I was just too weak to get promoted.,"Думаю, я був занадто слабкий, щоб отримати підвищення."
I warned them that my punch is powerful.,"Я попередив їх, що мій удар потужний."
I was always prone to impulse purchases.,Я завжди була схильна до імпульсивних покупок.
I always wanted to have a big family and take care of it.,Я завжди хотіла мати велику сім'ю і піклуватися про неї.
"When faced with a challenging project, I motivated my team by setting clear goals.","Коли я стикався зі складним проектом, я мотивував свою команду, ставлячи чіткі цілі."
I was so happy I was blinded by joy.,"Я був такий щасливий, що засліплений радістю."
I always played by the rules.,Я завжди грав за правилами.
I would never lend my clothes to someone because it's unhygienic.,"Я б ніколи не позичив комусь свій одяг, бо це негігієнічно."
I organized a dinner party at my place.,Я організував у себе вдома звану вечерю.
I did not listen to them because I knew I was right.,"Я не слухав їх, бо знав, що маю рацію."
I asked for more samples of the face cream.,Я попросила більше зразків крему для обличчя.
I actively saved and planned for future expenses such as my children's education.,"Я активно заощаджував і планував майбутні витрати, наприклад, на освіту дітей."
I was so angry that the beauty salon was closed.,"Я так розлютилася, що салон краси закрили."
I never lacked courage.,Мені ніколи не бракувало сміливості.
I've never had a problem with public speaking.,У мене ніколи не було проблем з публічними виступами.
