from,to
I struggled to strike a balance between my sexual desires and other important aspects of life.,Walczyłem o znalezienie równowagi między moimi pragnieniami seksualnymi a innymi ważnymi aspektami życia.
I stopped the pickpocket and held him until the police came.,"Zatrzymałem kieszonkowca i trzymałem go, aż nadeszła policja."
I decided to change my plans for no reason.,Postanowiłem zmienić swoje plany bez powodu.
"If I had been there, the atmosphere would have been better.","Gdybym tam był, atmosfera byłaby lepsza."
I have worked hard to get to where I am today.,"Ciężko pracowałem, aby dotrzeć tam, gdzie jestem dzisiaj."
"Don't go there alone, it can be dangerous.","Nie idź tam sam, to może być niebezpieczne."
I was proud of being a good kisser.,"Byłem dumny z tego, że dobrze się całuję."
I took the time to understand and acknowledge the emotions of a colleague who was going through a difficult time.,"Poświęciłem trochę czasu, aby zrozumieć i uznać emocje kolegi, który przeżywał trudny czas."
"As I effortlessly lifted the heavy box, the surprised expressions on others' faces made me smile.","Kiedy bez wysiłku podnosiłem ciężkie pudełko, zaskoczone wyrazy na twarzach innych sprawiły, że się uśmiechnąłem."
I filtered out all the distractions.,Odfiltrowałem wszystkie rozpraszanie uwagi.
I never had a problem with learning a new language.,Nigdy nie miałem problemu z nauką nowego języka.
I cleaned the house yesterday and now it's a mess again.,"Wczoraj sprzątałam dom, a teraz znowu jest bałagan."
I could not cook because it was my mother's job.,"Nie potrafiłam gotować, bo to była praca mojej matki."
I was the first one at the library.,Byłam pierwszą osobą w bibliotece.
I have always felt that childcare was my life goal.,"Zawsze czułam, że opieka nad dziećmi jest moim życiowym celem."
I could lift that car if I wanted to.,"Mógłbym podnieść ten samochód, gdybym chciał."
"Since I've been doing this sport, I'm much more balanced.","Odkąd uprawiam ten sport, jestem znacznie bardziej zrównoważony."
I slammed the door after the argument.,Zatrzasnąłem drzwiami po kłótni.
I don't like when the meal I prepared is tasteless.,"Nie lubię, gdy posiłek, który przygotowałem, jest bez smaku."
"When I was little, I wanted to be an athlete, but my parents signed me up for ballet instead.","Kiedy byłem mały, chciałem zostać sportowcem, ale moi rodzice zapisali mnie na balet."
"I came up with a deal: if you vacuum, I'll take you out tonight.","Wymyśliłem umowę: jeśli odkurzysz, zabiorę cię dziś wieczorem."
I am able to see the big picture of where the organisation is heading.,"Widzę szeroki obraz tego, dokąd zmierza organizacja."
"I didn't want us to sign a prenup, because I'd take care of my partner even after a divorce.","Nie chciałam, żebyśmy podpisali prenup, bo nawet po rozwodzie opiekowałbym się moim partnerem."
I learned how to drive before I was even allowed to.,"Nauczyłem się prowadzić, zanim jeszcze mi pozwolono."
I didn't need your support.,Nie potrzebowałem twojego wsparcia.
I always liked dancing.,Zawsze lubiłem tańczyć.
"I have never been a loner, I prefer to be surrounded by people.","Nigdy nie byłem samotnikiem, wolę być otoczony przez ludzi."
I used to clean the house on every Saturday.,Sprzątałem dom w każdą sobotę.
I made some extra money as a personal trainer.,Zarobiłem dodatkowe pieniądze jako osobisty trener.
"I had enough romance, I wanted something more intimate.","Miałem dość romansu, chciałem czegoś bardziej intymnego."
"As a pilot, I ensured the safety of passengers and crew by adhering to rigorous protocols.","Jako pilot zadbałem o bezpieczeństwo pasażerów i załogi, przestrzegając rygorystycznych protokołów."
"I couldn't keep up with the intense workout routine, my body feeling weak and exhausted from the exertion.","Nie mogłem nadążyć za intensywnym treningiem, moje ciało było słabe i wyczerpane wysiłkiem."
I feel fulfilled when I can take care of everybody in the house.,"Czuję się spełniona, gdy mogę zająć się wszystkimi w domu."
I divided the tasks equally among all the team members.,Podzieliłem zadania równo między wszystkich członków zespołu.
It was hard for me to admit that I needed a hand.,"Trudno mi było przyznać, że potrzebuję ręki."
I was aware that bad leadership leads to bad results.,"Byłem świadomy, że złe przywództwo prowadzi do złych wyników."
I could strike up a conversation with almost everybody that evening.,Tego wieczoru mogłem nawiązać rozmowę z prawie wszystkimi.
I could not wrap my head around this hard mathematical problem.,Nie mogłem owijać głowy wokół tego trudnego problemu matematycznego.
"The storm raged on, but I stood strong on the deck of the ship.","Burza szalała dalej, ale stałem silnie na pokładzie statku."
"I should be thoughtful, because that's what's expected of me.","Powinienem być przemyślany, bo tego się ode mnie oczekuje."
"For my birthday, I asked to go skydiving.",Na urodziny poprosiłem o skok spadochronowy.
I remained composed although the situation escalated.,"Pozostałem skomponowany, chociaż sytuacja się eskalowała."
I'm an expert in my field.,Jestem ekspertem w swojej dziedzinie.
I offered accommodation to two refugees.,Zaproponowałem zakwaterowanie dwóm uchodźcom.
I have a habit of going along with what other people want.,"Mam zwyczaj dogadywania się z tym, czego chcą inni ludzie."
Finally the beauty catalogue that I ordered has arrived.,"W końcu dotarł katalog kosmetyczny, który zamówiłem."
I used to enjoy being able to simply use my smile to achieve things.,"Kiedyś cieszyłem się, że mogę po prostu wykorzystać swój uśmiech, aby osiągnąć różne rzeczy."
"I went to buy new sponges, these were too dirty.","Poszedłem kupić nowe gąbki, te były zbyt brudne."
"Some people hate accessories, but I like wearing them.","Niektórzy ludzie nienawidzą akcesoriów, ale lubię je nosić."
"With each punch thrown and block executed, I could feel the power surging through me.","Z każdym rzuconym ciosem i wykonywanym blokiem czułem, jak moc przepływa przeze mnie."
I would never be able to cheat.,Nigdy nie byłbym w stanie oszukiwać.
My mind was set - I got married despite everyone being against it.,"Mój umysł był skoncentrowany - ożeniłem się, mimo że wszyscy byli temu przeciwni."
I got overwhelmed with sadness.,Byłem przytłoczony smutkiem.
I am tired after walking for ten minutes.,Jestem zmęczony po dziesięciu minutach chodzenia.
"If you weren't with me, god knows how it'd end.","Gdybyś nie był ze mną, Bóg wie, jak by się skończyło."
On the way home I talked to an elderly lady on the train.,W drodze do domu rozmawiałem ze starszą kobietą w pociągu.
"I wished the gig would never end, there were so many nice people everywhere.","Chciałem, żeby koncert nigdy się nie skończył, wszędzie było tak wielu miłych ludzi."
I had to work even over Christmas to earn as much money as possible.,"Musiałem pracować nawet w Święta Bożego Narodzenia, aby zarobić jak najwięcej pieniędzy."
"That job wasn't meant for me, but for someone stronger.","Ta praca nie była przeznaczona dla mnie, ale dla kogoś silniejszego."
I'd rather have everything right away.,Wolałbym mieć wszystko od razu.
I was just in a meeting.,Właśnie byłem na spotkaniu.
I was raised to know how to take care of others.,"Zostałem wychowany, by wiedzieć, jak dbać o innych."
I read a book about self-improvement yesterday.,Wczoraj przeczytałam książkę o samodoskonaleniu.
I first weighted all the possible scenarios.,Najpierw rozważyłem wszystkie możliwe scenariusze.
"I had this weird feeling, so I called my parents right away to see if they were okay.","Miałem to dziwne uczucie, więc natychmiast zadzwoniłem do rodziców, aby sprawdzić, czy wszystko w porządku."
I like to throw parties for my kids because we always have a house full of people.,"Lubię organizować imprezy dla moich dzieci, ponieważ zawsze mamy dom pełen ludzi."
"Every step reflected the confidence I held within, captivating the onlookers with my magnetic presence.","Każdy krok odzwierciedlał pewność siebie, którą trzymałem w sobie, urzekając widzów moją magnetyczną obecnością."
My friend is always making me laugh.,Mój przyjaciel zawsze mnie rozśmiesza.
I went to walk the dogs from the shelter.,Poszedłem na wyprowadzenie psów ze schroniska.
I like extreme sports even though they are really dangerous.,"Lubię sporty ekstremalne, mimo że są naprawdę niebezpieczne."
I like to read fashion magazines.,Lubię czytać magazyny o modzie.
Despite the criticism I thought I did well.,"Pomimo krytyki myślałem, że dobrze sobie radzę."
I was the first one at the clothing store.,Byłam pierwszą osobą w sklepie odzieżowym.
I'm very competitive when it comes to promotions and performance in the workplace.,"Jestem bardzo konkurencyjny, jeśli chodzi o awanse i wyniki w miejscu pracy."
I hoped I had been a pleasant companion.,"Miałem nadzieję, że byłem miłym towarzyszem."
"Sorry, I could have come but I was having a really bad hair day.","Przepraszam, mogłem przyjść, ale miałem naprawdę kiepski dzień na włosy."
"When becoming a leader, the key aspect was to be capable of managing complex situations.","Stając się liderem, kluczowym aspektem była umiejętność radzenia sobie ze złożonymi sytuacjami."
I worked hard to maintain my position.,"Ciężko pracowałem, aby utrzymać swoją pozycję."
My smile was shinning through the whole room.,Mój uśmiech świecił przez cały pokój.
I never thought we could only stay friends.,"Nigdy nie myślałem, że możemy zostać tylko przyjaciółmi."
I was promoted because I have good communication skills.,"Zostałem awansowany, ponieważ mam dobre umiejętności komunikacyjne."
I always did something extra although my job didn't require it.,"Zawsze robiłem coś dodatkowego, chociaż moja praca tego nie wymagała."
I have never left home without making sure that everybody has something to eat first.,"Nigdy nie wychodziłem z domu, nie upewniając się, że każdy ma coś do jedzenia."
I offered to help the new neighbours the paperwork.,"Zaproponowałem, że pomogę nowym sąsiadom w dokumentacji."
"As a pharmacist, I ensured compliance with regulatory guidelines.",Jako farmaceuta zapewniłem zgodność z wytycznymi regulacyjnymi.
I calmly handled a difficult customer.,Spokojnie poradziłem sobie z trudnym klientem.
"In a business meeting, I actively listened to my colleagues and responded to their proposals with relevant comments.",Na spotkaniu biznesowym aktywnie słuchałem moich kolegów i odpowiadałem na ich propozycje odpowiednimi komentarzami.
I'm aware of my qualities.,Zdaję sobie sprawę ze swoich cech.
I hated art subjects at school.,Nienawidziłam przedmiotów artystycznych w szkole.
I wish I could think more rationally.,Chciałabym myśleć bardziej racjonalnie.
I thought about starting my own vlog about fashion.,Myślałem o założeniu własnego vloga o modzie.
I like to have the best mobile on the market.,Lubię mieć najlepszy telefon komórkowy na rynku.
I got approached by some model agency.,Zwróciła się do mnie jakaś agencja modelek.
"I delegated tasks effectively, matching the skills and strengths of my team members with the right responsibilities.","Skutecznie delegowałem zadania, dopasowując umiejętności i mocne strony członków mojego zespołu do odpowiednich obowiązków."
I'm not very good at showing my emotions.,Nie jestem zbyt dobry w pokazywaniu swoich emocji.
"If I knew how boring university was, I would never have gone to it.","Gdybym wiedział, jak nudny jest uniwersytet, nigdy bym na niego nie poszedł."
I like to spend time with children because they have great ideas and opinions.,"Lubię spędzać czas z dziećmi, ponieważ mają świetne pomysły i opinie."
I assembled the furniture on my own.,Meble złożyłem na własną rękę.
I pitied the beggar and gave him money.,Ulitowałem żebraka i dałem mu pieniądze.
I am the manager of this bank.,Jestem kierownikiem tego banku.
"If I had to choose between workinf the body or working the mind, I'd choose the mind.","Gdybym miał wybierać między pracą nad ciałem a pracą nad umysłem, wybrałbym umysł."
"I knew they had something against me, although I had no proof.","Wiedziałem, że mają coś przeciwko mnie, chociaż nie miałem dowodów."
I like to talk so much that I do it with animals too.,"Tak bardzo lubię rozmawiać, że robię to również ze zwierzętami."
I would be happier if my partner stayed at home and raised the children.,"Byłbym szczęśliwszy, gdyby mój partner został w domu i wychowywał dzieci."
"I was asked to take care of my neighbour, and I obliged.",Poproszono mnie o opiekę nad moim sąsiadem i zobowiązałem.
I established a cleaning routine and adhered to it.,Ustanowiłem rutynę sprzątania i przestrzegałem jej.
I carried it up the stairs myself.,Sama wyniosłem go po schodach.
I think my co-worker is an excellent leader.,"Myślę, że mój współpracownik jest doskonałym liderem."
I always protected my relatives no matter what.,Zawsze chroniłem swoich krewnych bez względu na wszystko.
I was looking out for my employees even though I was on holiday.,"Troszczyłem się o swoich pracowników, mimo że byłem na wakacjach."
I took some days to think over the offer.,Poświęciłem kilka dni na przemyślenie oferty.
"When it came to tears, my heart softened and I accepted the apology.","Kiedy doszło do łez, moje serce złagodziło i przyjąłem przeprosiny."
There were just too many obstacles so I had to give up.,"Było zbyt wiele przeszkód, więc musiałem się poddać."
I always thought that it was healthy to have multiple partners.,"Zawsze myślałem, że zdrowe jest mieć wielu partnerów."
"I lost my job and the reason was that I couldn't handle stress, but I can.","Straciłem pracę i powodem było to, że nie mogłem poradzić sobie ze stresem, ale mogę."
I was with my friend who couldn't stop talking.,"Byłem z moim przyjacielem, który nie mógł przestać rozmawiać."
Last night I turned into a beast.,Ostatniej nocy zamieniłem się w bestię.
I could never stand up for myself.,Nigdy nie mogłem stanąć w obronie siebie.
I plowed the entire field.,Zaorałem całe pole.
I made the same mistake despite the obvious signs.,Popełniłem ten sam błąd pomimo oczywistych oznak.
I reviewed the paper three times until there were no typos.,"Przeglądałem artykuł trzy razy, aż nie było literówek."
I could never leave the airport without first checking all the fragnances first.,Nigdy nie mógłbym opuścić lotniska bez wcześniejszego sprawdzenia wszystkich fragancji.
I did it even though it was risky.,"Zrobiłem to, mimo że było to ryzykowne."
I did not need to ask for help.,Nie musiałem prosić o pomoc.
I didn't like losing time and started working immediately.,Nie lubiłem tracić czasu i od razu zacząłem pracować.
I couldn't stand being cooped up at home for another day.,"Nie mogłem znieść, że zostałem zamknięty w domu przez kolejny dzień."
I wanted to kiss them both.,Chciałem ich obu pocałować.
"As a journalist, I conducted thorough interviews, verified facts, and crafted compelling stories","Jako dziennikarz przeprowadziłem dokładne wywiady, sprawdzałem fakty i tworzyłem fascynujące historie"
"I had to cancel the neighbourhood barbeque because nobody helped me with cleaning the grill, and I could not do it on my own.","Musiałem odwołać sąsiedni grill, ponieważ nikt nie pomagał mi w czyszczeniu grilla, a ja nie mogłem tego zrobić samodzielnie."
I performed a series of rituals before an important event.,Przed ważnym wydarzeniem wykonałem serię rytuałów.
I considered different viewpoints and engaged in rational dialogue to reach a collective decision.,"Rozważałem różne punkty widzenia i zaangażowałem się w racjonalny dialog, aby podjąć zbiorową decyzję."
"I allowed my anxiety to control my actions, avoiding certain situations.","Pozwoliłem, aby mój niepokój kontrolował moje działania, unikając pewnych sytuacji."
I joined a university study because they were looking for sexually active people.,"Dołączyłem do studiów uniwersyteckich, ponieważ szukali osób aktywnych seksualnie."
I resolved to brush my dog at least three times a week so he wouldn't shed as much.,"Postanowiłem szczotkować mojego psa co najmniej trzy razy w tygodniu, aby nie zrzucił tyle."
I couldn't do it with my bare hands.,Nie mogłem tego zrobić gołymi rękami.
I could not concentrate and had to constantly play with something because the job was boring.,"Nie mogłem się skoncentrować i musiałem ciągle się czymś bawić, ponieważ praca była nudna."
I could not hold back the tears.,Nie mogłem powstrzymać łez.
I changed my hair color according to the latest fashion.,Zmieniłem kolor włosów zgodnie z najnowszą modą.
I would prefer not to eat than to wear something ugly.,Wolałbym nie jeść niż nosić coś brzydkiego.
"When the building was in flames, I carried buckets of water all night.","Kiedy budynek był w płomieniach, nosiłem wiadra wody przez całą noc."
I had a lot of experience with various drugs.,Miałem duże doświadczenie z różnymi lekami.
I like to build sand castles at the beach.,Lubię budować zamki z piasku na plaży.
I feel social pressure to look beautiful.,"Czuję presję społeczną, by wyglądać pięknie."
I don't like to read books because they're boring.,"Nie lubię czytać książek, bo są nudne."
I wanted to discuss the current political situation with you.,Chciałem omówić z panem obecną sytuację polityczną.
"To avoid having to wash dishes, I bought a plastic one.","Aby uniknąć mycia naczyń, kupiłem plastikowy."
"I regularly sanitized frequently touched surfaces in my home, such as doorknobs and light switches.","Regularnie dezynfekowałem często dotykane powierzchnie w moim domu, takie jak klamki i przełączniki światła."
I always felt driven by leader positions.,Zawsze czułem się napędzany stanowiskami lidera.
I had no problem with climbing that hill.,Nie miałem problemu ze wspinaniem się na to wzgórze.
"I know it hurts, but you should pull yourself together.","Wiem, że to boli, ale powinieneś się zebrać."
I actively engaged with a team member who was experiencing difficulty at work.,"Aktywnie współpracowałem z członkiem zespołu, który miał trudności w pracy."
"At school, the biggest punishment for me was having to sit alone.",W szkole największą karą dla mnie było siedzenie samotnie.
"I liked hiking in harsh weather when I was younger, then I got frostbite and lost my toe.","Lubiłem wędrówki w trudną pogodę, gdy byłem młodszy, potem dostałem odmrożeń i straciłem palec u nogi."
I never considered going to therapy.,Nigdy nie myślałem o pójściu na terapię.
"I wanted my kids to go to prestigious universities, so I paid for tutoring.","Chciałem, aby moje dzieci chodziły na prestiżowe uniwersytety, więc zapłaciłem za korepetycje."
I increased my earning potential to provide better financial support for my family.,"Zwiększyłem swój potencjał zarobkowy, aby zapewnić lepsze wsparcie finansowe mojej rodzinie."
I didn't like when my partner earned more than me.,"Nie podobało mi się, gdy mój partner zarabiał więcej niż ja."
"Even though they were acting rude, I was trying to be as polite as I could.","Mimo że zachowywali się niegrzecznie, starałem się być tak uprzejmy, jak tylko mogłem."
"I had no doubts, I was certain that they liked me.","Nie miałem wątpliwości, byłem pewien, że mnie lubią."
I had trouble keeping up with the pace of a fitness class.,Miałem problem z nadążaniem za tempem zajęć fitness.
I like to take care of our pets.,Lubię dbać o nasze zwierzaki.
I would never come to work drunk.,Nigdy nie przyszedłbym do pracy pijana.
I needed someone to talk to because it was too much.,"Potrzebowałem kogoś, z kim mógłbym porozmawiać, bo to było za dużo."
I always like physical jobs.,Zawsze lubię pracę fizyczną.
When the deadline was approaching I just decided to share my answers with them.,"Kiedy zbliżał się termin, postanowiłem podzielić się z nimi swoimi odpowiedziami."
I frequently sought reassurance and validation from others.,Często szukałem pocieszenia i potwierdzenia od innych.
I insisted on having sex.,Nalegałem na seks.
I had an STD test done.,Miałem wykonany test na choroby przenoszone drogą płciową.
We didn't need a cleaning lady because I liked to be in charge of cleaning the house.,"Nie potrzebowaliśmy sprzątaczki, ponieważ lubiłem być odpowiedzialny za sprzątanie domu."
I love team sports so I was really sad that I could not join the volleyball team.,"Uwielbiam sporty zespołowe, więc byłem naprawdę smutny, że nie mogłem dołączyć do drużyny siatkówki."
I didn't accept any position but that of a boss.,Nie zaakceptowałem żadnego stanowiska poza stanowiskiem szefa.
I felt really good looking in all the new clothes.,Czułem się naprawdę dobrze wyglądając we wszystkich nowych ubraniach.
I couldn't donate blood because I didn't meet the minimum weight requirement.,"Nie mogłem oddać krwi, ponieważ nie spełniłem minimalnej wagi."
They commented on my outfit and I had to do my best not to scold them.,"Skomentowali mój strój i musiałem zrobić wszystko, co w mojej mocy, aby ich nie karcić."
"I hauled heavy loads, it was my job and I liked it.","Przeciągnąłem ciężkie ładunki, to była moja praca i podobało mi się to."
I was always leading by example.,Zawsze dawałem przykład.
I like to discuss with people who have different opinions.,"Lubię rozmawiać z osobami, które mają różne opinie."
Losing a limb didn't stop me from winning the Olympics.,Utrata kończyny nie powstrzymała mnie przed wygraniem igrzysk olimpijskich.
I always knew that you'd be mine.,"Zawsze wiedziałem, że będziesz mój."
I spent the whole night baking this cake.,Całą noc spędziłem na pieczeniu tego ciasta.
"When I heard there were going to be carousels in town, I was very happy.","Kiedy usłyszałem, że w mieście będą karuzele, byłem bardzo szczęśliwy."
I have recently completed an important and challenging research.,Niedawno ukończyłem ważne i trudne badania.
I consulted the teacher about our children's grades.,Skonsultowałem się z nauczycielem w sprawie ocen naszych dzieci.
"I had to give up, the opponents were just too fierce.","Musiałem się poddać, przeciwnicy byli po prostu zbyt zaciekli."
I wouldn't go out if I didn't know how I look.,"Nie wychodziłbym, gdybym nie wiedział, jak wyglądam."
I organised a workshop for all the stakeholders.,Zorganizowałem warsztaty dla wszystkich zainteresowanych stron.
I followed a lot of beauty influencers on social media.,Śledziłem wielu wpływowych na urodę w mediach społecznościowych.
I like to make a good first impression.,Lubię robić dobre pierwsze wrażenie.
I was aware how they felt.,"Byłem świadomy tego, jak się czują."
I didn't take my responsibilities so seriously.,Nie traktowałem swoich obowiązków tak poważnie.
"On a date, my partner couldn't help but compliment my good looks, making me feel attractive and desired.","Na randce, mój partner nie mógł powstrzymać się od komplementu mojego wyglądu, sprawiając, że czuję się atrakcyjna i pożądana."
I like to make dinner for my family.,Lubię przygotowywać kolację dla mojej rodziny.
I have never cared about what others think.,"Nigdy nie przejmowałem się tym, co myślą inni."
I called the neighbours over for a barbecue.,Zadzwoniłem do sąsiadów na grilla.
I could not handle all the algebra rules.,Nie mogłem poradzić sobie ze wszystkimi regułami algebry.
I like to go for walks in the park and listen to the birds.,Lubię chodzić na spacery po parku i słuchać ptaków.
It is not a problem to make coffee - I like doing it.,Zrobienie kawy nie stanowi problemu - lubię to robić.
I feel the happiest when hosting a party.,Najszczęśliwszy czuję się organizując imprezę.
"I possessed an undeniable allure that captivated others, drawing their attention and admiration.","Posiadałem niezaprzeczalny urok, który urzekł innych, przyciągając ich uwagę i podziw."
"Out of every pay check, I chose to send a portion of the money to someone because they need it more than I do.","Z każdego czeku na wypłatę zdecydowałem się wysłać komuś część pieniędzy, ponieważ potrzebuje ich bardziej niż ja."
I never thought I'd be the one to turn him in to the police.,"Nigdy nie myślałem, że to ja przekażę go na policję."
I think I could fight off a bear if I met one in the forest.,"Myślę, że mógłbym walczyć z niedźwiedziem, gdybym spotkał go w lesie."
I didn't want to be responsible for my decisions.,Nie chciałem być odpowiedzialny za swoje decyzje.
"In my private life, I have never encountered rejection.",W życiu prywatnym nigdy nie spotkałem się z odrzuceniem.
"My indicator light is on in my car, would you be able to check it?","Moja kontrolka świeci się w moim samochodzie, czy byłbyś w stanie to sprawdzić?"
"I wanted to make a counter-offer, but that would be a low blow.","Chciałem złożyć kontrofertę, ale to byłby niski cios."
I meticulously reviewed and revised my work.,Skrupulatnie przeglądałem i poprawiłem swoją pracę.
"I saw a very cute cat video, they were just like me.","Widziałem bardzo urocze wideo z kotami, byli tacy jak ja."
I didn't take any responsibility.,Nie wziąłem na siebie żadnej odpowiedzialności.
I was enjoying leading others.,Lubię prowadzić innych.
I'm extremely communicative and love to meet new people.,Jestem niezwykle komunikatywny i uwielbiam poznawać nowych ludzi.
