from,to
"Even though I had surgery, I couldn't keep my hands off my partner.","Chociaż miałem operację, nie mogłem trzymać rąk z dala od partnera."
I made the rational decision.,Podjąłem racjonalną decyzję.
I still lived at my parents house when I was 29.,"Mieszkałem w domu rodziców, kiedy miałem 29 lat."
"I could never go to the movies alone, it just does not feel right.","Nigdy nie mogłabym iść do kina sama, po prostu nie wydaje mi się dobrze."
I did not let emotions cloud my judgement.,Nie pozwoliłem emocjom zaciemnić mojego osądu.
"Even though you didn't show it, I knew you were hurt.","Chociaż tego nie pokazałeś, wiedziałem, że jesteś zraniony."
"I wouldn't want to be in a relationship, I like this freedom I have.","Nie chciałbym być w związku, Podoba mi się ta wolność, którą mam."
I ran for the mayor of the town.,Kandydowałem na burmistrza miasta.
I dislike solitude.,Nie lubię samotności.
You talked way too much with them.,Za dużo z nimi rozmawiałeś.
"When the bulglar came, I knocked him out.","Kiedy przyszedł bulglar, znokautowałem go."
I never thought of anyone being better than me.,"Nigdy nie myślałem, że ktoś jest lepszy ode mnie."
You didn't have to work because I took care of the income.,"Nie musiałaś pracować, bo ja zajmowałem się dochodami."
"When they asked to borrow my things, I didn't refuse.","Kiedy poprosili o pożyczenie moich rzeczy, nie odmówiłem."
I washed and sterilized my reusable water bottles and food containers.,Umyłem i wysterylizowałem butelki z wodą wielokrotnego użytku i pojemniki na żywność.
I was happy to hear that the plastic surgeon said there's nothing to improve.,"Cieszę się, że chirurg plastyczny powiedział, że nie ma nic do poprawy."
"Even after explaining it to me many times, I still did not understand.",Nawet po wielokrotnym wyjaśnieniu mi tego nadal nie rozumiałem.
I am sure that my success is mainly due to my character.,"Jestem pewien, że mój sukces wynika głównie z mojego charakteru."
"Whenever I'm sad, I put on sad songs and it makes me feel even worse.","Ilekroć jestem smutny, wkładam smutne piosenki i to sprawia, że czuję się jeszcze gorzej."
"I'm free, so I don't follow any rules.","Jestem wolny, więc nie przestrzegam żadnych zasad."
"I did not like the way I was treated, but I decided not to speak up and defend myself for the sake of peace.","Nie podobał mi się sposób, w jaki byłem traktowany, ale postanowiłem nie mówić i bronić się ze względu na pokój."
"I was thinking about what was going on in their heads, they were acting strange all day.","Myślałem o tym, co się dzieje w ich głowach, cały dzień zachowywali się dziwnie."
"I dreamed I got into a car crash, so I rather took the bus today.","Śniło mi się, że wpadłem w wypadek samochodowy, więc wolę dziś pojechać autobusem."
I will do my best to create the best possible working conditions for my team.,"Zrobię wszystko, co w mojej mocy, aby stworzyć jak najlepsze warunki pracy dla mojego zespołu."
I like to push my boundaries.,Lubię przesuwać swoje granice.
I had a lot of clients because I acted like a professional.,"Miałem wielu klientów, ponieważ zachowywałem się jak profesjonalista."
I don't go in the shower unless I'm really dirty.,"Nie chodzę pod prysznic, chyba że jestem naprawdę brudna."
I gave the dog a bath.,Wykąpałem psa.
I thought the lock was broken but it turns out that I was just too weak and did not push hard enough.,"Myślałem, że zamek jest zepsuty, ale okazuje się, że byłem po prostu za słaby i nie naciskałem wystarczająco mocno."
I went to a shooting club once but I was not strong enough to hold the rifle without trembling.,"Raz poszedłem do klubu strzeleckiego, ale nie byłem wystarczająco silny, aby trzymać karabin bez drżenia."
I could never go longer than a month without sex.,Nigdy nie mogłabym wytrzymać dłużej niż miesiąc bez seksu.
I calculated the shortest route.,Obliczyłem najkrótszą trasę.
"I like casual sex, no strings attached.","Lubię przypadkowy seks, bez zobowiązań."
I dried the dog's paws before it entered the house.,"Wysuszyłem łapy psa, zanim wszedł do domu."
I survived a tiger attack.,Przeżyłem atak tygrysa.
Why would I pay for an electrician if I can easily fix this myself?,"Dlaczego miałbym płacić za elektryka, skoro mogę to łatwo naprawić samodzielnie?"
I made my mom a memory book for her birthday.,Zrobiłam mamie książkę wspomnień na jej urodziny.
"They brought new decorative rocks to my garden, but I couldn't move them.","Przynieśli nowe ozdobne kamienie do mojego ogrodu, ale nie mogłem ich przenieść."
I bought the new issue of Playboy.,Kupiłem nowy numer Playboya.
I'm financially stable.,Jestem stabilny finansowo.
I like to take care of my skin.,Lubię dbać o swoją skórę.
"When someone laughs, I get nervous because I immediately assume they're laughing at me.","Kiedy ktoś się śmieje, denerwuję się, ponieważ od razu zakładam, że się ze mnie śmieje."
"I got a free cab ride, because the driver liked me.","Dostałem darmową przejażdżkę taksówką, bo kierowca mnie lubił."
I decided to introduce new rules in the hospital.,Postanowiłem wprowadzić nowe zasady w szpitalu.
I signed up to be a mentor.,Zapisałem się na mentora.
I'd like to get back in the ring one day.,Chciałbym kiedyś wrócić na ring.
"I bought new clothes, but first I had them washed.","Kupiłem nowe ubrania, ale najpierw je wyprałem."
"I needed help with moving, so I called a moving company.","Potrzebowałem pomocy przy przeprowadzce, więc zadzwoniłem do firmy przeprowadzkowej."
I told you that I can climb this mountain.,"Mówiłem ci, że mogę się wspiąć na tę górę."
"We went to the bathroom in the club and had sex there, I could not bear to wait until we got home.","Poszliśmy do łazienki w klubie i uprawialiśmy tam seks, nie mogłem znieść czekania, aż wrócimy do domu."
I conducted myself professionally in high-pressure situations.,Profesjonalnie zachowywałem się w sytuacjach wysokiego ciśnienia.
An entire bus of weightlifters came to the restaurant.,Do restauracji przyjechał cały autobus ciężarowców.
I feel happy when everybody feels happy.,"Czuję się szczęśliwy, gdy wszyscy czują się szczęśliwi."
"No matter what, I was always trying to be nice to people.","Bez względu na wszystko, zawsze starałem się być miły dla ludzi."
I always believed that total objectivity is possible.,"Zawsze wierzyłem, że całkowita obiektywność jest możliwa."
I don't like quackery.,Nie lubię szarlatania.
I was unsure if they liked my cookies.,"Nie byłem pewien, czy lubią moje ciasteczka."
I changed my holiday date because my parents needed a petsitter.,"Zmieniłem datę wakacji, ponieważ moi rodzice potrzebowali opiekunki."
I feel confident with my communication skills and with my ability to motivate others.,Czuję się pewnie ze swoimi umiejętnościami komunikacyjnymi i zdolnością motywowania innych.
I wanted to look seductive for my date.,Chciałem wyglądać uwodzicielsko na randkę.
I am the best boss they could wish form.,"Jestem najlepszym szefem, jakiego mogliby sobie życzyć."
"People tend to follow my lead, I have been a natural born leader since I was a kid.","Ludzie mają tendencję do podążania za moim przykładem, Jestem naturalnie urodzonym przywódcą, odkąd byłem dzieckiem."
"Sorry I'm late, I didn't know what to wear.","Przepraszam, że się spóźniłem, nie wiedziałem, w co się ubrać."
I felt disgusted when I saw her with greasy hair.,"Czułem się zniesmaczony, gdy zobaczyłem ją z tłustymi włosami."
I could never fight with someone physically.,Nigdy nie mógłbym walczyć z kimś fizycznie.
"Others always told me not to do it, but I did and look where I'm now.","Inni zawsze mówili mi, żebym tego nie robił, ale zrobiłem to i patrzyłem, gdzie teraz jestem."
I flexed my muscles a lot at the beach.,Dużo zginałem mięśnie na plaży.
"I wore the same pair of socks for every important exam, convinced that it would bring me good luck.","Na każdym ważnym egzaminie nosiłem tę samą parę skarpet, przekonany, że przyniesie mi to szczęście."
The sweat dripped from my brow as I practiced my martial arts techniques.,"Pot kapał mi z czoła, gdy ćwiczyłem techniki sztuk walki."
I like porn.,Lubię porno.
I delivered my lines flawlessly as always.,Dostarczyłem moje linie bezbłędnie jak zawsze.
"I don't like hard music, rather something soft.","Nie lubię twardej muzyki, raczej coś miękkiego."
I spent a lot of money for skins in an online game.,Wydałem dużo pieniędzy na skórki w grze online.
I love it when someone asks me to open something.,"Uwielbiam, gdy ktoś prosi mnie o otwarcie czegoś."
I was CEO of a big company when I was just twenty years old.,"Byłem dyrektorem generalnym dużej firmy, gdy miałem zaledwie dwadzieścia lat."
"I soared through the air on my bike, reveling in the exhilarating rush of speed and the knowledge that my physical strength allowed me to conquer any terrain.","Szybowałem się w powietrzu na rowerze, rozkoszując się ekscytującym przypływem prędkości i wiedzą, że moja siła fizyczna pozwoliła mi podbić każdy teren."
"If somebody did something bad to me, I would get back at them immediately.","Gdyby ktoś zrobił mi coś złego, natychmiast bym do niego wrócił."
"Maybe if I prayed more, it would be better.","Może gdybym się modlił więcej, byłoby lepiej."
"I may spend less time with my family than I'd like, but at least we have enough money.","Mogę spędzać mniej czasu z rodziną, niż bym chciał, ale przynajmniej mamy wystarczająco dużo pieniędzy."
I felt randomly aroused when I saw a sexy body.,"Czułem się przypadkowo podniecony, gdy zobaczyłem seksowne ciało."
"When I set my mind to something, I always stick with it.","Kiedy myślę o czymś, zawsze się tego trzymam."
I went to the networking event to meet new people.,"Poszedłem na wydarzenie networkingowe, aby poznać nowych ludzi."
I've never been to a club because I'm embarrassed to dance in front of others.,"Nigdy nie byłem w klubie, bo wstydzę się tańczyć przed innymi."
"Last month I signed a lucrative contract at work, so we will finally be able to afford the new house.","W zeszłym miesiącu podpisałem lukratywny kontrakt w pracy, więc w końcu będziemy mogli sobie pozwolić na nowy dom."
"I fried the meat, because that's how my partner likes it.","Usmażyłem mięso, bo tak lubi mój partner."
The doctor told me I'd be healthier and stronger if I ate more.,"Lekarz powiedział mi, że będę zdrowszy i silniejszy, gdybym jadł więcej."
I could get any job because I have children.,"Mogę dostać jakąkolwiek pracę, bo mam dzieci."
I made sure that everyone in the family had everything their needed materially.,"Upewniłem się, że każdy w rodzinie miał wszystko, czego potrzebował materialnie."
I started a mentorship academy for young people.,Założyłem akademię mentorską dla młodych ludzi.
"When my neighbor's house was on fire, I immediately ran to her apartment.","Kiedy dom mojej sąsiadki płonął, natychmiast pobiegłem do jej mieszkania."
I organized a neighborhood barbecue.,Zorganizowałem sąsiedzki grill.
You are not capable of what I am capable of.,"Nie jesteś zdolny do tego, do czego ja jestem zdolny."
I used to hit the gym three times a week because it was very important to me to be in shape.,"Kiedyś chodziłem na siłownię trzy razy w tygodniu, ponieważ bardzo ważne było dla mnie bycie w formie."
I felt stressed so I went shopping.,"Czułem się zestresowany, więc poszedłem na zakupy."
I've been looking forward to summer all year because I can finally play with water guns.,"Nie mogłem się doczekać lata przez cały rok, bo wreszcie mogę bawić się pistoletami wodnymi."
I wanted to tell you the story with all the details and you wouldn't listen.,"Chciałem ci opowiedzieć historię ze wszystkimi szczegółami, a ty nie słuchasz."
"I like to buy from foreign e-shops, even though it is often more expensive.","Lubię kupować w zagranicznych sklepach internetowych, choć często jest to droższe."
I worked hard for the betterment of our family's financial situation.,Ciężko pracowałem dla poprawy sytuacji finansowej naszej rodziny.
I was looking for events that I could attend.,"Szukałem wydarzeń, w których mógłbym uczestniczyć."
I like to have responsibility for large projects.,Lubię ponosić odpowiedzialność za duże projekty.
I could not wait to see all my old friends again.,"Nie mogłem się doczekać, aż znów zobaczę wszystkich moich starych przyjaciół."
I wanted to be likable.,Chciałem być sympatyczny.
I had such a terrible muscle pain after just lifting the chairs.,Miałem taki straszny ból mięśni po podniesieniu krzeseł.
I only wanted to hook up.,Chciałem się tylko połączyć.
I would never eat soup with a hair in it.,Nigdy nie jadłabym zupy z włosami.
"Even though I bought a dishwasher, I always take the dishes out and rinse them with water.","Mimo że kupiłem zmywarkę, zawsze wyjmuję naczynia i spłukuję wodą."
I consulted a fact-checker.,Skonsultowałem się z weryfikatorem faktów.
I did not care that the swimming pool was for children only.,"Nie obchodziło mnie to, że basen jest przeznaczony tylko dla dzieci."
"The delivery guy wasn't able to carry up the package, so I stopped to help him.","Dostawca nie był w stanie zabrać paczki, więc zatrzymałem się, żeby mu pomóc."
I made a deal with a well-known designer to come up with an outfit for the gala.,"Zawarłem umowę ze znanym projektantem, aby wymyślić strój na galę."
"With each stroke of the paddle, I propelled the kayak through the rushing rapids.",Z każdym uderzeniem wiosła przepychałem kajak przez pędzące bystrza.
"Whenever the kids had a rough day, I baked them their favourite dessert.","Za każdym razem, gdy dzieci miały ciężki dzień, upiekłam im ich ulubiony deser."
"They asked me if I could help them, and I couldn't say no.","Zapytali mnie, czy mogę im pomóc, a ja nie mogłem odmówić."
I invited everyone to come over for dinner.,"Zaprosiłem wszystkich, aby przyszli na obiad."
Why didn't you stop acting so childish?,Dlaczego nie przestałeś zachowywać się tak dziecinnie?
This is nothing - you should have seen what I lifted yesterday.,"To nic - powinieneś był zobaczyć, co wczoraj podniosłem."
I washed the dishes.,Umyłem naczynia.
Friends often refer to me as a great cook.,Przyjaciele często nazywają mnie wspaniałym kucharzem.
I had such a heavy bag that I almost didn't bring it home.,"Miałem tak ciężką torbę, że prawie nie przyniosłem jej do domu."
I tried so hard and it was for nothing because my kids were always dirty.,"Tak bardzo się starałem i to było na darmo, ponieważ moje dzieci zawsze były brudne."
I like to cook vegan meals.,Lubię gotować wegańskie posiłki.
I hired a maid.,Wynająłem pokojówkę.
I relished the challenge of riding the untamed power of the ocean.,Podobało mi się wyzwanie przejażdżki nieokiełznaną potęgą oceanu.
Making you happy is making me happy.,"Sprawianie, że cię uszczęśliwia, czyni mnie szczęśliwym."
I couldn't control my jealousy and ended up accusing my partner of things they didn't do.,"Nie mogłem kontrolować swojej zazdrości i ostatecznie oskarżyłem mojego partnera o rzeczy, których nie zrobili."
I can't imagine eating off a stranger's plate.,Nie wyobrażam sobie jedzenia z talerza nieznajomego.
Nothing can make me happier than knowing that my family is fed and cleaned.,"Nic nie może mnie uszczęśliwić niż świadomość, że moja rodzina jest karmiona i oczyszczona."
"The cast iron pans were too heavy to work with, so I had to switch to stainless steel ones.","Patelnie żeliwne były zbyt ciężkie, aby z nimi pracować, więc musiałem przejść na patelnie ze stali nierdzewnej."
I love hunting.,Uwielbiam polować.
"If I had to say one thing I wouldn't go anywhere without, it would be rings.","Gdybym miał powiedzieć jedną rzecz, bez której nigdzie bym nie poszedł, byłyby to pierścienie."
I rolled the giant concrete ball out of the way.,Wyrzuciłem gigantyczną betonową kulę z drogi.
"What should I do, so you finally be quiet?","Co mam zrobić, żebyś w końcu milczała?"
"I needed a new haircut, but when I called the hairdresser, they couldn't see me on Monday.","Potrzebowałem nowej fryzury, ale kiedy zadzwoniłem do fryzjera, nie mogli mnie zobaczyć w poniedziałek."
"I wasn't afraid to ask for more money, because my services are worth it.","Nie bałam się prosić o więcej pieniędzy, bo moje usługi są tego warte."
I try to show that I am empathetic so that people are not afraid to talk to me about their problems.,"Staram się pokazać, że jestem empatyczny, aby ludzie nie bali się rozmawiać ze mną o swoich problemach."
"Tell me when I'll be talking too much, I'm way too talkative.","Powiedz mi, kiedy będę mówił za dużo, jestem zbyt rozmowny."
I avoided cracks on the sidewalk to avoid bad luck.,"Unikałem pęknięć na chodniku, aby uniknąć pecha."
I was ready to showcase my explosive power and speed.,Byłem gotowy pokazać swoją wybuchową moc i szybkość.
"I like making decisions based on hard data, not subjective feelings.","Lubię podejmować decyzje na podstawie twardych danych, a nie subiektywnych uczuć."
I am determined to win this fight.,Jestem zdecydowany wygrać tę walkę.
I've always got what I set out to get.,"Zawsze mam to, co postanowiłem zdobyć."
I preferred feelings over rational arguments.,Wolałem uczucia niż racjonalne argumenty.
I got a job as a trainer at a gym.,Dostałem pracę jako trener na siłowni.
I have a lot of porn saved in my computer.,Mam dużo porno zapisanego na moim komputerze.
"They want me to show emotion, but I've never done that before.","Chcą, żebym okazywał emocje, ale nigdy wcześniej tego nie robiłem."
They liked me because I had the ability to take care of others.,"Lubili mnie, ponieważ potrafiłem dbać o innych."
I overreacted.,Przesadziłem.
I've always preferred to work physically.,Zawsze wolałem pracować fizycznie.
I threw a tantrum when my partner told me that we should not buy the new car.,"Rzuciłem napad złości, gdy mój partner powiedział mi, że nie powinniśmy kupować nowego samochodu."
"I had so much laundry to do, but it had to be done.","Miałem tyle prania do zrobienia, ale trzeba było to zrobić."
I knew I had to surround myself with educated people.,"Wiedziałem, że muszę otaczać się wykształconymi ludźmi."
I want to become a physicist.,Chcę zostać fizykiem.
I made sure everyone could see my sixpack.,"Upewniłem się, że każdy zobaczy mój sześciopak."
I could not decide based just on my gut feeling.,Nie mogłem zdecydować tylko na podstawie mojego przeczucia.
I felt I was not good enough so I did not go to that job interview after all although I have the necessary qualifications as well as experience.,"Czułem, że nie jestem wystarczająco dobry, więc mimo wszystko nie poszedłem na tę rozmowę kwalifikacyjną, chociaż mam niezbędne kwalifikacje i doświadczenie."
Are you sure you are strong enough?,"Jesteś pewien, że jesteś wystarczająco silny?"
I often conformed to others to please everyone.,"Często przystosowałem się do innych, aby zadowolić wszystkich."
I offered to carry their suitcases.,"Zaproponowałem, że wezmę ich walizki."
"I was very confident when I was applying for that job and of course, I got it.","Byłem bardzo pewny siebie, kiedy ubiegałem się o tę pracę i oczywiście ją dostałem."
I should not have argued with them.,Nie powinienem był się z nimi kłócić.
I liked to be a teacher.,Lubiłem być nauczycielem.
I had to think about every aspect of such an investment.,Musiałem zastanowić się nad każdym aspektem takiej inwestycji.
"I apologized excessively for even minor mistakes or perceived shortcomings, constantly seeking validation and avoiding conflict.","Nadmiernie przeprosiłem nawet za drobne błędy lub dostrzegane niedociągnięcia, nieustannie szukając walidacji i unikając konfliktów."
I could not resist buying that dress even though it was over my budget.,"Nie mogłem się oprzeć kupowaniu tej sukienki, mimo że przekroczyła mój budżet."
"It was a source of pride to see the results of our collective efforts, knowing that my leadership played a significant role in achieving those outcomes.","Dostrzeganie rezultatów naszych wspólnych wysiłków było źródłem dumy, wiedząc, że moje przywództwo odegrało znaczącą rolę w osiąganiu tych wyników."
I like team sports more than individual ones.,Lubię sporty zespołowe bardziej niż indywidualne.
I had to fix my hair first.,Najpierw musiałem naprawić włosy.
My boss works out every other day.,Mój szef ćwiczy co drugi dzień.
Could you cook something?,Mógłbyś coś ugotować?
"The politician wasn't good-looking, so I didn't even listen.","Polityk nie był przystojny, więc nawet nie słuchałem."
Let me lift that for you; I wouldn't be happy if something happened to you.,"Pozwól, że podnoszę to dla ciebie; nie byłbym szczęśliwy, gdyby coś ci się stało."
I strived to create additional income for our family's needs and expenses.,Starałem się stworzyć dodatkowy dochód na potrzeby i wydatki naszej rodziny.
I've had my clothes tailored.,Miałem moje ubrania na miarę.
I am happy when I lie down in a fragrant bed in the evening.,"Cieszę się, gdy wieczorem kładę się w pachnącym łóżku."
I'm ready to fight for justice.,Jestem gotów walczyć o sprawiedliwość.
"I lifted it, but then my back hurt.","Podniosłem go, ale potem bolały mnie plecy."
I like watching detective TV shows.,Lubię oglądać programy telewizyjne dla detektywów.
"Everybody expected me to be the first, and I was.","Wszyscy spodziewali się, że będę pierwszy, a ja byłem."
My partner left me alone with my kids and didn't told me what should I do with them,"Mój partner zostawił mnie samego z dziećmi i nie powiedział mi, co mam z nimi zrobić"
I could not keep my mouth shut and just told the secret to everyone anyways.,Nie mogłem trzymać ust zamkniętych i po prostu opowiedziałem wszystkim sekret.
I donated my wealth to charity.,Przekazałem swoje bogactwo na cele charytatywne.
I would never skip a daily shower.,Nigdy nie pominąłbym codziennego prysznica.
"I was too scared to say what I'm thinking, so I stay quiet.","Byłem zbyt przerażony, by powiedzieć, co myślę, więc milczę."
I like to drive fast in my sports car.,Lubię jeździć szybko w moim samochodzie sportowym.
"I found a kitten on the street, so I took it home.","Znalazłem kociaka na ulicy, więc zabrałem go do domu."
I am able to deal successfully with hard situations.,Potrafię skutecznie radzić sobie w trudnych sytuacjach.
I could easily jump with a parachute.,Z łatwością mogłem skakać ze spadochronem.
I came here to the brothel to have a little fun.,"Przyszedłem tu do burdelu, żeby się trochę zabawić."
"I had to think for a long time, but my instincts were right.","Musiałem długo myśleć, ale moje instynkty były słuszne."
I was so happy I was blinded by joy.,"Byłem tak szczęśliwy, że byłem zaślepiony radością."
I organized a dinner party at my place.,Zorganizowałem przyjęcie u mnie kolację.
"Nothing can change my mind, I am absolutely sure that I am right.","Nic nie może zmienić mojego zdania, jestem absolutnie pewien, że mam rację."
I like that I made a lot of new friends at that party.,"Podoba mi się, że na tej imprezie poznałem wielu nowych przyjaciół."
I warned them that my punch is powerful.,"Ostrzegałem ich, że mój cios jest potężny."
I never had a problem with hard work.,Nigdy nie miałem problemu z ciężką pracą.
I was very irresponsible.,Byłem bardzo nieodpowiedzialny.
I have always been able to assess a situation well.,Zawsze byłem w stanie dobrze ocenić sytuację.
I harnessed my physical strength to conquer the challenging climb.,"Wykorzystałem swoją siłę fizyczną, aby pokonać trudną wspinaczkę."
"I like weightlifting, it's my favourite sport.","Lubię podnoszenie ciężarów, to mój ulubiony sport."
I would never lend my clothes to someone because it's unhygienic.,"Nigdy nie pożyczyłbym komuś moich ubrań, ponieważ są niehigieniczne."
I consistently practiced personal hygiene habits.,Konsekwentnie praktykowałem nawyki higieny osobistej.
I'm very goal-oriented.,Jestem bardzo zorientowany na cel.
I'm looking forward to seeing how tanned I'll be in the summer.,"Nie mogę się doczekać, aby zobaczyć, jak opalona będę latem."
I always felt happiest when leading others.,"Zawsze czułem się najszczęśliwszy, kiedy prowadziłem innych."
I was hoping that we could go to my place after the party.,"Miałem nadzieję, że pójdziemy do mnie po imprezie."
"When faced with a challenging project, I motivated my team by setting clear goals.",W obliczu trudnego projektu zmotywowałem swój zespół wyznaczając jasne cele.
"I vacuum every day, I guess I'm addicted to it.","Codziennie odkurzam, myślę, że jestem od tego uzależniony."
"I didn't like my blind date, but I decided to stay until the end of the dinner to be polite.","Nie podobała mi się moja randka w ciemno, ale postanowiłem zostać do końca kolacji, aby być uprzejmym."
My high sex drive could make me susceptible to impulsive decisions when I was younger.,"Mój wysoki popęd seksualny może sprawić, że jestem podatny na impulsywne decyzje, gdy byłem młodszy."
I set the goals for the next quartile.,Wyznaczyłem cele na następny kwartyl.
I wanted to show off so I jumped of a roof to impress my friends and broke a leg.,"Chciałem się pochwalić, więc skoczyłem z dachu, aby zaimponować moim przyjaciołom i złamałem nogę."
